[{"EventSourceName":"Microsoft-Windows-Security-Auditing","Provider":"Microsoft-Windows-Security-Auditing","ProviderGuid":"{54849625-5478-4994-a5ba-3e3b0328c30d}","Level":"0","Keywords":"0x8020000000000000","Channel":"Security","Computer":"FlareVM","TimeCreated":"2023-03-02T11:37:52.679Z","TimeGenerated":"2023-03-02T04:37:52.679Z","EventRecordID":"287844","EventID":4688,"Message":"A new process has been created.\r\n\r\nCreator Subject:\r\n\tSecurity ID:\t\tS-1-5-18\r\n\tAccount Name:\t\tFLAREVM$\r\n\tAccount Domain:\t\tWORKGROUP\r\n\tLogon ID:\t\t0x3E7\r\n\r\nTarget Subject:\r\n\tSecurity ID:\t\tS-1-5-21-2199682790-2533951109-4136935257-1001\r\n\tAccount Name:\t\tmalware\r\n\tAccount Domain:\t\tFLAREVM\r\n\tLogon ID:\t\t0xDFDD5\r\n\r\nProcess Information:\r\n\tNew Process ID:\t\t0x2220\r\n\tNew Process Name:\tC:\\Windows\\SysWOW64\\dllhost.exe\r\n\tToken Elevation Type:\t%%1938\r\n\tMandatory Label:\t\tS-1-16-8192\r\n\tCreator Process ID:\t0x364\r\n\tCreator Process Name:\tC:\\Windows\\System32\\svchost.exe\r\n\tProcess Command Line:\t\r\n\r\nToken Elevation Type indicates the type of token that was assigned to the new process in accordance with User Account Control policy.\r\n\r\nType 1 is a full token with no privileges removed or groups disabled.  A full token is only used if User Account Control is disabled or if the user is the built-in Administrator account or a service account.\r\n\r\nType 2 is an elevated token with no privileges removed or groups disabled.  An elevated token is used when User Account Control is enabled and the user chooses to start the program using Run as administrator.  An elevated token is also used when an application is configured to always require administrative privilege or to always require maximum privilege, and the user is a member of the Administrators group.\r\n\r\nType 3 is a limited token with administrative privileges removed and administrative groups disabled.  The limited token is used when User Account Control is enabled, the application does not require administrative privilege, and the user does not choose to start the program using Run as administrator.","EventData":"\u003cEventData xmlns=\"http://schemas.microsoft.com/win/2004/08/events/event\"\u003e\u003cData Name=\"SubjectUserSid\"\u003eS-1-5-18\u003c/Data\u003e\u003cData Name=\"SubjectUserName\"\u003eFLAREVM$\u003c/Data\u003e\u003cData Name=\"SubjectDomainName\"\u003eWORKGROUP\u003c/Data\u003e\u003cData Name=\"SubjectLogonId\"\u003e0x3e7\u003c/Data\u003e\u003cData Name=\"NewProcessId\"\u003e0x2220\u003c/Data\u003e\u003cData Name=\"NewProcessName\"\u003eC:\\Windows\\SysWOW64\\dllhost.exe\u003c/Data\u003e\u003cData Name=\"TokenElevationType\"\u003e%%1938\u003c/Data\u003e\u003cData Name=\"ProcessId\"\u003e0x364\u003c/Data\u003e\u003cData Name=\"CommandLine\"\u003e\u003c/Data\u003e\u003cData Name=\"TargetUserSid\"\u003eS-1-5-21-2199682790-2533951109-4136935257-1001\u003c/Data\u003e\u003cData Name=\"TargetUserName\"\u003emalware\u003c/Data\u003e\u003cData Name=\"TargetDomainName\"\u003eFLAREVM\u003c/Data\u003e\u003cData Name=\"TargetLogonId\"\u003e0xdfdd5\u003c/Data\u003e\u003cData Name=\"ParentProcessName\"\u003eC:\\Windows\\System32\\svchost.exe\u003c/Data\u003e\u003cData Name=\"MandatoryLabel\"\u003eS-1-16-8192\u003c/Data\u003e\u003c/EventData\u003e","Task":13312,"SubjectUserSid":"S-1-5-18","SubjectUserName":"FLAREVM$","SubjectDomainName":"WORKGROUP","SubjectLogonId":"0x3e7","NewProcessId":"0x2220","NewProcessName":"C:\\Windows\\SysWOW64\\dllhost.exe","TokenElevationType":"%%1938","ProcessId":"0x364","CommandLine":"","TargetUserSid":"S-1-5-21-2199682790-2533951109-4136935257-1001","TargetUserName":"malware","TargetDomainName":"FLAREVM","TargetLogonId":"0xdfdd5","ParentProcessName":"C:\\Windows\\System32\\svchost.exe","MandatoryLabel":"S-1-16-8192"},{"EventSourceName":"Microsoft-Windows-Security-Auditing","Provider":"Microsoft-Windows-Security-Auditing","ProviderGuid":"{54849625-5478-4994-a5ba-3e3b0328c30d}","Level":"0","Keywords":"0x8020000000000000","Channel":"Security","Computer":"FlareVM","TimeCreated":"2023-03-02T11:37:56.434Z","TimeGenerated":"2023-03-02T04:37:56.434Z","EventRecordID":"287845","EventID":4688,"Message":"A new process has been created.\r\n\r\nCreator Subject:\r\n\tSecurity ID:\t\tS-1-5-21-2199682790-2533951109-4136935257-1001\r\n\tAccount Name:\t\tmalware\r\n\tAccount Domain:\t\tFLAREVM\r\n\tLogon ID:\t\t0xDFDD5\r\n\r\nTarget Subject:\r\n\tSecurity ID:\t\tS-1-0-0\r\n\tAccount Name:\t\t-\r\n\tAccount Domain:\t\t-\r\n\tLogon ID:\t\t0x0\r\n\r\nProcess Information:\r\n\tNew Process ID:\t\t0xc08\r\n\tNew Process Name:\tC:\\Program Files\\7-Zip\\7zG.exe\r\n\tToken Elevation Type:\t%%1938\r\n\tMandatory Label:\t\tS-1-16-8192\r\n\tCreator Process ID:\t0x196c\r\n\tCreator Process Name:\tC:\\Windows\\explorer.exe\r\n\tProcess Command Line:\t\r\n\r\nToken Elevation Type indicates the type of token that was assigned to the new process in accordance with User Account Control policy.\r\n\r\nType 1 is a full token with no privileges removed or groups disabled.  A full token is only used if User Account Control is disabled or if the user is the built-in Administrator account or a service account.\r\n\r\nType 2 is an elevated token with no privileges removed or groups disabled.  An elevated token is used when User Account Control is enabled and the user chooses to start the program using Run as administrator.  An elevated token is also used when an application is configured to always require administrative privilege or to always require maximum privilege, and the user is a member of the Administrators group.\r\n\r\nType 3 is a limited token with administrative privileges removed and administrative groups disabled.  The limited token is used when User Account Control is enabled, the application does not require administrative privilege, and the user does not choose to start the program using Run as administrator.","EventData":"\u003cEventData xmlns=\"http://schemas.microsoft.com/win/2004/08/events/event\"\u003e\u003cData Name=\"SubjectUserSid\"\u003eS-1-5-21-2199682790-2533951109-4136935257-1001\u003c/Data\u003e\u003cData Name=\"SubjectUserName\"\u003emalware\u003c/Data\u003e\u003cData Name=\"SubjectDomainName\"\u003eFLAREVM\u003c/Data\u003e\u003cData Name=\"SubjectLogonId\"\u003e0xdfdd5\u003c/Data\u003e\u003cData Name=\"NewProcessId\"\u003e0xc08\u003c/Data\u003e\u003cData Name=\"NewProcessName\"\u003eC:\\Program Files\\7-Zip\\7zG.exe\u003c/Data\u003e\u003cData Name=\"TokenElevationType\"\u003e%%1938\u003c/Data\u003e\u003cData Name=\"ProcessId\"\u003e0x196c\u003c/Data\u003e\u003cData Name=\"CommandLine\"\u003e\u003c/Data\u003e\u003cData Name=\"TargetUserSid\"\u003eS-1-0-0\u003c/Data\u003e\u003cData Name=\"TargetUserName\"\u003e-\u003c/Data\u003e\u003cData Name=\"TargetDomainName\"\u003e-\u003c/Data\u003e\u003cData Name=\"TargetLogonId\"\u003e0x0\u003c/Data\u003e\u003cData Name=\"ParentProcessName\"\u003eC:\\Windows\\explorer.exe\u003c/Data\u003e\u003cData Name=\"MandatoryLabel\"\u003eS-1-16-8192\u003c/Data\u003e\u003c/EventData\u003e","Task":13312,"SubjectUserSid":"S-1-5-21-2199682790-2533951109-4136935257-1001","SubjectUserName":"malware","SubjectDomainName":"FLAREVM","SubjectLogonId":"0xdfdd5","NewProcessId":"0xc08","NewProcessName":"C:\\Program Files\\7-Zip\\7zG.exe","TokenElevationType":"%%1938","ProcessId":"0x196c","CommandLine":"","TargetUserSid":"S-1-0-0","TargetUserName":"-","TargetDomainName":"-","TargetLogonId":"0x0","ParentProcessName":"C:\\Windows\\explorer.exe","MandatoryLabel":"S-1-16-8192"},{"EventSourceName":"Microsoft-Windows-Security-Auditing","Provider":"Microsoft-Windows-Security-Auditing","ProviderGuid":"{54849625-5478-4994-a5ba-3e3b0328c30d}","Level":"0","Keywords":"0x8020000000000000","Channel":"Security","Computer":"FlareVM","TimeCreated":"2023-03-02T11:38:06.328Z","TimeGenerated":"2023-03-02T04:38:06.328Z","EventRecordID":"287846","EventID":4688,"Message":"A new process has been created.\r\n\r\nCreator Subject:\r\n\tSecurity ID:\t\tS-1-5-21-2199682790-2533951109-4136935257-1001\r\n\tAccount Name:\t\tmalware\r\n\tAccount Domain:\t\tFLAREVM\r\n\tLogon ID:\t\t0xDFDD5\r\n\r\nTarget Subject:\r\n\tSecurity ID:\t\tS-1-0-0\r\n\tAccount Name:\t\t-\r\n\tAccount Domain:\t\t-\r\n\tLogon ID:\t\t0x0\r\n\r\nProcess Information:\r\n\tNew Process ID:\t\t0x16d4\r\n\tNew Process Name:\tC:\\Windows\\SysWOW64\\mshta.exe\r\n\tToken Elevation Type:\t%%1938\r\n\tMandatory Label:\t\tS-1-16-8192\r\n\tCreator Process ID:\t0x196c\r\n\tCreator Process Name:\tC:\\Windows\\explorer.exe\r\n\tProcess Command Line:\t\r\n\r\nToken Elevation Type indicates the type of token that was assigned to the new process in accordance with User Account Control policy.\r\n\r\nType 1 is a full token with no privileges removed or groups disabled.  A full token is only used if User Account Control is disabled or if the user is the built-in Administrator account or a service account.\r\n\r\nType 2 is an elevated token with no privileges removed or groups disabled.  An elevated token is used when User Account Control is enabled and the user chooses to start the program using Run as administrator.  An elevated token is also used when an application is configured to always require administrative privilege or to always require maximum privilege, and the user is a member of the Administrators group.\r\n\r\nType 3 is a limited token with administrative privileges removed and administrative groups disabled.  The limited token is used when User Account Control is enabled, the application does not require administrative privilege, and the user does not choose to start the program using Run as administrator.","EventData":"\u003cEventData xmlns=\"http://schemas.microsoft.com/win/2004/08/events/event\"\u003e\u003cData Name=\"SubjectUserSid\"\u003eS-1-5-21-2199682790-2533951109-4136935257-1001\u003c/Data\u003e\u003cData Name=\"SubjectUserName\"\u003emalware\u003c/Data\u003e\u003cData Name=\"SubjectDomainName\"\u003eFLAREVM\u003c/Data\u003e\u003cData Name=\"SubjectLogonId\"\u003e0xdfdd5\u003c/Data\u003e\u003cData Name=\"NewProcessId\"\u003e0x16d4\u003c/Data\u003e\u003cData Name=\"NewProcessName\"\u003eC:\\Windows\\SysWOW64\\mshta.exe\u003c/Data\u003e\u003cData Name=\"TokenElevationType\"\u003e%%1938\u003c/Data\u003e\u003cData Name=\"ProcessId\"\u003e0x196c\u003c/Data\u003e\u003cData Name=\"CommandLine\"\u003e\u003c/Data\u003e\u003cData Name=\"TargetUserSid\"\u003eS-1-0-0\u003c/Data\u003e\u003cData Name=\"TargetUserName\"\u003e-\u003c/Data\u003e\u003cData Name=\"TargetDomainName\"\u003e-\u003c/Data\u003e\u003cData Name=\"TargetLogonId\"\u003e0x0\u003c/Data\u003e\u003cData Name=\"ParentProcessName\"\u003eC:\\Windows\\explorer.exe\u003c/Data\u003e\u003cData Name=\"MandatoryLabel\"\u003eS-1-16-8192\u003c/Data\u003e\u003c/EventData\u003e","Task":13312,"SubjectUserSid":"S-1-5-21-2199682790-2533951109-4136935257-1001","SubjectUserName":"malware","SubjectDomainName":"FLAREVM","SubjectLogonId":"0xdfdd5","NewProcessId":"0x16d4","NewProcessName":"C:\\Windows\\SysWOW64\\mshta.exe","TokenElevationType":"%%1938","ProcessId":"0x196c","CommandLine":"","TargetUserSid":"S-1-0-0","TargetUserName":"-","TargetDomainName":"-","TargetLogonId":"0x0","ParentProcessName":"C:\\Windows\\explorer.exe","MandatoryLabel":"S-1-16-8192"},{"EventSourceName":"Microsoft-Windows-Security-Auditing","Provider":"Microsoft-Windows-Security-Auditing","ProviderGuid":"{54849625-5478-4994-a5ba-3e3b0328c30d}","Level":"0","Keywords":"0x8020000000000000","Channel":"Security","Computer":"FlareVM","TimeCreated":"2023-03-02T11:38:06.696Z","TimeGenerated":"2023-03-02T04:38:06.696Z","EventRecordID":"287847","EventID":4688,"Message":"A new process has been created.\r\n\r\nCreator Subject:\r\n\tSecurity ID:\t\tS-1-5-21-2199682790-2533951109-4136935257-1001\r\n\tAccount Name:\t\tmalware\r\n\tAccount Domain:\t\tFLAREVM\r\n\tLogon ID:\t\t0xDFDD5\r\n\r\nTarget Subject:\r\n\tSecurity ID:\t\tS-1-0-0\r\n\tAccount Name:\t\t-\r\n\tAccount Domain:\t\t-\r\n\tLogon ID:\t\t0x0\r\n\r\nProcess Information:\r\n\tNew Process ID:\t\t0x2470\r\n\tNew Process Name:\tC:\\Windows\\SysWOW64\\cmd.exe\r\n\tToken Elevation Type:\t%%1938\r\n\tMandatory Label:\t\tS-1-16-8192\r\n\tCreator Process ID:\t0x16d4\r\n\tCreator Process Name:\tC:\\Windows\\SysWOW64\\mshta.exe\r\n\tProcess Command Line:\t\r\n\r\nToken Elevation Type indicates the type of token that was assigned to the new process in accordance with User Account Control policy.\r\n\r\nType 1 is a full token with no privileges removed or groups disabled.  A full token is only used if User Account Control is disabled or if the user is the built-in Administrator account or a service account.\r\n\r\nType 2 is an elevated token with no privileges removed or groups disabled.  An elevated token is used when User Account Control is enabled and the user chooses to start the program using Run as administrator.  An elevated token is also used when an application is configured to always require administrative privilege or to always require maximum privilege, and the user is a member of the Administrators group.\r\n\r\nType 3 is a limited token with administrative privileges removed and administrative groups disabled.  The limited token is used when User Account Control is enabled, the application does not require administrative privilege, and the user does not choose to start the program using Run as administrator.","EventData":"\u003cEventData xmlns=\"http://schemas.microsoft.com/win/2004/08/events/event\"\u003e\u003cData Name=\"SubjectUserSid\"\u003eS-1-5-21-2199682790-2533951109-4136935257-1001\u003c/Data\u003e\u003cData Name=\"SubjectUserName\"\u003emalware\u003c/Data\u003e\u003cData Name=\"SubjectDomainName\"\u003eFLAREVM\u003c/Data\u003e\u003cData Name=\"SubjectLogonId\"\u003e0xdfdd5\u003c/Data\u003e\u003cData Name=\"NewProcessId\"\u003e0x2470\u003c/Data\u003e\u003cData Name=\"NewProcessName\"\u003eC:\\Windows\\SysWOW64\\cmd.exe\u003c/Data\u003e\u003cData Name=\"TokenElevationType\"\u003e%%1938\u003c/Data\u003e\u003cData Name=\"ProcessId\"\u003e0x16d4\u003c/Data\u003e\u003cData Name=\"CommandLine\"\u003e\u003c/Data\u003e\u003cData Name=\"TargetUserSid\"\u003eS-1-0-0\u003c/Data\u003e\u003cData Name=\"TargetUserName\"\u003e-\u003c/Data\u003e\u003cData Name=\"TargetDomainName\"\u003e-\u003c/Data\u003e\u003cData Name=\"TargetLogonId\"\u003e0x0\u003c/Data\u003e\u003cData Name=\"ParentProcessName\"\u003eC:\\Windows\\SysWOW64\\mshta.exe\u003c/Data\u003e\u003cData Name=\"MandatoryLabel\"\u003eS-1-16-8192\u003c/Data\u003e\u003c/EventData\u003e","Task":13312,"SubjectUserSid":"S-1-5-21-2199682790-2533951109-4136935257-1001","SubjectUserName":"malware","SubjectDomainName":"FLAREVM","SubjectLogonId":"0xdfdd5","NewProcessId":"0x2470","NewProcessName":"C:\\Windows\\SysWOW64\\cmd.exe","TokenElevationType":"%%1938","ProcessId":"0x16d4","CommandLine":"","TargetUserSid":"S-1-0-0","TargetUserName":"-","TargetDomainName":"-","TargetLogonId":"0x0","ParentProcessName":"C:\\Windows\\SysWOW64\\mshta.exe","MandatoryLabel":"S-1-16-8192"},{"EventSourceName":"Microsoft-Windows-Security-Auditing","Provider":"Microsoft-Windows-Security-Auditing","ProviderGuid":"{54849625-5478-4994-a5ba-3e3b0328c30d}","Level":"0","Keywords":"0x8020000000000000","Channel":"Security","Computer":"FlareVM","TimeCreated":"2023-03-02T11:38:06.712Z","TimeGenerated":"2023-03-02T04:38:06.712Z","EventRecordID":"287848","EventID":4688,"Message":"A new process has been created.\r\n\r\nCreator Subject:\r\n\tSecurity ID:\t\tS-1-5-21-2199682790-2533951109-4136935257-1001\r\n\tAccount Name:\t\tmalware\r\n\tAccount Domain:\t\tFLAREVM\r\n\tLogon ID:\t\t0xDFDD5\r\n\r\nTarget Subject:\r\n\tSecurity ID:\t\tS-1-0-0\r\n\tAccount Name:\t\t-\r\n\tAccount Domain:\t\t-\r\n\tLogon ID:\t\t0x0\r\n\r\nProcess Information:\r\n\tNew Process ID:\t\t0xa58\r\n\tNew Process Name:\tC:\\Windows\\System32\\conhost.exe\r\n\tToken Elevation Type:\t%%1938\r\n\tMandatory Label:\t\tS-1-16-8192\r\n\tCreator Process ID:\t0x2470\r\n\tCreator Process Name:\tC:\\Windows\\SysWOW64\\cmd.exe\r\n\tProcess Command Line:\t\r\n\r\nToken Elevation Type indicates the type of token that was assigned to the new process in accordance with User Account Control policy.\r\n\r\nType 1 is a full token with no privileges removed or groups disabled.  A full token is only used if User Account Control is disabled or if the user is the built-in Administrator account or a service account.\r\n\r\nType 2 is an elevated token with no privileges removed or groups disabled.  An elevated token is used when User Account Control is enabled and the user chooses to start the program using Run as administrator.  An elevated token is also used when an application is configured to always require administrative privilege or to always require maximum privilege, and the user is a member of the Administrators group.\r\n\r\nType 3 is a limited token with administrative privileges removed and administrative groups disabled.  The limited token is used when User Account Control is enabled, the application does not require administrative privilege, and the user does not choose to start the program using Run as administrator.","EventData":"\u003cEventData xmlns=\"http://schemas.microsoft.com/win/2004/08/events/event\"\u003e\u003cData Name=\"SubjectUserSid\"\u003eS-1-5-21-2199682790-2533951109-4136935257-1001\u003c/Data\u003e\u003cData Name=\"SubjectUserName\"\u003emalware\u003c/Data\u003e\u003cData Name=\"SubjectDomainName\"\u003eFLAREVM\u003c/Data\u003e\u003cData Name=\"SubjectLogonId\"\u003e0xdfdd5\u003c/Data\u003e\u003cData Name=\"NewProcessId\"\u003e0xa58\u003c/Data\u003e\u003cData Name=\"NewProcessName\"\u003eC:\\Windows\\System32\\conhost.exe\u003c/Data\u003e\u003cData Name=\"TokenElevationType\"\u003e%%1938\u003c/Data\u003e\u003cData Name=\"ProcessId\"\u003e0x2470\u003c/Data\u003e\u003cData Name=\"CommandLine\"\u003e\u003c/Data\u003e\u003cData Name=\"TargetUserSid\"\u003eS-1-0-0\u003c/Data\u003e\u003cData Name=\"TargetUserName\"\u003e-\u003c/Data\u003e\u003cData Name=\"TargetDomainName\"\u003e-\u003c/Data\u003e\u003cData Name=\"TargetLogonId\"\u003e0x0\u003c/Data\u003e\u003cData Name=\"ParentProcessName\"\u003eC:\\Windows\\SysWOW64\\cmd.exe\u003c/Data\u003e\u003cData Name=\"MandatoryLabel\"\u003eS-1-16-8192\u003c/Data\u003e\u003c/EventData\u003e","Task":13312,"SubjectUserSid":"S-1-5-21-2199682790-2533951109-4136935257-1001","SubjectUserName":"malware","SubjectDomainName":"FLAREVM","SubjectLogonId":"0xdfdd5","NewProcessId":"0xa58","NewProcessName":"C:\\Windows\\System32\\conhost.exe","TokenElevationType":"%%1938","ProcessId":"0x2470","CommandLine":"","TargetUserSid":"S-1-0-0","TargetUserName":"-","TargetDomainName":"-","TargetLogonId":"0x0","ParentProcessName":"C:\\Windows\\SysWOW64\\cmd.exe","MandatoryLabel":"S-1-16-8192"},{"EventSourceName":"Microsoft-Windows-Security-Auditing","Provider":"Microsoft-Windows-Security-Auditing","ProviderGuid":"{54849625-5478-4994-a5ba-3e3b0328c30d}","Level":"0","Keywords":"0x8020000000000000","Channel":"Security","Computer":"FlareVM","TimeCreated":"2023-03-02T11:38:06.826Z","TimeGenerated":"2023-03-02T04:38:06.826Z","EventRecordID":"287849","EventID":4688,"Message":"A new process has been created.\r\n\r\nCreator Subject:\r\n\tSecurity ID:\t\tS-1-5-21-2199682790-2533951109-4136935257-1001\r\n\tAccount Name:\t\tmalware\r\n\tAccount Domain:\t\tFLAREVM\r\n\tLogon ID:\t\t0xDFDD5\r\n\r\nTarget Subject:\r\n\tSecurity ID:\t\tS-1-0-0\r\n\tAccount Name:\t\t-\r\n\tAccount Domain:\t\t-\r\n\tLogon ID:\t\t0x0\r\n\r\nProcess Information:\r\n\tNew Process ID:\t\t0x710\r\n\tNew Process Name:\tC:\\Windows\\SysWOW64\\curl.exe\r\n\tToken Elevation Type:\t%%1938\r\n\tMandatory Label:\t\tS-1-16-8192\r\n\tCreator Process ID:\t0x2470\r\n\tCreator Process Name:\tC:\\Windows\\SysWOW64\\cmd.exe\r\n\tProcess Command Line:\t\r\n\r\nToken Elevation Type indicates the type of token that was assigned to the new process in accordance with User Account Control policy.\r\n\r\nType 1 is a full token with no privileges removed or groups disabled.  A full token is only used if User Account Control is disabled or if the user is the built-in Administrator account or a service account.\r\n\r\nType 2 is an elevated token with no privileges removed or groups disabled.  An elevated token is used when User Account Control is enabled and the user chooses to start the program using Run as administrator.  An elevated token is also used when an application is configured to always require administrative privilege or to always require maximum privilege, and the user is a member of the Administrators group.\r\n\r\nType 3 is a limited token with administrative privileges removed and administrative groups disabled.  The limited token is used when User Account Control is enabled, the application does not require administrative privilege, and the user does not choose to start the program using Run as administrator.","EventData":"\u003cEventData xmlns=\"http://schemas.microsoft.com/win/2004/08/events/event\"\u003e\u003cData Name=\"SubjectUserSid\"\u003eS-1-5-21-2199682790-2533951109-4136935257-1001\u003c/Data\u003e\u003cData Name=\"SubjectUserName\"\u003emalware\u003c/Data\u003e\u003cData Name=\"SubjectDomainName\"\u003eFLAREVM\u003c/Data\u003e\u003cData Name=\"SubjectLogonId\"\u003e0xdfdd5\u003c/Data\u003e\u003cData Name=\"NewProcessId\"\u003e0x710\u003c/Data\u003e\u003cData Name=\"NewProcessName\"\u003eC:\\Windows\\SysWOW64\\curl.exe\u003c/Data\u003e\u003cData Name=\"TokenElevationType\"\u003e%%1938\u003c/Data\u003e\u003cData Name=\"ProcessId\"\u003e0x2470\u003c/Data\u003e\u003cData Name=\"CommandLine\"\u003e\u003c/Data\u003e\u003cData Name=\"TargetUserSid\"\u003eS-1-0-0\u003c/Data\u003e\u003cData Name=\"TargetUserName\"\u003e-\u003c/Data\u003e\u003cData Name=\"TargetDomainName\"\u003e-\u003c/Data\u003e\u003cData Name=\"TargetLogonId\"\u003e0x0\u003c/Data\u003e\u003cData Name=\"ParentProcessName\"\u003eC:\\Windows\\SysWOW64\\cmd.exe\u003c/Data\u003e\u003cData Name=\"MandatoryLabel\"\u003eS-1-16-8192\u003c/Data\u003e\u003c/EventData\u003e","Task":13312,"SubjectUserSid":"S-1-5-21-2199682790-2533951109-4136935257-1001","SubjectUserName":"malware","SubjectDomainName":"FLAREVM","SubjectLogonId":"0xdfdd5","NewProcessId":"0x710","NewProcessName":"C:\\Windows\\SysWOW64\\curl.exe","TokenElevationType":"%%1938","ProcessId":"0x2470","CommandLine":"","TargetUserSid":"S-1-0-0","TargetUserName":"-","TargetDomainName":"-","TargetLogonId":"0x0","ParentProcessName":"C:\\Windows\\SysWOW64\\cmd.exe","MandatoryLabel":"S-1-16-8192"},{"EventSourceName":"Microsoft-Windows-Security-Auditing","Provider":"Microsoft-Windows-Security-Auditing","ProviderGuid":"{54849625-5478-4994-a5ba-3e3b0328c30d}","Level":"0","Keywords":"0x8020000000000000","Channel":"Security","Computer":"FlareVM","TimeCreated":"2023-03-02T11:38:06.981Z","TimeGenerated":"2023-03-02T04:38:06.981Z","EventRecordID":"287850","EventID":4688,"Message":"A new process has been created.\r\n\r\nCreator Subject:\r\n\tSecurity ID:\t\tS-1-5-21-2199682790-2533951109-4136935257-1001\r\n\tAccount Name:\t\tmalware\r\n\tAccount Domain:\t\tFLAREVM\r\n\tLogon ID:\t\t0xDFDD5\r\n\r\nTarget Subject:\r\n\tSecurity ID:\t\tS-1-0-0\r\n\tAccount Name:\t\t-\r\n\tAccount Domain:\t\t-\r\n\tLogon ID:\t\t0x0\r\n\r\nProcess Information:\r\n\tNew Process ID:\t\t0x1fac\r\n\tNew Process Name:\tC:\\Windows\\SysWOW64\\rundll32.exe\r\n\tToken Elevation Type:\t%%1938\r\n\tMandatory Label:\t\tS-1-16-8192\r\n\tCreator Process ID:\t0x2470\r\n\tCreator Process Name:\tC:\\Windows\\SysWOW64\\cmd.exe\r\n\tProcess Command Line:\t\r\n\r\nToken Elevation Type indicates the type of token that was assigned to the new process in accordance with User Account Control policy.\r\n\r\nType 1 is a full token with no privileges removed or groups disabled.  A full token is only used if User Account Control is disabled or if the user is the built-in Administrator account or a service account.\r\n\r\nType 2 is an elevated token with no privileges removed or groups disabled.  An elevated token is used when User Account Control is enabled and the user chooses to start the program using Run as administrator.  An elevated token is also used when an application is configured to always require administrative privilege or to always require maximum privilege, and the user is a member of the Administrators group.\r\n\r\nType 3 is a limited token with administrative privileges removed and administrative groups disabled.  The limited token is used when User Account Control is enabled, the application does not require administrative privilege, and the user does not choose to start the program using Run as administrator.","EventData":"\u003cEventData xmlns=\"http://schemas.microsoft.com/win/2004/08/events/event\"\u003e\u003cData Name=\"SubjectUserSid\"\u003eS-1-5-21-2199682790-2533951109-4136935257-1001\u003c/Data\u003e\u003cData Name=\"SubjectUserName\"\u003emalware\u003c/Data\u003e\u003cData Name=\"SubjectDomainName\"\u003eFLAREVM\u003c/Data\u003e\u003cData Name=\"SubjectLogonId\"\u003e0xdfdd5\u003c/Data\u003e\u003cData Name=\"NewProcessId\"\u003e0x1fac\u003c/Data\u003e\u003cData Name=\"NewProcessName\"\u003eC:\\Windows\\SysWOW64\\rundll32.exe\u003c/Data\u003e\u003cData Name=\"TokenElevationType\"\u003e%%1938\u003c/Data\u003e\u003cData Name=\"ProcessId\"\u003e0x2470\u003c/Data\u003e\u003cData Name=\"CommandLine\"\u003e\u003c/Data\u003e\u003cData Name=\"TargetUserSid\"\u003eS-1-0-0\u003c/Data\u003e\u003cData Name=\"TargetUserName\"\u003e-\u003c/Data\u003e\u003cData Name=\"TargetDomainName\"\u003e-\u003c/Data\u003e\u003cData Name=\"TargetLogonId\"\u003e0x0\u003c/Data\u003e\u003cData Name=\"ParentProcessName\"\u003eC:\\Windows\\SysWOW64\\cmd.exe\u003c/Data\u003e\u003cData Name=\"MandatoryLabel\"\u003eS-1-16-8192\u003c/Data\u003e\u003c/EventData\u003e","Task":13312,"SubjectUserSid":"S-1-5-21-2199682790-2533951109-4136935257-1001","SubjectUserName":"malware","SubjectDomainName":"FLAREVM","SubjectLogonId":"0xdfdd5","NewProcessId":"0x1fac","NewProcessName":"C:\\Windows\\SysWOW64\\rundll32.exe","TokenElevationType":"%%1938","ProcessId":"0x2470","CommandLine":"","TargetUserSid":"S-1-0-0","TargetUserName":"-","TargetDomainName":"-","TargetLogonId":"0x0","ParentProcessName":"C:\\Windows\\SysWOW64\\cmd.exe","MandatoryLabel":"S-1-16-8192"},{"EventSourceName":"Microsoft-Windows-Security-Auditing","Provider":"Microsoft-Windows-Security-Auditing","ProviderGuid":"{54849625-5478-4994-a5ba-3e3b0328c30d}","Level":"0","Keywords":"0x8020000000000000","Channel":"Security","Computer":"FlareVM","TimeCreated":"2023-03-02T11:38:21.110Z","TimeGenerated":"2023-03-02T04:38:21.110Z","EventRecordID":"287851","EventID":4688,"Message":"A new process has been created.\r\n\r\nCreator Subject:\r\n\tSecurity ID:\t\tS-1-5-21-2199682790-2533951109-4136935257-1001\r\n\tAccount Name:\t\tmalware\r\n\tAccount Domain:\t\tFLAREVM\r\n\tLogon ID:\t\t0xDFDD5\r\n\r\nTarget Subject:\r\n\tSecurity ID:\t\tS-1-0-0\r\n\tAccount Name:\t\t-\r\n\tAccount Domain:\t\t-\r\n\tLogon ID:\t\t0x0\r\n\r\nProcess Information:\r\n\tNew Process ID:\t\t0x1cd0\r\n\tNew Process Name:\tC:\\Windows\\SysWOW64\\mshta.exe\r\n\tToken Elevation Type:\t%%1938\r\n\tMandatory Label:\t\tS-1-16-8192\r\n\tCreator Process ID:\t0x196c\r\n\tCreator Process Name:\tC:\\Windows\\explorer.exe\r\n\tProcess Command Line:\t\r\n\r\nToken Elevation Type indicates the type of token that was assigned to the new process in accordance with User Account Control policy.\r\n\r\nType 1 is a full token with no privileges removed or groups disabled.  A full token is only used if User Account Control is disabled or if the user is the built-in Administrator account or a service account.\r\n\r\nType 2 is an elevated token with no privileges removed or groups disabled.  An elevated token is used when User Account Control is enabled and the user chooses to start the program using Run as administrator.  An elevated token is also used when an application is configured to always require administrative privilege or to always require maximum privilege, and the user is a member of the Administrators group.\r\n\r\nType 3 is a limited token with administrative privileges removed and administrative groups disabled.  The limited token is used when User Account Control is enabled, the application does not require administrative privilege, and the user does not choose to start the program using Run as administrator.","EventData":"\u003cEventData xmlns=\"http://schemas.microsoft.com/win/2004/08/events/event\"\u003e\u003cData Name=\"SubjectUserSid\"\u003eS-1-5-21-2199682790-2533951109-4136935257-1001\u003c/Data\u003e\u003cData Name=\"SubjectUserName\"\u003emalware\u003c/Data\u003e\u003cData Name=\"SubjectDomainName\"\u003eFLAREVM\u003c/Data\u003e\u003cData Name=\"SubjectLogonId\"\u003e0xdfdd5\u003c/Data\u003e\u003cData Name=\"NewProcessId\"\u003e0x1cd0\u003c/Data\u003e\u003cData Name=\"NewProcessName\"\u003eC:\\Windows\\SysWOW64\\mshta.exe\u003c/Data\u003e\u003cData Name=\"TokenElevationType\"\u003e%%1938\u003c/Data\u003e\u003cData Name=\"ProcessId\"\u003e0x196c\u003c/Data\u003e\u003cData Name=\"CommandLine\"\u003e\u003c/Data\u003e\u003cData Name=\"TargetUserSid\"\u003eS-1-0-0\u003c/Data\u003e\u003cData Name=\"TargetUserName\"\u003e-\u003c/Data\u003e\u003cData Name=\"TargetDomainName\"\u003e-\u003c/Data\u003e\u003cData Name=\"TargetLogonId\"\u003e0x0\u003c/Data\u003e\u003cData Name=\"ParentProcessName\"\u003eC:\\Windows\\explorer.exe\u003c/Data\u003e\u003cData Name=\"MandatoryLabel\"\u003eS-1-16-8192\u003c/Data\u003e\u003c/EventData\u003e","Task":13312,"SubjectUserSid":"S-1-5-21-2199682790-2533951109-4136935257-1001","SubjectUserName":"malware","SubjectDomainName":"FLAREVM","SubjectLogonId":"0xdfdd5","NewProcessId":"0x1cd0","NewProcessName":"C:\\Windows\\SysWOW64\\mshta.exe","TokenElevationType":"%%1938","ProcessId":"0x196c","CommandLine":"","TargetUserSid":"S-1-0-0","TargetUserName":"-","TargetDomainName":"-","TargetLogonId":"0x0","ParentProcessName":"C:\\Windows\\explorer.exe","MandatoryLabel":"S-1-16-8192"},{"EventSourceName":"Microsoft-Windows-Security-Auditing","Provider":"Microsoft-Windows-Security-Auditing","ProviderGuid":"{54849625-5478-4994-a5ba-3e3b0328c30d}","Level":"0","Keywords":"0x8020000000000000","Channel":"Security","Computer":"FlareVM","TimeCreated":"2023-03-02T11:38:21.259Z","TimeGenerated":"2023-03-02T04:38:21.259Z","EventRecordID":"287852","EventID":4688,"Message":"A new process has been created.\r\n\r\nCreator Subject:\r\n\tSecurity ID:\t\tS-1-5-21-2199682790-2533951109-4136935257-1001\r\n\tAccount Name:\t\tmalware\r\n\tAccount Domain:\t\tFLAREVM\r\n\tLogon ID:\t\t0xDFDD5\r\n\r\nTarget Subject:\r\n\tSecurity ID:\t\tS-1-0-0\r\n\tAccount Name:\t\t-\r\n\tAccount Domain:\t\t-\r\n\tLogon ID:\t\t0x0\r\n\r\nProcess Information:\r\n\tNew Process ID:\t\t0x1214\r\n\tNew Process Name:\tC:\\Windows\\SysWOW64\\cmd.exe\r\n\tToken Elevation Type:\t%%1938\r\n\tMandatory Label:\t\tS-1-16-8192\r\n\tCreator Process ID:\t0x1cd0\r\n\tCreator Process Name:\tC:\\Windows\\SysWOW64\\mshta.exe\r\n\tProcess Command Line:\t\r\n\r\nToken Elevation Type indicates the type of token that was assigned to the new process in accordance with User Account Control policy.\r\n\r\nType 1 is a full token with no privileges removed or groups disabled.  A full token is only used if User Account Control is disabled or if the user is the built-in Administrator account or a service account.\r\n\r\nType 2 is an elevated token with no privileges removed or groups disabled.  An elevated token is used when User Account Control is enabled and the user chooses to start the program using Run as administrator.  An elevated token is also used when an application is configured to always require administrative privilege or to always require maximum privilege, and the user is a member of the Administrators group.\r\n\r\nType 3 is a limited token with administrative privileges removed and administrative groups disabled.  The limited token is used when User Account Control is enabled, the application does not require administrative privilege, and the user does not choose to start the program using Run as administrator.","EventData":"\u003cEventData xmlns=\"http://schemas.microsoft.com/win/2004/08/events/event\"\u003e\u003cData Name=\"SubjectUserSid\"\u003eS-1-5-21-2199682790-2533951109-4136935257-1001\u003c/Data\u003e\u003cData Name=\"SubjectUserName\"\u003emalware\u003c/Data\u003e\u003cData Name=\"SubjectDomainName\"\u003eFLAREVM\u003c/Data\u003e\u003cData Name=\"SubjectLogonId\"\u003e0xdfdd5\u003c/Data\u003e\u003cData Name=\"NewProcessId\"\u003e0x1214\u003c/Data\u003e\u003cData Name=\"NewProcessName\"\u003eC:\\Windows\\SysWOW64\\cmd.exe\u003c/Data\u003e\u003cData Name=\"TokenElevationType\"\u003e%%1938\u003c/Data\u003e\u003cData Name=\"ProcessId\"\u003e0x1cd0\u003c/Data\u003e\u003cData Name=\"CommandLine\"\u003e\u003c/Data\u003e\u003cData Name=\"TargetUserSid\"\u003eS-1-0-0\u003c/Data\u003e\u003cData Name=\"TargetUserName\"\u003e-\u003c/Data\u003e\u003cData Name=\"TargetDomainName\"\u003e-\u003c/Data\u003e\u003cData Name=\"TargetLogonId\"\u003e0x0\u003c/Data\u003e\u003cData Name=\"ParentProcessName\"\u003eC:\\Windows\\SysWOW64\\mshta.exe\u003c/Data\u003e\u003cData Name=\"MandatoryLabel\"\u003eS-1-16-8192\u003c/Data\u003e\u003c/EventData\u003e","Task":13312,"SubjectUserSid":"S-1-5-21-2199682790-2533951109-4136935257-1001","SubjectUserName":"malware","SubjectDomainName":"FLAREVM","SubjectLogonId":"0xdfdd5","NewProcessId":"0x1214","NewProcessName":"C:\\Windows\\SysWOW64\\cmd.exe","TokenElevationType":"%%1938","ProcessId":"0x1cd0","CommandLine":"","TargetUserSid":"S-1-0-0","TargetUserName":"-","TargetDomainName":"-","TargetLogonId":"0x0","ParentProcessName":"C:\\Windows\\SysWOW64\\mshta.exe","MandatoryLabel":"S-1-16-8192"},{"EventSourceName":"Microsoft-Windows-Security-Auditing","Provider":"Microsoft-Windows-Security-Auditing","ProviderGuid":"{54849625-5478-4994-a5ba-3e3b0328c30d}","Level":"0","Keywords":"0x8020000000000000","Channel":"Security","Computer":"FlareVM","TimeCreated":"2023-03-02T11:38:21.265Z","TimeGenerated":"2023-03-02T04:38:21.265Z","EventRecordID":"287853","EventID":4688,"Message":"A new process has been created.\r\n\r\nCreator Subject:\r\n\tSecurity ID:\t\tS-1-5-21-2199682790-2533951109-4136935257-1001\r\n\tAccount Name:\t\tmalware\r\n\tAccount Domain:\t\tFLAREVM\r\n\tLogon ID:\t\t0xDFDD5\r\n\r\nTarget Subject:\r\n\tSecurity ID:\t\tS-1-0-0\r\n\tAccount Name:\t\t-\r\n\tAccount Domain:\t\t-\r\n\tLogon ID:\t\t0x0\r\n\r\nProcess Information:\r\n\tNew Process ID:\t\t0x530\r\n\tNew Process Name:\tC:\\Windows\\System32\\conhost.exe\r\n\tToken Elevation Type:\t%%1938\r\n\tMandatory Label:\t\tS-1-16-8192\r\n\tCreator Process ID:\t0x1214\r\n\tCreator Process Name:\tC:\\Windows\\SysWOW64\\cmd.exe\r\n\tProcess Command Line:\t\r\n\r\nToken Elevation Type indicates the type of token that was assigned to the new process in accordance with User Account Control policy.\r\n\r\nType 1 is a full token with no privileges removed or groups disabled.  A full token is only used if User Account Control is disabled or if the user is the built-in Administrator account or a service account.\r\n\r\nType 2 is an elevated token with no privileges removed or groups disabled.  An elevated token is used when User Account Control is enabled and the user chooses to start the program using Run as administrator.  An elevated token is also used when an application is configured to always require administrative privilege or to always require maximum privilege, and the user is a member of the Administrators group.\r\n\r\nType 3 is a limited token with administrative privileges removed and administrative groups disabled.  The limited token is used when User Account Control is enabled, the application does not require administrative privilege, and the user does not choose to start the program using Run as administrator.","EventData":"\u003cEventData xmlns=\"http://schemas.microsoft.com/win/2004/08/events/event\"\u003e\u003cData Name=\"SubjectUserSid\"\u003eS-1-5-21-2199682790-2533951109-4136935257-1001\u003c/Data\u003e\u003cData Name=\"SubjectUserName\"\u003emalware\u003c/Data\u003e\u003cData Name=\"SubjectDomainName\"\u003eFLAREVM\u003c/Data\u003e\u003cData Name=\"SubjectLogonId\"\u003e0xdfdd5\u003c/Data\u003e\u003cData Name=\"NewProcessId\"\u003e0x530\u003c/Data\u003e\u003cData Name=\"NewProcessName\"\u003eC:\\Windows\\System32\\conhost.exe\u003c/Data\u003e\u003cData Name=\"TokenElevationType\"\u003e%%1938\u003c/Data\u003e\u003cData Name=\"ProcessId\"\u003e0x1214\u003c/Data\u003e\u003cData Name=\"CommandLine\"\u003e\u003c/Data\u003e\u003cData Name=\"TargetUserSid\"\u003eS-1-0-0\u003c/Data\u003e\u003cData Name=\"TargetUserName\"\u003e-\u003c/Data\u003e\u003cData Name=\"TargetDomainName\"\u003e-\u003c/Data\u003e\u003cData Name=\"TargetLogonId\"\u003e0x0\u003c/Data\u003e\u003cData Name=\"ParentProcessName\"\u003eC:\\Windows\\SysWOW64\\cmd.exe\u003c/Data\u003e\u003cData Name=\"MandatoryLabel\"\u003eS-1-16-8192\u003c/Data\u003e\u003c/EventData\u003e","Task":13312,"SubjectUserSid":"S-1-5-21-2199682790-2533951109-4136935257-1001","SubjectUserName":"malware","SubjectDomainName":"FLAREVM","SubjectLogonId":"0xdfdd5","NewProcessId":"0x530","NewProcessName":"C:\\Windows\\System32\\conhost.exe","TokenElevationType":"%%1938","ProcessId":"0x1214","CommandLine":"","TargetUserSid":"S-1-0-0","TargetUserName":"-","TargetDomainName":"-","TargetLogonId":"0x0","ParentProcessName":"C:\\Windows\\SysWOW64\\cmd.exe","MandatoryLabel":"S-1-16-8192"},{"EventSourceName":"Microsoft-Windows-Security-Auditing","Provider":"Microsoft-Windows-Security-Auditing","ProviderGuid":"{54849625-5478-4994-a5ba-3e3b0328c30d}","Level":"0","Keywords":"0x8020000000000000","Channel":"Security","Computer":"FlareVM","TimeCreated":"2023-03-02T11:38:21.449Z","TimeGenerated":"2023-03-02T04:38:21.449Z","EventRecordID":"287854","EventID":4688,"Message":"A new process has been created.\r\n\r\nCreator Subject:\r\n\tSecurity ID:\t\tS-1-5-21-2199682790-2533951109-4136935257-1001\r\n\tAccount Name:\t\tmalware\r\n\tAccount Domain:\t\tFLAREVM\r\n\tLogon ID:\t\t0xDFDD5\r\n\r\nTarget Subject:\r\n\tSecurity ID:\t\tS-1-0-0\r\n\tAccount Name:\t\t-\r\n\tAccount Domain:\t\t-\r\n\tLogon ID:\t\t0x0\r\n\r\nProcess Information:\r\n\tNew Process ID:\t\t0x2554\r\n\tNew Process Name:\tC:\\Windows\\SysWOW64\\curl.exe\r\n\tToken Elevation Type:\t%%1938\r\n\tMandatory Label:\t\tS-1-16-8192\r\n\tCreator Process ID:\t0x1214\r\n\tCreator Process Name:\tC:\\Windows\\SysWOW64\\cmd.exe\r\n\tProcess Command Line:\t\r\n\r\nToken Elevation Type indicates the type of token that was assigned to the new process in accordance with User Account Control policy.\r\n\r\nType 1 is a full token with no privileges removed or groups disabled.  A full token is only used if User Account Control is disabled or if the user is the built-in Administrator account or a service account.\r\n\r\nType 2 is an elevated token with no privileges removed or groups disabled.  An elevated token is used when User Account Control is enabled and the user chooses to start the program using Run as administrator.  An elevated token is also used when an application is configured to always require administrative privilege or to always require maximum privilege, and the user is a member of the Administrators group.\r\n\r\nType 3 is a limited token with administrative privileges removed and administrative groups disabled.  The limited token is used when User Account Control is enabled, the application does not require administrative privilege, and the user does not choose to start the program using Run as administrator.","EventData":"\u003cEventData xmlns=\"http://schemas.microsoft.com/win/2004/08/events/event\"\u003e\u003cData Name=\"SubjectUserSid\"\u003eS-1-5-21-2199682790-2533951109-4136935257-1001\u003c/Data\u003e\u003cData Name=\"SubjectUserName\"\u003emalware\u003c/Data\u003e\u003cData Name=\"SubjectDomainName\"\u003eFLAREVM\u003c/Data\u003e\u003cData Name=\"SubjectLogonId\"\u003e0xdfdd5\u003c/Data\u003e\u003cData Name=\"NewProcessId\"\u003e0x2554\u003c/Data\u003e\u003cData Name=\"NewProcessName\"\u003eC:\\Windows\\SysWOW64\\curl.exe\u003c/Data\u003e\u003cData Name=\"TokenElevationType\"\u003e%%1938\u003c/Data\u003e\u003cData Name=\"ProcessId\"\u003e0x1214\u003c/Data\u003e\u003cData Name=\"CommandLine\"\u003e\u003c/Data\u003e\u003cData Name=\"TargetUserSid\"\u003eS-1-0-0\u003c/Data\u003e\u003cData Name=\"TargetUserName\"\u003e-\u003c/Data\u003e\u003cData Name=\"TargetDomainName\"\u003e-\u003c/Data\u003e\u003cData Name=\"TargetLogonId\"\u003e0x0\u003c/Data\u003e\u003cData Name=\"ParentProcessName\"\u003eC:\\Windows\\SysWOW64\\cmd.exe\u003c/Data\u003e\u003cData Name=\"MandatoryLabel\"\u003eS-1-16-8192\u003c/Data\u003e\u003c/EventData\u003e","Task":13312,"SubjectUserSid":"S-1-5-21-2199682790-2533951109-4136935257-1001","SubjectUserName":"malware","SubjectDomainName":"FLAREVM","SubjectLogonId":"0xdfdd5","NewProcessId":"0x2554","NewProcessName":"C:\\Windows\\SysWOW64\\curl.exe","TokenElevationType":"%%1938","ProcessId":"0x1214","CommandLine":"","TargetUserSid":"S-1-0-0","TargetUserName":"-","TargetDomainName":"-","TargetLogonId":"0x0","ParentProcessName":"C:\\Windows\\SysWOW64\\cmd.exe","MandatoryLabel":"S-1-16-8192"},{"EventSourceName":"Microsoft-Windows-Security-Auditing","Provider":"Microsoft-Windows-Security-Auditing","ProviderGuid":"{54849625-5478-4994-a5ba-3e3b0328c30d}","Level":"0","Keywords":"0x8020000000000000","Channel":"Security","Computer":"FlareVM","TimeCreated":"2023-03-02T11:38:21.570Z","TimeGenerated":"2023-03-02T04:38:21.570Z","EventRecordID":"287855","EventID":4688,"Message":"A new process has been created.\r\n\r\nCreator Subject:\r\n\tSecurity ID:\t\tS-1-5-21-2199682790-2533951109-4136935257-1001\r\n\tAccount Name:\t\tmalware\r\n\tAccount Domain:\t\tFLAREVM\r\n\tLogon ID:\t\t0xDFDD5\r\n\r\nTarget Subject:\r\n\tSecurity ID:\t\tS-1-0-0\r\n\tAccount Name:\t\t-\r\n\tAccount Domain:\t\t-\r\n\tLogon ID:\t\t0x0\r\n\r\nProcess Information:\r\n\tNew Process ID:\t\t0x774\r\n\tNew Process Name:\tC:\\Windows\\SysWOW64\\rundll32.exe\r\n\tToken Elevation Type:\t%%1938\r\n\tMandatory Label:\t\tS-1-16-8192\r\n\tCreator Process ID:\t0x1214\r\n\tCreator Process Name:\tC:\\Windows\\SysWOW64\\cmd.exe\r\n\tProcess Command Line:\t\r\n\r\nToken Elevation Type indicates the type of token that was assigned to the new process in accordance with User Account Control policy.\r\n\r\nType 1 is a full token with no privileges removed or groups disabled.  A full token is only used if User Account Control is disabled or if the user is the built-in Administrator account or a service account.\r\n\r\nType 2 is an elevated token with no privileges removed or groups disabled.  An elevated token is used when User Account Control is enabled and the user chooses to start the program using Run as administrator.  An elevated token is also used when an application is configured to always require administrative privilege or to always require maximum privilege, and the user is a member of the Administrators group.\r\n\r\nType 3 is a limited token with administrative privileges removed and administrative groups disabled.  The limited token is used when User Account Control is enabled, the application does not require administrative privilege, and the user does not choose to start the program using Run as administrator.","EventData":"\u003cEventData xmlns=\"http://schemas.microsoft.com/win/2004/08/events/event\"\u003e\u003cData Name=\"SubjectUserSid\"\u003eS-1-5-21-2199682790-2533951109-4136935257-1001\u003c/Data\u003e\u003cData Name=\"SubjectUserName\"\u003emalware\u003c/Data\u003e\u003cData Name=\"SubjectDomainName\"\u003eFLAREVM\u003c/Data\u003e\u003cData Name=\"SubjectLogonId\"\u003e0xdfdd5\u003c/Data\u003e\u003cData Name=\"NewProcessId\"\u003e0x774\u003c/Data\u003e\u003cData Name=\"NewProcessName\"\u003eC:\\Windows\\SysWOW64\\rundll32.exe\u003c/Data\u003e\u003cData Name=\"TokenElevationType\"\u003e%%1938\u003c/Data\u003e\u003cData Name=\"ProcessId\"\u003e0x1214\u003c/Data\u003e\u003cData Name=\"CommandLine\"\u003e\u003c/Data\u003e\u003cData Name=\"TargetUserSid\"\u003eS-1-0-0\u003c/Data\u003e\u003cData Name=\"TargetUserName\"\u003e-\u003c/Data\u003e\u003cData Name=\"TargetDomainName\"\u003e-\u003c/Data\u003e\u003cData Name=\"TargetLogonId\"\u003e0x0\u003c/Data\u003e\u003cData Name=\"ParentProcessName\"\u003eC:\\Windows\\SysWOW64\\cmd.exe\u003c/Data\u003e\u003cData Name=\"MandatoryLabel\"\u003eS-1-16-8192\u003c/Data\u003e\u003c/EventData\u003e","Task":13312,"SubjectUserSid":"S-1-5-21-2199682790-2533951109-4136935257-1001","SubjectUserName":"malware","SubjectDomainName":"FLAREVM","SubjectLogonId":"0xdfdd5","NewProcessId":"0x774","NewProcessName":"C:\\Windows\\SysWOW64\\rundll32.exe","TokenElevationType":"%%1938","ProcessId":"0x1214","CommandLine":"","TargetUserSid":"S-1-0-0","TargetUserName":"-","TargetDomainName":"-","TargetLogonId":"0x0","ParentProcessName":"C:\\Windows\\SysWOW64\\cmd.exe","MandatoryLabel":"S-1-16-8192"},{"EventSourceName":"Microsoft-Windows-Security-Auditing","Provider":"Microsoft-Windows-Security-Auditing","ProviderGuid":"{54849625-5478-4994-a5ba-3e3b0328c30d}","Level":"0","Keywords":"0x8020000000000000","Channel":"Security","Computer":"FlareVM","TimeCreated":"2023-03-02T11:38:46.661Z","TimeGenerated":"2023-03-02T04:38:46.661Z","EventRecordID":"287856","EventID":4688,"Message":"A new process has been created.\r\n\r\nCreator Subject:\r\n\tSecurity ID:\t\tS-1-5-21-2199682790-2533951109-4136935257-1001\r\n\tAccount Name:\t\tmalware\r\n\tAccount Domain:\t\tFLAREVM\r\n\tLogon ID:\t\t0xDFDD5\r\n\r\nTarget Subject:\r\n\tSecurity ID:\t\tS-1-0-0\r\n\tAccount Name:\t\t-\r\n\tAccount Domain:\t\t-\r\n\tLogon ID:\t\t0x0\r\n\r\nProcess Information:\r\n\tNew Process ID:\t\t0x17c0\r\n\tNew Process Name:\tC:\\Program Files\\Mozilla Firefox\\firefox.exe\r\n\tToken Elevation Type:\t%%1938\r\n\tMandatory Label:\t\tS-1-16-4096\r\n\tCreator Process ID:\t0x2478\r\n\tCreator Process Name:\tC:\\Program Files\\Mozilla Firefox\\firefox.exe\r\n\tProcess Command Line:\t\r\n\r\nToken Elevation Type indicates the type of token that was assigned to the new process in accordance with User Account Control policy.\r\n\r\nType 1 is a full token with no privileges removed or groups disabled.  A full token is only used if User Account Control is disabled or if the user is the built-in Administrator account or a service account.\r\n\r\nType 2 is an elevated token with no privileges removed or groups disabled.  An elevated token is used when User Account Control is enabled and the user chooses to start the program using Run as administrator.  An elevated token is also used when an application is configured to always require administrative privilege or to always require maximum privilege, and the user is a member of the Administrators group.\r\n\r\nType 3 is a limited token with administrative privileges removed and administrative groups disabled.  The limited token is used when User Account Control is enabled, the application does not require administrative privilege, and the user does not choose to start the program using Run as administrator.","EventData":"\u003cEventData xmlns=\"http://schemas.microsoft.com/win/2004/08/events/event\"\u003e\u003cData Name=\"SubjectUserSid\"\u003eS-1-5-21-2199682790-2533951109-4136935257-1001\u003c/Data\u003e\u003cData Name=\"SubjectUserName\"\u003emalware\u003c/Data\u003e\u003cData Name=\"SubjectDomainName\"\u003eFLAREVM\u003c/Data\u003e\u003cData Name=\"SubjectLogonId\"\u003e0xdfdd5\u003c/Data\u003e\u003cData Name=\"NewProcessId\"\u003e0x17c0\u003c/Data\u003e\u003cData Name=\"NewProcessName\"\u003eC:\\Program Files\\Mozilla Firefox\\firefox.exe\u003c/Data\u003e\u003cData Name=\"TokenElevationType\"\u003e%%1938\u003c/Data\u003e\u003cData Name=\"ProcessId\"\u003e0x2478\u003c/Data\u003e\u003cData Name=\"CommandLine\"\u003e\u003c/Data\u003e\u003cData Name=\"TargetUserSid\"\u003eS-1-0-0\u003c/Data\u003e\u003cData Name=\"TargetUserName\"\u003e-\u003c/Data\u003e\u003cData Name=\"TargetDomainName\"\u003e-\u003c/Data\u003e\u003cData Name=\"TargetLogonId\"\u003e0x0\u003c/Data\u003e\u003cData Name=\"ParentProcessName\"\u003eC:\\Program Files\\Mozilla Firefox\\firefox.exe\u003c/Data\u003e\u003cData Name=\"MandatoryLabel\"\u003eS-1-16-4096\u003c/Data\u003e\u003c/EventData\u003e","Task":13312,"SubjectUserSid":"S-1-5-21-2199682790-2533951109-4136935257-1001","SubjectUserName":"malware","SubjectDomainName":"FLAREVM","SubjectLogonId":"0xdfdd5","NewProcessId":"0x17c0","NewProcessName":"C:\\Program Files\\Mozilla Firefox\\firefox.exe","TokenElevationType":"%%1938","ProcessId":"0x2478","CommandLine":"","TargetUserSid":"S-1-0-0","TargetUserName":"-","TargetDomainName":"-","TargetLogonId":"0x0","ParentProcessName":"C:\\Program Files\\Mozilla Firefox\\firefox.exe","MandatoryLabel":"S-1-16-4096"},{"EventSourceName":"Microsoft-Windows-Security-Auditing","Provider":"Microsoft-Windows-Security-Auditing","ProviderGuid":"{54849625-5478-4994-a5ba-3e3b0328c30d}","Level":"0","Keywords":"0x8020000000000000","Channel":"Security","Computer":"FlareVM","TimeCreated":"2023-03-02T11:38:46.671Z","TimeGenerated":"2023-03-02T04:38:46.671Z","EventRecordID":"287857","EventID":4688,"Message":"A new process has been created.\r\n\r\nCreator Subject:\r\n\tSecurity ID:\t\tS-1-5-21-2199682790-2533951109-4136935257-1001\r\n\tAccount Name:\t\tmalware\r\n\tAccount Domain:\t\tFLAREVM\r\n\tLogon ID:\t\t0xDFDD5\r\n\r\nTarget Subject:\r\n\tSecurity ID:\t\tS-1-0-0\r\n\tAccount Name:\t\t-\r\n\tAccount Domain:\t\t-\r\n\tLogon ID:\t\t0x0\r\n\r\nProcess Information:\r\n\tNew Process ID:\t\t0x9f8\r\n\tNew Process Name:\tC:\\Program Files\\Mozilla Firefox\\firefox.exe\r\n\tToken Elevation Type:\t%%1938\r\n\tMandatory Label:\t\tS-1-16-4096\r\n\tCreator Process ID:\t0x2478\r\n\tCreator Process Name:\tC:\\Program Files\\Mozilla Firefox\\firefox.exe\r\n\tProcess Command Line:\t\r\n\r\nToken Elevation Type indicates the type of token that was assigned to the new process in accordance with User Account Control policy.\r\n\r\nType 1 is a full token with no privileges removed or groups disabled.  A full token is only used if User Account Control is disabled or if the user is the built-in Administrator account or a service account.\r\n\r\nType 2 is an elevated token with no privileges removed or groups disabled.  An elevated token is used when User Account Control is enabled and the user chooses to start the program using Run as administrator.  An elevated token is also used when an application is configured to always require administrative privilege or to always require maximum privilege, and the user is a member of the Administrators group.\r\n\r\nType 3 is a limited token with administrative privileges removed and administrative groups disabled.  The limited token is used when User Account Control is enabled, the application does not require administrative privilege, and the user does not choose to start the program using Run as administrator.","EventData":"\u003cEventData xmlns=\"http://schemas.microsoft.com/win/2004/08/events/event\"\u003e\u003cData Name=\"SubjectUserSid\"\u003eS-1-5-21-2199682790-2533951109-4136935257-1001\u003c/Data\u003e\u003cData Name=\"SubjectUserName\"\u003emalware\u003c/Data\u003e\u003cData Name=\"SubjectDomainName\"\u003eFLAREVM\u003c/Data\u003e\u003cData Name=\"SubjectLogonId\"\u003e0xdfdd5\u003c/Data\u003e\u003cData Name=\"NewProcessId\"\u003e0x9f8\u003c/Data\u003e\u003cData Name=\"NewProcessName\"\u003eC:\\Program Files\\Mozilla Firefox\\firefox.exe\u003c/Data\u003e\u003cData Name=\"TokenElevationType\"\u003e%%1938\u003c/Data\u003e\u003cData Name=\"ProcessId\"\u003e0x2478\u003c/Data\u003e\u003cData Name=\"CommandLine\"\u003e\u003c/Data\u003e\u003cData Name=\"TargetUserSid\"\u003eS-1-0-0\u003c/Data\u003e\u003cData Name=\"TargetUserName\"\u003e-\u003c/Data\u003e\u003cData Name=\"TargetDomainName\"\u003e-\u003c/Data\u003e\u003cData Name=\"TargetLogonId\"\u003e0x0\u003c/Data\u003e\u003cData Name=\"ParentProcessName\"\u003eC:\\Program Files\\Mozilla Firefox\\firefox.exe\u003c/Data\u003e\u003cData Name=\"MandatoryLabel\"\u003eS-1-16-4096\u003c/Data\u003e\u003c/EventData\u003e","Task":13312,"SubjectUserSid":"S-1-5-21-2199682790-2533951109-4136935257-1001","SubjectUserName":"malware","SubjectDomainName":"FLAREVM","SubjectLogonId":"0xdfdd5","NewProcessId":"0x9f8","NewProcessName":"C:\\Program Files\\Mozilla Firefox\\firefox.exe","TokenElevationType":"%%1938","ProcessId":"0x2478","CommandLine":"","TargetUserSid":"S-1-0-0","TargetUserName":"-","TargetDomainName":"-","TargetLogonId":"0x0","ParentProcessName":"C:\\Program Files\\Mozilla Firefox\\firefox.exe","MandatoryLabel":"S-1-16-4096"},{"EventSourceName":"Microsoft-Windows-Security-Auditing","Provider":"Microsoft-Windows-Security-Auditing","ProviderGuid":"{54849625-5478-4994-a5ba-3e3b0328c30d}","Level":"0","Keywords":"0x8020000000000000","Channel":"Security","Computer":"FlareVM","TimeCreated":"2023-03-02T11:38:46.677Z","TimeGenerated":"2023-03-02T04:38:46.677Z","EventRecordID":"287858","EventID":4688,"Message":"A new process has been created.\r\n\r\nCreator Subject:\r\n\tSecurity ID:\t\tS-1-5-21-2199682790-2533951109-4136935257-1001\r\n\tAccount Name:\t\tmalware\r\n\tAccount Domain:\t\tFLAREVM\r\n\tLogon ID:\t\t0xDFDD5\r\n\r\nTarget Subject:\r\n\tSecurity ID:\t\tS-1-0-0\r\n\tAccount Name:\t\t-\r\n\tAccount Domain:\t\t-\r\n\tLogon ID:\t\t0x0\r\n\r\nProcess Information:\r\n\tNew Process ID:\t\t0x1350\r\n\tNew Process Name:\tC:\\Program Files\\Mozilla Firefox\\firefox.exe\r\n\tToken Elevation Type:\t%%1938\r\n\tMandatory Label:\t\tS-1-16-4096\r\n\tCreator Process ID:\t0x2478\r\n\tCreator Process Name:\tC:\\Program Files\\Mozilla Firefox\\firefox.exe\r\n\tProcess Command Line:\t\r\n\r\nToken Elevation Type indicates the type of token that was assigned to the new process in accordance with User Account Control policy.\r\n\r\nType 1 is a full token with no privileges removed or groups disabled.  A full token is only used if User Account Control is disabled or if the user is the built-in Administrator account or a service account.\r\n\r\nType 2 is an elevated token with no privileges removed or groups disabled.  An elevated token is used when User Account Control is enabled and the user chooses to start the program using Run as administrator.  An elevated token is also used when an application is configured to always require administrative privilege or to always require maximum privilege, and the user is a member of the Administrators group.\r\n\r\nType 3 is a limited token with administrative privileges removed and administrative groups disabled.  The limited token is used when User Account Control is enabled, the application does not require administrative privilege, and the user does not choose to start the program using Run as administrator.","EventData":"\u003cEventData xmlns=\"http://schemas.microsoft.com/win/2004/08/events/event\"\u003e\u003cData Name=\"SubjectUserSid\"\u003eS-1-5-21-2199682790-2533951109-4136935257-1001\u003c/Data\u003e\u003cData Name=\"SubjectUserName\"\u003emalware\u003c/Data\u003e\u003cData Name=\"SubjectDomainName\"\u003eFLAREVM\u003c/Data\u003e\u003cData Name=\"SubjectLogonId\"\u003e0xdfdd5\u003c/Data\u003e\u003cData Name=\"NewProcessId\"\u003e0x1350\u003c/Data\u003e\u003cData Name=\"NewProcessName\"\u003eC:\\Program Files\\Mozilla Firefox\\firefox.exe\u003c/Data\u003e\u003cData Name=\"TokenElevationType\"\u003e%%1938\u003c/Data\u003e\u003cData Name=\"ProcessId\"\u003e0x2478\u003c/Data\u003e\u003cData Name=\"CommandLine\"\u003e\u003c/Data\u003e\u003cData Name=\"TargetUserSid\"\u003eS-1-0-0\u003c/Data\u003e\u003cData Name=\"TargetUserName\"\u003e-\u003c/Data\u003e\u003cData Name=\"TargetDomainName\"\u003e-\u003c/Data\u003e\u003cData Name=\"TargetLogonId\"\u003e0x0\u003c/Data\u003e\u003cData Name=\"ParentProcessName\"\u003eC:\\Program Files\\Mozilla Firefox\\firefox.exe\u003c/Data\u003e\u003cData Name=\"MandatoryLabel\"\u003eS-1-16-4096\u003c/Data\u003e\u003c/EventData\u003e","Task":13312,"SubjectUserSid":"S-1-5-21-2199682790-2533951109-4136935257-1001","SubjectUserName":"malware","SubjectDomainName":"FLAREVM","SubjectLogonId":"0xdfdd5","NewProcessId":"0x1350","NewProcessName":"C:\\Program Files\\Mozilla Firefox\\firefox.exe","TokenElevationType":"%%1938","ProcessId":"0x2478","CommandLine":"","TargetUserSid":"S-1-0-0","TargetUserName":"-","TargetDomainName":"-","TargetLogonId":"0x0","ParentProcessName":"C:\\Program Files\\Mozilla Firefox\\firefox.exe","MandatoryLabel":"S-1-16-4096"},{"EventSourceName":"Microsoft-Windows-Security-Auditing","Provider":"Microsoft-Windows-Security-Auditing","ProviderGuid":"{54849625-5478-4994-a5ba-3e3b0328c30d}","Level":"0","Keywords":"0x8020000000000000","Channel":"Security","Computer":"FlareVM","TimeCreated":"2023-03-02T11:39:24.335Z","TimeGenerated":"2023-03-02T04:39:24.335Z","EventRecordID":"287859","EventID":4798,"Message":"A user\u0027s local group membership was enumerated.\r\n\r\nSubject:\r\n\tSecurity ID:\t\tS-1-5-21-2199682790-2533951109-4136935257-1001\r\n\tAccount Name:\t\tmalware\r\n\tAccount Domain:\t\tFLAREVM\r\n\tLogon ID:\t\t0xDFD96\r\n\r\nUser:\r\n\tSecurity ID:\t\tS-1-5-21-2199682790-2533951109-4136935257-1001\r\n\tAccount Name:\t\tmalware\r\n\tAccount Domain:\t\tFLAREVM\r\n\r\nProcess Information:\r\n\tProcess ID:\t\t0x21a8\r\n\tProcess Name:\t\tC:\\Windows\\System32\\mmc.exe","EventData":"\u003cEventData xmlns=\"http://schemas.microsoft.com/win/2004/08/events/event\"\u003e\u003cData Name=\"TargetUserName\"\u003emalware\u003c/Data\u003e\u003cData Name=\"TargetDomainName\"\u003eFLAREVM\u003c/Data\u003e\u003cData Name=\"TargetSid\"\u003eS-1-5-21-2199682790-2533951109-4136935257-1001\u003c/Data\u003e\u003cData Name=\"SubjectUserSid\"\u003eS-1-5-21-2199682790-2533951109-4136935257-1001\u003c/Data\u003e\u003cData Name=\"SubjectUserName\"\u003emalware\u003c/Data\u003e\u003cData Name=\"SubjectDomainName\"\u003eFLAREVM\u003c/Data\u003e\u003cData Name=\"SubjectLogonId\"\u003e0xdfd96\u003c/Data\u003e\u003cData Name=\"CallerProcessId\"\u003e0x21a8\u003c/Data\u003e\u003cData Name=\"CallerProcessName\"\u003eC:\\Windows\\System32\\mmc.exe\u003c/Data\u003e\u003c/EventData\u003e","Task":13824,"TargetUserName":"malware","TargetDomainName":"FLAREVM","TargetSid":"S-1-5-21-2199682790-2533951109-4136935257-1001","SubjectUserSid":"S-1-5-21-2199682790-2533951109-4136935257-1001","SubjectUserName":"malware","SubjectDomainName":"FLAREVM","SubjectLogonId":"0xdfd96","CallerProcessId":"0x21a8","CallerProcessName":"C:\\Windows\\System32\\mmc.exe"},{"EventSourceName":"Microsoft-Windows-Security-Auditing","Provider":"Microsoft-Windows-Security-Auditing","ProviderGuid":"{54849625-5478-4994-a5ba-3e3b0328c30d}","Level":"0","Keywords":"0x8020000000000000","Channel":"Security","Computer":"FlareVM","TimeCreated":"2023-03-02T11:39:27.749Z","TimeGenerated":"2023-03-02T04:39:27.749Z","EventRecordID":"287860","EventID":4798,"Message":"A user\u0027s local group membership was enumerated.\r\n\r\nSubject:\r\n\tSecurity ID:\t\tS-1-5-21-2199682790-2533951109-4136935257-1001\r\n\tAccount Name:\t\tmalware\r\n\tAccount Domain:\t\tFLAREVM\r\n\tLogon ID:\t\t0xDFDD5\r\n\r\nUser:\r\n\tSecurity ID:\t\tS-1-5-21-2199682790-2533951109-4136935257-1001\r\n\tAccount Name:\t\tmalware\r\n\tAccount Domain:\t\tFLAREVM\r\n\r\nProcess Information:\r\n\tProcess ID:\t\t0x196c\r\n\tProcess Name:\t\tC:\\Windows\\explorer.exe","EventData":"\u003cEventData xmlns=\"http://schemas.microsoft.com/win/2004/08/events/event\"\u003e\u003cData Name=\"TargetUserName\"\u003emalware\u003c/Data\u003e\u003cData Name=\"TargetDomainName\"\u003eFLAREVM\u003c/Data\u003e\u003cData Name=\"TargetSid\"\u003eS-1-5-21-2199682790-2533951109-4136935257-1001\u003c/Data\u003e\u003cData Name=\"SubjectUserSid\"\u003eS-1-5-21-2199682790-2533951109-4136935257-1001\u003c/Data\u003e\u003cData Name=\"SubjectUserName\"\u003emalware\u003c/Data\u003e\u003cData Name=\"SubjectDomainName\"\u003eFLAREVM\u003c/Data\u003e\u003cData Name=\"SubjectLogonId\"\u003e0xdfdd5\u003c/Data\u003e\u003cData Name=\"CallerProcessId\"\u003e0x196c\u003c/Data\u003e\u003cData Name=\"CallerProcessName\"\u003eC:\\Windows\\explorer.exe\u003c/Data\u003e\u003c/EventData\u003e","Task":13824,"TargetUserName":"malware","TargetDomainName":"FLAREVM","TargetSid":"S-1-5-21-2199682790-2533951109-4136935257-1001","SubjectUserSid":"S-1-5-21-2199682790-2533951109-4136935257-1001","SubjectUserName":"malware","SubjectDomainName":"FLAREVM","SubjectLogonId":"0xdfdd5","CallerProcessId":"0x196c","CallerProcessName":"C:\\Windows\\explorer.exe"},{"EventSourceName":"Microsoft-Windows-Security-Auditing","Provider":"Microsoft-Windows-Security-Auditing","ProviderGuid":"{54849625-5478-4994-a5ba-3e3b0328c30d}","Level":"0","Keywords":"0x8020000000000000","Channel":"Security","Computer":"FlareVM","TimeCreated":"2023-03-02T11:39:27.752Z","TimeGenerated":"2023-03-02T04:39:27.752Z","EventRecordID":"287861","EventID":4798,"Message":"A user\u0027s local group membership was enumerated.\r\n\r\nSubject:\r\n\tSecurity ID:\t\tS-1-5-21-2199682790-2533951109-4136935257-1001\r\n\tAccount Name:\t\tmalware\r\n\tAccount Domain:\t\tFLAREVM\r\n\tLogon ID:\t\t0xDFD96\r\n\r\nUser:\r\n\tSecurity ID:\t\tS-1-5-21-2199682790-2533951109-4136935257-1001\r\n\tAccount Name:\t\tmalware\r\n\tAccount Domain:\t\tFLAREVM\r\n\r\nProcess Information:\r\n\tProcess ID:\t\t0x21a8\r\n\tProcess Name:\t\tC:\\Windows\\System32\\mmc.exe","EventData":"\u003cEventData xmlns=\"http://schemas.microsoft.com/win/2004/08/events/event\"\u003e\u003cData Name=\"TargetUserName\"\u003emalware\u003c/Data\u003e\u003cData Name=\"TargetDomainName\"\u003eFLAREVM\u003c/Data\u003e\u003cData Name=\"TargetSid\"\u003eS-1-5-21-2199682790-2533951109-4136935257-1001\u003c/Data\u003e\u003cData Name=\"SubjectUserSid\"\u003eS-1-5-21-2199682790-2533951109-4136935257-1001\u003c/Data\u003e\u003cData Name=\"SubjectUserName\"\u003emalware\u003c/Data\u003e\u003cData Name=\"SubjectDomainName\"\u003eFLAREVM\u003c/Data\u003e\u003cData Name=\"SubjectLogonId\"\u003e0xdfd96\u003c/Data\u003e\u003cData Name=\"CallerProcessId\"\u003e0x21a8\u003c/Data\u003e\u003cData Name=\"CallerProcessName\"\u003eC:\\Windows\\System32\\mmc.exe\u003c/Data\u003e\u003c/EventData\u003e","Task":13824,"TargetUserName":"malware","TargetDomainName":"FLAREVM","TargetSid":"S-1-5-21-2199682790-2533951109-4136935257-1001","SubjectUserSid":"S-1-5-21-2199682790-2533951109-4136935257-1001","SubjectUserName":"malware","SubjectDomainName":"FLAREVM","SubjectLogonId":"0xdfd96","CallerProcessId":"0x21a8","CallerProcessName":"C:\\Windows\\System32\\mmc.exe"},{"EventSourceName":"Microsoft-Windows-Security-Auditing","Provider":"Microsoft-Windows-Security-Auditing","ProviderGuid":"{54849625-5478-4994-a5ba-3e3b0328c30d}","Level":"0","Keywords":"0x8020000000000000","Channel":"Security","Computer":"FlareVM","TimeCreated":"2023-03-02T11:39:36.364Z","TimeGenerated":"2023-03-02T04:39:36.364Z","EventRecordID":"287862","EventID":4688,"Message":"A new process has been created.\r\n\r\nCreator Subject:\r\n\tSecurity ID:\t\tS-1-5-18\r\n\tAccount Name:\t\tFLAREVM$\r\n\tAccount Domain:\t\tWORKGROUP\r\n\tLogon ID:\t\t0x3E7\r\n\r\nTarget Subject:\r\n\tSecurity ID:\t\tS-1-5-21-2199682790-2533951109-4136935257-1001\r\n\tAccount Name:\t\tmalware\r\n\tAccount Domain:\t\tFLAREVM\r\n\tLogon ID:\t\t0xDFDD5\r\n\r\nProcess Information:\r\n\tNew Process ID:\t\t0x1258\r\n\tNew Process Name:\tC:\\Windows\\System32\\dllhost.exe\r\n\tToken Elevation Type:\t%%1938\r\n\tMandatory Label:\t\tS-1-16-8192\r\n\tCreator Process ID:\t0x364\r\n\tCreator Process Name:\tC:\\Windows\\System32\\svchost.exe\r\n\tProcess Command Line:\t\r\n\r\nToken Elevation Type indicates the type of token that was assigned to the new process in accordance with User Account Control policy.\r\n\r\nType 1 is a full token with no privileges removed or groups disabled.  A full token is only used if User Account Control is disabled or if the user is the built-in Administrator account or a service account.\r\n\r\nType 2 is an elevated token with no privileges removed or groups disabled.  An elevated token is used when User Account Control is enabled and the user chooses to start the program using Run as administrator.  An elevated token is also used when an application is configured to always require administrative privilege or to always require maximum privilege, and the user is a member of the Administrators group.\r\n\r\nType 3 is a limited token with administrative privileges removed and administrative groups disabled.  The limited token is used when User Account Control is enabled, the application does not require administrative privilege, and the user does not choose to start the program using Run as administrator.","EventData":"\u003cEventData xmlns=\"http://schemas.microsoft.com/win/2004/08/events/event\"\u003e\u003cData Name=\"SubjectUserSid\"\u003eS-1-5-18\u003c/Data\u003e\u003cData Name=\"SubjectUserName\"\u003eFLAREVM$\u003c/Data\u003e\u003cData Name=\"SubjectDomainName\"\u003eWORKGROUP\u003c/Data\u003e\u003cData Name=\"SubjectLogonId\"\u003e0x3e7\u003c/Data\u003e\u003cData Name=\"NewProcessId\"\u003e0x1258\u003c/Data\u003e\u003cData Name=\"NewProcessName\"\u003eC:\\Windows\\System32\\dllhost.exe\u003c/Data\u003e\u003cData Name=\"TokenElevationType\"\u003e%%1938\u003c/Data\u003e\u003cData Name=\"ProcessId\"\u003e0x364\u003c/Data\u003e\u003cData Name=\"CommandLine\"\u003e\u003c/Data\u003e\u003cData Name=\"TargetUserSid\"\u003eS-1-5-21-2199682790-2533951109-4136935257-1001\u003c/Data\u003e\u003cData Name=\"TargetUserName\"\u003emalware\u003c/Data\u003e\u003cData Name=\"TargetDomainName\"\u003eFLAREVM\u003c/Data\u003e\u003cData Name=\"TargetLogonId\"\u003e0xdfdd5\u003c/Data\u003e\u003cData Name=\"ParentProcessName\"\u003eC:\\Windows\\System32\\svchost.exe\u003c/Data\u003e\u003cData Name=\"MandatoryLabel\"\u003eS-1-16-8192\u003c/Data\u003e\u003c/EventData\u003e","Task":13312,"SubjectUserSid":"S-1-5-18","SubjectUserName":"FLAREVM$","SubjectDomainName":"WORKGROUP","SubjectLogonId":"0x3e7","NewProcessId":"0x1258","NewProcessName":"C:\\Windows\\System32\\dllhost.exe","TokenElevationType":"%%1938","ProcessId":"0x364","CommandLine":"","TargetUserSid":"S-1-5-21-2199682790-2533951109-4136935257-1001","TargetUserName":"malware","TargetDomainName":"FLAREVM","TargetLogonId":"0xdfdd5","ParentProcessName":"C:\\Windows\\System32\\svchost.exe","MandatoryLabel":"S-1-16-8192"},{"EventSourceName":"Microsoft-Windows-Security-Auditing","Provider":"Microsoft-Windows-Security-Auditing","ProviderGuid":"{54849625-5478-4994-a5ba-3e3b0328c30d}","Level":"0","Keywords":"0x8020000000000000","Channel":"Security","Computer":"FlareVM","TimeCreated":"2023-03-02T11:39:40.496Z","TimeGenerated":"2023-03-02T04:39:40.496Z","EventRecordID":"287863","EventID":4688,"Message":"A new process has been created.\r\n\r\nCreator Subject:\r\n\tSecurity ID:\t\tS-1-5-18\r\n\tAccount Name:\t\tFLAREVM$\r\n\tAccount Domain:\t\tWORKGROUP\r\n\tLogon ID:\t\t0x3E7\r\n\r\nTarget Subject:\r\n\tSecurity ID:\t\tS-1-0-0\r\n\tAccount Name:\t\t-\r\n\tAccount Domain:\t\t-\r\n\tLogon ID:\t\t0x0\r\n\r\nProcess Information:\r\n\tNew Process ID:\t\t0x297c\r\n\tNew Process Name:\tC:\\Windows\\System32\\SearchProtocolHost.exe\r\n\tToken Elevation Type:\t%%1936\r\n\tMandatory Label:\t\tS-1-16-16384\r\n\tCreator Process ID:\t0x1c58\r\n\tCreator Process Name:\tC:\\Windows\\System32\\SearchIndexer.exe\r\n\tProcess Command Line:\t\r\n\r\nToken Elevation Type indicates the type of token that was assigned to the new process in accordance with User Account Control policy.\r\n\r\nType 1 is a full token with no privileges removed or groups disabled.  A full token is only used if User Account Control is disabled or if the user is the built-in Administrator account or a service account.\r\n\r\nType 2 is an elevated token with no privileges removed or groups disabled.  An elevated token is used when User Account Control is enabled and the user chooses to start the program using Run as administrator.  An elevated token is also used when an application is configured to always require administrative privilege or to always require maximum privilege, and the user is a member of the Administrators group.\r\n\r\nType 3 is a limited token with administrative privileges removed and administrative groups disabled.  The limited token is used when User Account Control is enabled, the application does not require administrative privilege, and the user does not choose to start the program using Run as administrator.","EventData":"\u003cEventData xmlns=\"http://schemas.microsoft.com/win/2004/08/events/event\"\u003e\u003cData Name=\"SubjectUserSid\"\u003eS-1-5-18\u003c/Data\u003e\u003cData Name=\"SubjectUserName\"\u003eFLAREVM$\u003c/Data\u003e\u003cData Name=\"SubjectDomainName\"\u003eWORKGROUP\u003c/Data\u003e\u003cData Name=\"SubjectLogonId\"\u003e0x3e7\u003c/Data\u003e\u003cData Name=\"NewProcessId\"\u003e0x297c\u003c/Data\u003e\u003cData Name=\"NewProcessName\"\u003eC:\\Windows\\System32\\SearchProtocolHost.exe\u003c/Data\u003e\u003cData Name=\"TokenElevationType\"\u003e%%1936\u003c/Data\u003e\u003cData Name=\"ProcessId\"\u003e0x1c58\u003c/Data\u003e\u003cData Name=\"CommandLine\"\u003e\u003c/Data\u003e\u003cData Name=\"TargetUserSid\"\u003eS-1-0-0\u003c/Data\u003e\u003cData Name=\"TargetUserName\"\u003e-\u003c/Data\u003e\u003cData Name=\"TargetDomainName\"\u003e-\u003c/Data\u003e\u003cData Name=\"TargetLogonId\"\u003e0x0\u003c/Data\u003e\u003cData Name=\"ParentProcessName\"\u003eC:\\Windows\\System32\\SearchIndexer.exe\u003c/Data\u003e\u003cData Name=\"MandatoryLabel\"\u003eS-1-16-16384\u003c/Data\u003e\u003c/EventData\u003e","Task":13312,"SubjectUserSid":"S-1-5-18","SubjectUserName":"FLAREVM$","SubjectDomainName":"WORKGROUP","SubjectLogonId":"0x3e7","NewProcessId":"0x297c","NewProcessName":"C:\\Windows\\System32\\SearchProtocolHost.exe","TokenElevationType":"%%1936","ProcessId":"0x1c58","CommandLine":"","TargetUserSid":"S-1-0-0","TargetUserName":"-","TargetDomainName":"-","TargetLogonId":"0x0","ParentProcessName":"C:\\Windows\\System32\\SearchIndexer.exe","MandatoryLabel":"S-1-16-16384"},{"EventSourceName":"Microsoft-Windows-Security-Auditing","Provider":"Microsoft-Windows-Security-Auditing","ProviderGuid":"{54849625-5478-4994-a5ba-3e3b0328c30d}","Level":"0","Keywords":"0x8020000000000000","Channel":"Security","Computer":"FlareVM","TimeCreated":"2023-03-02T11:39:40.541Z","TimeGenerated":"2023-03-02T04:39:40.541Z","EventRecordID":"287864","EventID":4688,"Message":"A new process has been created.\r\n\r\nCreator Subject:\r\n\tSecurity ID:\t\tS-1-5-18\r\n\tAccount Name:\t\tFLAREVM$\r\n\tAccount Domain:\t\tWORKGROUP\r\n\tLogon ID:\t\t0x3E7\r\n\r\nTarget Subject:\r\n\tSecurity ID:\t\tS-1-0-0\r\n\tAccount Name:\t\t-\r\n\tAccount Domain:\t\t-\r\n\tLogon ID:\t\t0x0\r\n\r\nProcess Information:\r\n\tNew Process ID:\t\t0x1c78\r\n\tNew Process Name:\tC:\\Windows\\System32\\SearchFilterHost.exe\r\n\tToken Elevation Type:\t%%1936\r\n\tMandatory Label:\t\tS-1-16-8192\r\n\tCreator Process ID:\t0x1c58\r\n\tCreator Process Name:\tC:\\Windows\\System32\\SearchIndexer.exe\r\n\tProcess Command Line:\t\r\n\r\nToken Elevation Type indicates the type of token that was assigned to the new process in accordance with User Account Control policy.\r\n\r\nType 1 is a full token with no privileges removed or groups disabled.  A full token is only used if User Account Control is disabled or if the user is the built-in Administrator account or a service account.\r\n\r\nType 2 is an elevated token with no privileges removed or groups disabled.  An elevated token is used when User Account Control is enabled and the user chooses to start the program using Run as administrator.  An elevated token is also used when an application is configured to always require administrative privilege or to always require maximum privilege, and the user is a member of the Administrators group.\r\n\r\nType 3 is a limited token with administrative privileges removed and administrative groups disabled.  The limited token is used when User Account Control is enabled, the application does not require administrative privilege, and the user does not choose to start the program using Run as administrator.","EventData":"\u003cEventData xmlns=\"http://schemas.microsoft.com/win/2004/08/events/event\"\u003e\u003cData Name=\"SubjectUserSid\"\u003eS-1-5-18\u003c/Data\u003e\u003cData Name=\"SubjectUserName\"\u003eFLAREVM$\u003c/Data\u003e\u003cData Name=\"SubjectDomainName\"\u003eWORKGROUP\u003c/Data\u003e\u003cData Name=\"SubjectLogonId\"\u003e0x3e7\u003c/Data\u003e\u003cData Name=\"NewProcessId\"\u003e0x1c78\u003c/Data\u003e\u003cData Name=\"NewProcessName\"\u003eC:\\Windows\\System32\\SearchFilterHost.exe\u003c/Data\u003e\u003cData Name=\"TokenElevationType\"\u003e%%1936\u003c/Data\u003e\u003cData Name=\"ProcessId\"\u003e0x1c58\u003c/Data\u003e\u003cData Name=\"CommandLine\"\u003e\u003c/Data\u003e\u003cData Name=\"TargetUserSid\"\u003eS-1-0-0\u003c/Data\u003e\u003cData Name=\"TargetUserName\"\u003e-\u003c/Data\u003e\u003cData Name=\"TargetDomainName\"\u003e-\u003c/Data\u003e\u003cData Name=\"TargetLogonId\"\u003e0x0\u003c/Data\u003e\u003cData Name=\"ParentProcessName\"\u003eC:\\Windows\\System32\\SearchIndexer.exe\u003c/Data\u003e\u003cData Name=\"MandatoryLabel\"\u003eS-1-16-8192\u003c/Data\u003e\u003c/EventData\u003e","Task":13312,"SubjectUserSid":"S-1-5-18","SubjectUserName":"FLAREVM$","SubjectDomainName":"WORKGROUP","SubjectLogonId":"0x3e7","NewProcessId":"0x1c78","NewProcessName":"C:\\Windows\\System32\\SearchFilterHost.exe","TokenElevationType":"%%1936","ProcessId":"0x1c58","CommandLine":"","TargetUserSid":"S-1-0-0","TargetUserName":"-","TargetDomainName":"-","TargetLogonId":"0x0","ParentProcessName":"C:\\Windows\\System32\\SearchIndexer.exe","MandatoryLabel":"S-1-16-8192"},{"EventSourceName":"Microsoft-Windows-Security-Auditing","Provider":"Microsoft-Windows-Security-Auditing","ProviderGuid":"{54849625-5478-4994-a5ba-3e3b0328c30d}","Level":"0","Keywords":"0x8020000000000000","Channel":"Security","Computer":"FlareVM","TimeCreated":"2023-03-02T11:39:53.384Z","TimeGenerated":"2023-03-02T04:39:53.384Z","EventRecordID":"287865","EventID":4798,"Message":"A user\u0027s local group membership was enumerated.\r\n\r\nSubject:\r\n\tSecurity ID:\t\tS-1-5-21-2199682790-2533951109-4136935257-1001\r\n\tAccount Name:\t\tmalware\r\n\tAccount Domain:\t\tFLAREVM\r\n\tLogon ID:\t\t0xDFD96\r\n\r\nUser:\r\n\tSecurity ID:\t\tS-1-5-21-2199682790-2533951109-4136935257-1001\r\n\tAccount Name:\t\tmalware\r\n\tAccount Domain:\t\tFLAREVM\r\n\r\nProcess Information:\r\n\tProcess ID:\t\t0x21a8\r\n\tProcess Name:\t\tC:\\Windows\\System32\\mmc.exe","EventData":"\u003cEventData xmlns=\"http://schemas.microsoft.com/win/2004/08/events/event\"\u003e\u003cData Name=\"TargetUserName\"\u003emalware\u003c/Data\u003e\u003cData Name=\"TargetDomainName\"\u003eFLAREVM\u003c/Data\u003e\u003cData Name=\"TargetSid\"\u003eS-1-5-21-2199682790-2533951109-4136935257-1001\u003c/Data\u003e\u003cData Name=\"SubjectUserSid\"\u003eS-1-5-21-2199682790-2533951109-4136935257-1001\u003c/Data\u003e\u003cData Name=\"SubjectUserName\"\u003emalware\u003c/Data\u003e\u003cData Name=\"SubjectDomainName\"\u003eFLAREVM\u003c/Data\u003e\u003cData Name=\"SubjectLogonId\"\u003e0xdfd96\u003c/Data\u003e\u003cData Name=\"CallerProcessId\"\u003e0x21a8\u003c/Data\u003e\u003cData Name=\"CallerProcessName\"\u003eC:\\Windows\\System32\\mmc.exe\u003c/Data\u003e\u003c/EventData\u003e","Task":13824,"TargetUserName":"malware","TargetDomainName":"FLAREVM","TargetSid":"S-1-5-21-2199682790-2533951109-4136935257-1001","SubjectUserSid":"S-1-5-21-2199682790-2533951109-4136935257-1001","SubjectUserName":"malware","SubjectDomainName":"FLAREVM","SubjectLogonId":"0xdfd96","CallerProcessId":"0x21a8","CallerProcessName":"C:\\Windows\\System32\\mmc.exe"},{"EventSourceName":"Microsoft-Windows-Security-Auditing","Provider":"Microsoft-Windows-Security-Auditing","ProviderGuid":"{54849625-5478-4994-a5ba-3e3b0328c30d}","Level":"0","Keywords":"0x8020000000000000","Channel":"Security","Computer":"FlareVM","TimeCreated":"2023-03-02T11:40:02.186Z","TimeGenerated":"2023-03-02T04:40:02.186Z","EventRecordID":"287866","EventID":4688,"Message":"A new process has been created.\r\n\r\nCreator Subject:\r\n\tSecurity ID:\t\tS-1-5-18\r\n\tAccount Name:\t\tFLAREVM$\r\n\tAccount Domain:\t\tWORKGROUP\r\n\tLogon ID:\t\t0x3E7\r\n\r\nTarget Subject:\r\n\tSecurity ID:\t\tS-1-5-21-2199682790-2533951109-4136935257-1001\r\n\tAccount Name:\t\tmalware\r\n\tAccount Domain:\t\tFLAREVM\r\n\tLogon ID:\t\t0xDFDD5\r\n\r\nProcess Information:\r\n\tNew Process ID:\t\t0x13a8\r\n\tNew Process Name:\tC:\\Windows\\System32\\dllhost.exe\r\n\tToken Elevation Type:\t%%1938\r\n\tMandatory Label:\t\tS-1-16-8192\r\n\tCreator Process ID:\t0x364\r\n\tCreator Process Name:\tC:\\Windows\\System32\\svchost.exe\r\n\tProcess Command Line:\t\r\n\r\nToken Elevation Type indicates the type of token that was assigned to the new process in accordance with User Account Control policy.\r\n\r\nType 1 is a full token with no privileges removed or groups disabled.  A full token is only used if User Account Control is disabled or if the user is the built-in Administrator account or a service account.\r\n\r\nType 2 is an elevated token with no privileges removed or groups disabled.  An elevated token is used when User Account Control is enabled and the user chooses to start the program using Run as administrator.  An elevated token is also used when an application is configured to always require administrative privilege or to always require maximum privilege, and the user is a member of the Administrators group.\r\n\r\nType 3 is a limited token with administrative privileges removed and administrative groups disabled.  The limited token is used when User Account Control is enabled, the application does not require administrative privilege, and the user does not choose to start the program using Run as administrator.","EventData":"\u003cEventData xmlns=\"http://schemas.microsoft.com/win/2004/08/events/event\"\u003e\u003cData Name=\"SubjectUserSid\"\u003eS-1-5-18\u003c/Data\u003e\u003cData Name=\"SubjectUserName\"\u003eFLAREVM$\u003c/Data\u003e\u003cData Name=\"SubjectDomainName\"\u003eWORKGROUP\u003c/Data\u003e\u003cData Name=\"SubjectLogonId\"\u003e0x3e7\u003c/Data\u003e\u003cData Name=\"NewProcessId\"\u003e0x13a8\u003c/Data\u003e\u003cData Name=\"NewProcessName\"\u003eC:\\Windows\\System32\\dllhost.exe\u003c/Data\u003e\u003cData Name=\"TokenElevationType\"\u003e%%1938\u003c/Data\u003e\u003cData Name=\"ProcessId\"\u003e0x364\u003c/Data\u003e\u003cData Name=\"CommandLine\"\u003e\u003c/Data\u003e\u003cData Name=\"TargetUserSid\"\u003eS-1-5-21-2199682790-2533951109-4136935257-1001\u003c/Data\u003e\u003cData Name=\"TargetUserName\"\u003emalware\u003c/Data\u003e\u003cData Name=\"TargetDomainName\"\u003eFLAREVM\u003c/Data\u003e\u003cData Name=\"TargetLogonId\"\u003e0xdfdd5\u003c/Data\u003e\u003cData Name=\"ParentProcessName\"\u003eC:\\Windows\\System32\\svchost.exe\u003c/Data\u003e\u003cData Name=\"MandatoryLabel\"\u003eS-1-16-8192\u003c/Data\u003e\u003c/EventData\u003e","Task":13312,"SubjectUserSid":"S-1-5-18","SubjectUserName":"FLAREVM$","SubjectDomainName":"WORKGROUP","SubjectLogonId":"0x3e7","NewProcessId":"0x13a8","NewProcessName":"C:\\Windows\\System32\\dllhost.exe","TokenElevationType":"%%1938","ProcessId":"0x364","CommandLine":"","TargetUserSid":"S-1-5-21-2199682790-2533951109-4136935257-1001","TargetUserName":"malware","TargetDomainName":"FLAREVM","TargetLogonId":"0xdfdd5","ParentProcessName":"C:\\Windows\\System32\\svchost.exe","MandatoryLabel":"S-1-16-8192"}]
