[{"EventSourceName":"Microsoft-Windows-Security-Auditing","Provider":"Microsoft-Windows-Security-Auditing","ProviderGuid":"{54849625-5478-4994-a5ba-3e3b0328c30d}","Level":"0","Keywords":"0x8020000000000000","Channel":"Security","Computer":"FlareVM","TimeCreated":"2023-02-28T10:54:50.730Z","TimeGenerated":"2023-02-28T03:54:50.730Z","EventRecordID":"288259","EventID":4672,"Message":"Special privileges assigned to new logon.\r\n\r\nSubject:\r\n\tSecurity ID:\t\tS-1-5-18\r\n\tAccount Name:\t\tSYSTEM\r\n\tAccount Domain:\t\tNT AUTHORITY\r\n\tLogon ID:\t\t0x3E7\r\n\r\nPrivileges:\t\tSeAssignPrimaryTokenPrivilege\r\n\t\t\tSeTcbPrivilege\r\n\t\t\tSeSecurityPrivilege\r\n\t\t\tSeTakeOwnershipPrivilege\r\n\t\t\tSeLoadDriverPrivilege\r\n\t\t\tSeBackupPrivilege\r\n\t\t\tSeRestorePrivilege\r\n\t\t\tSeDebugPrivilege\r\n\t\t\tSeAuditPrivilege\r\n\t\t\tSeSystemEnvironmentPrivilege\r\n\t\t\tSeImpersonatePrivilege\r\n\t\t\tSeDelegateSessionUserImpersonatePrivilege","EventData":"\u003cEventData xmlns=\"http://schemas.microsoft.com/win/2004/08/events/event\"\u003e\u003cData Name=\"SubjectUserSid\"\u003eS-1-5-18\u003c/Data\u003e\u003cData Name=\"SubjectUserName\"\u003eSYSTEM\u003c/Data\u003e\u003cData Name=\"SubjectDomainName\"\u003eNT AUTHORITY\u003c/Data\u003e\u003cData Name=\"SubjectLogonId\"\u003e0x3e7\u003c/Data\u003e\u003cData Name=\"PrivilegeList\"\u003eSeAssignPrimaryTokenPrivilege\n\t\t\tSeTcbPrivilege\n\t\t\tSeSecurityPrivilege\n\t\t\tSeTakeOwnershipPrivilege\n\t\t\tSeLoadDriverPrivilege\n\t\t\tSeBackupPrivilege\n\t\t\tSeRestorePrivilege\n\t\t\tSeDebugPrivilege\n\t\t\tSeAuditPrivilege\n\t\t\tSeSystemEnvironmentPrivilege\n\t\t\tSeImpersonatePrivilege\n\t\t\tSeDelegateSessionUserImpersonatePrivilege\u003c/Data\u003e\u003c/EventData\u003e","Task":12548,"SubjectUserSid":"S-1-5-18","SubjectUserName":"SYSTEM","SubjectDomainName":"NT AUTHORITY","SubjectLogonId":"0x3e7","PrivilegeList":"SeAssignPrimaryTokenPrivilege\r\n\t\t\tSeTcbPrivilege\r\n\t\t\tSeSecurityPrivilege\r\n\t\t\tSeTakeOwnershipPrivilege\r\n\t\t\tSeLoadDriverPrivilege\r\n\t\t\tSeBackupPrivilege\r\n\t\t\tSeRestorePrivilege\r\n\t\t\tSeDebugPrivilege\r\n\t\t\tSeAuditPrivilege\r\n\t\t\tSeSystemEnvironmentPrivilege\r\n\t\t\tSeImpersonatePrivilege\r\n\t\t\tSeDelegateSessionUserImpersonatePrivilege"},{"EventSourceName":"Microsoft-Windows-Security-Auditing","Provider":"Microsoft-Windows-Security-Auditing","ProviderGuid":"{54849625-5478-4994-a5ba-3e3b0328c30d}","Level":"0","Keywords":"0x8020000000000000","Channel":"Security","Computer":"FlareVM","TimeCreated":"2023-02-28T10:54:50.732Z","TimeGenerated":"2023-02-28T03:54:50.732Z","EventRecordID":"288260","EventID":4688,"Message":"A new process has been created.\r\n\r\nCreator Subject:\r\n\tSecurity ID:\t\tS-1-5-18\r\n\tAccount Name:\t\tFLAREVM$\r\n\tAccount Domain:\t\tWORKGROUP\r\n\tLogon ID:\t\t0x3E7\r\n\r\nTarget Subject:\r\n\tSecurity ID:\t\tS-1-0-0\r\n\tAccount Name:\t\t-\r\n\tAccount Domain:\t\t-\r\n\tLogon ID:\t\t0x0\r\n\r\nProcess Information:\r\n\tNew Process ID:\t\t0x1a10\r\n\tNew Process Name:\tC:\\Windows\\System32\\svchost.exe\r\n\tToken Elevation Type:\t%%1936\r\n\tMandatory Label:\t\tS-1-16-16384\r\n\tCreator Process ID:\t0x280\r\n\tCreator Process Name:\tC:\\Windows\\System32\\services.exe\r\n\tProcess Command Line:\t\r\n\r\nToken Elevation Type indicates the type of token that was assigned to the new process in accordance with User Account Control policy.\r\n\r\nType 1 is a full token with no privileges removed or groups disabled.  A full token is only used if User Account Control is disabled or if the user is the built-in Administrator account or a service account.\r\n\r\nType 2 is an elevated token with no privileges removed or groups disabled.  An elevated token is used when User Account Control is enabled and the user chooses to start the program using Run as administrator.  An elevated token is also used when an application is configured to always require administrative privilege or to always require maximum privilege, and the user is a member of the Administrators group.\r\n\r\nType 3 is a limited token with administrative privileges removed and administrative groups disabled.  The limited token is used when User Account Control is enabled, the application does not require administrative privilege, and the user does not choose to start the program using Run as administrator.","EventData":"\u003cEventData xmlns=\"http://schemas.microsoft.com/win/2004/08/events/event\"\u003e\u003cData Name=\"SubjectUserSid\"\u003eS-1-5-18\u003c/Data\u003e\u003cData Name=\"SubjectUserName\"\u003eFLAREVM$\u003c/Data\u003e\u003cData Name=\"SubjectDomainName\"\u003eWORKGROUP\u003c/Data\u003e\u003cData Name=\"SubjectLogonId\"\u003e0x3e7\u003c/Data\u003e\u003cData Name=\"NewProcessId\"\u003e0x1a10\u003c/Data\u003e\u003cData Name=\"NewProcessName\"\u003eC:\\Windows\\System32\\svchost.exe\u003c/Data\u003e\u003cData Name=\"TokenElevationType\"\u003e%%1936\u003c/Data\u003e\u003cData Name=\"ProcessId\"\u003e0x280\u003c/Data\u003e\u003cData Name=\"CommandLine\"\u003e\u003c/Data\u003e\u003cData Name=\"TargetUserSid\"\u003eS-1-0-0\u003c/Data\u003e\u003cData Name=\"TargetUserName\"\u003e-\u003c/Data\u003e\u003cData Name=\"TargetDomainName\"\u003e-\u003c/Data\u003e\u003cData Name=\"TargetLogonId\"\u003e0x0\u003c/Data\u003e\u003cData Name=\"ParentProcessName\"\u003eC:\\Windows\\System32\\services.exe\u003c/Data\u003e\u003cData Name=\"MandatoryLabel\"\u003eS-1-16-16384\u003c/Data\u003e\u003c/EventData\u003e","Task":13312,"SubjectUserSid":"S-1-5-18","SubjectUserName":"FLAREVM$","SubjectDomainName":"WORKGROUP","SubjectLogonId":"0x3e7","NewProcessId":"0x1a10","NewProcessName":"C:\\Windows\\System32\\svchost.exe","TokenElevationType":"%%1936","ProcessId":"0x280","CommandLine":"","TargetUserSid":"S-1-0-0","TargetUserName":"-","TargetDomainName":"-","TargetLogonId":"0x0","ParentProcessName":"C:\\Windows\\System32\\services.exe","MandatoryLabel":"S-1-16-16384"},{"EventSourceName":"Microsoft-Windows-Security-Auditing","Provider":"Microsoft-Windows-Security-Auditing","ProviderGuid":"{54849625-5478-4994-a5ba-3e3b0328c30d}","Level":"0","Keywords":"0x8020000000000000","Channel":"Security","Computer":"FlareVM","TimeCreated":"2023-02-28T10:54:51.477Z","TimeGenerated":"2023-02-28T03:54:51.477Z","EventRecordID":"288261","EventID":4688,"Message":"A new process has been created.\r\n\r\nCreator Subject:\r\n\tSecurity ID:\t\tS-1-5-21-2199682790-2533951109-4136935257-1001\r\n\tAccount Name:\t\tmalware\r\n\tAccount Domain:\t\tFLAREVM\r\n\tLogon ID:\t\t0x977DE\r\n\r\nTarget Subject:\r\n\tSecurity ID:\t\tS-1-0-0\r\n\tAccount Name:\t\t-\r\n\tAccount Domain:\t\t-\r\n\tLogon ID:\t\t0x0\r\n\r\nProcess Information:\r\n\tNew Process ID:\t\t0x1468\r\n\tNew Process Name:\tC:\\Windows\\System32\\HOSTNAME.EXE\r\n\tToken Elevation Type:\t%%1937\r\n\tMandatory Label:\t\tS-1-16-12288\r\n\tCreator Process ID:\t0x2340\r\n\tCreator Process Name:\tC:\\Windows\\System32\\WindowsPowerShell\\v1.0\\powershell.exe\r\n\tProcess Command Line:\t\r\n\r\nToken Elevation Type indicates the type of token that was assigned to the new process in accordance with User Account Control policy.\r\n\r\nType 1 is a full token with no privileges removed or groups disabled.  A full token is only used if User Account Control is disabled or if the user is the built-in Administrator account or a service account.\r\n\r\nType 2 is an elevated token with no privileges removed or groups disabled.  An elevated token is used when User Account Control is enabled and the user chooses to start the program using Run as administrator.  An elevated token is also used when an application is configured to always require administrative privilege or to always require maximum privilege, and the user is a member of the Administrators group.\r\n\r\nType 3 is a limited token with administrative privileges removed and administrative groups disabled.  The limited token is used when User Account Control is enabled, the application does not require administrative privilege, and the user does not choose to start the program using Run as administrator.","EventData":"\u003cEventData xmlns=\"http://schemas.microsoft.com/win/2004/08/events/event\"\u003e\u003cData Name=\"SubjectUserSid\"\u003eS-1-5-21-2199682790-2533951109-4136935257-1001\u003c/Data\u003e\u003cData Name=\"SubjectUserName\"\u003emalware\u003c/Data\u003e\u003cData Name=\"SubjectDomainName\"\u003eFLAREVM\u003c/Data\u003e\u003cData Name=\"SubjectLogonId\"\u003e0x977de\u003c/Data\u003e\u003cData Name=\"NewProcessId\"\u003e0x1468\u003c/Data\u003e\u003cData Name=\"NewProcessName\"\u003eC:\\Windows\\System32\\HOSTNAME.EXE\u003c/Data\u003e\u003cData Name=\"TokenElevationType\"\u003e%%1937\u003c/Data\u003e\u003cData Name=\"ProcessId\"\u003e0x2340\u003c/Data\u003e\u003cData Name=\"CommandLine\"\u003e\u003c/Data\u003e\u003cData Name=\"TargetUserSid\"\u003eS-1-0-0\u003c/Data\u003e\u003cData Name=\"TargetUserName\"\u003e-\u003c/Data\u003e\u003cData Name=\"TargetDomainName\"\u003e-\u003c/Data\u003e\u003cData Name=\"TargetLogonId\"\u003e0x0\u003c/Data\u003e\u003cData Name=\"ParentProcessName\"\u003eC:\\Windows\\System32\\WindowsPowerShell\\v1.0\\powershell.exe\u003c/Data\u003e\u003cData Name=\"MandatoryLabel\"\u003eS-1-16-12288\u003c/Data\u003e\u003c/EventData\u003e","Task":13312,"SubjectUserSid":"S-1-5-21-2199682790-2533951109-4136935257-1001","SubjectUserName":"malware","SubjectDomainName":"FLAREVM","SubjectLogonId":"0x977de","NewProcessId":"0x1468","NewProcessName":"C:\\Windows\\System32\\HOSTNAME.EXE","TokenElevationType":"%%1937","ProcessId":"0x2340","CommandLine":"","TargetUserSid":"S-1-0-0","TargetUserName":"-","TargetDomainName":"-","TargetLogonId":"0x0","ParentProcessName":"C:\\Windows\\System32\\WindowsPowerShell\\v1.0\\powershell.exe","MandatoryLabel":"S-1-16-12288"},{"EventSourceName":"Microsoft-Windows-Security-Auditing","Provider":"Microsoft-Windows-Security-Auditing","ProviderGuid":"{54849625-5478-4994-a5ba-3e3b0328c30d}","Level":"0","Keywords":"0x8020000000000000","Channel":"Security","Computer":"FlareVM","TimeCreated":"2023-02-28T10:54:51.490Z","TimeGenerated":"2023-02-28T03:54:51.490Z","EventRecordID":"288262","EventID":4688,"Message":"A new process has been created.\r\n\r\nCreator Subject:\r\n\tSecurity ID:\t\tS-1-5-21-2199682790-2533951109-4136935257-1001\r\n\tAccount Name:\t\tmalware\r\n\tAccount Domain:\t\tFLAREVM\r\n\tLogon ID:\t\t0x977DE\r\n\r\nTarget Subject:\r\n\tSecurity ID:\t\tS-1-0-0\r\n\tAccount Name:\t\t-\r\n\tAccount Domain:\t\t-\r\n\tLogon ID:\t\t0x0\r\n\r\nProcess Information:\r\n\tNew Process ID:\t\t0x2228\r\n\tNew Process Name:\tC:\\Windows\\System32\\whoami.exe\r\n\tToken Elevation Type:\t%%1937\r\n\tMandatory Label:\t\tS-1-16-12288\r\n\tCreator Process ID:\t0x2340\r\n\tCreator Process Name:\tC:\\Windows\\System32\\WindowsPowerShell\\v1.0\\powershell.exe\r\n\tProcess Command Line:\t\r\n\r\nToken Elevation Type indicates the type of token that was assigned to the new process in accordance with User Account Control policy.\r\n\r\nType 1 is a full token with no privileges removed or groups disabled.  A full token is only used if User Account Control is disabled or if the user is the built-in Administrator account or a service account.\r\n\r\nType 2 is an elevated token with no privileges removed or groups disabled.  An elevated token is used when User Account Control is enabled and the user chooses to start the program using Run as administrator.  An elevated token is also used when an application is configured to always require administrative privilege or to always require maximum privilege, and the user is a member of the Administrators group.\r\n\r\nType 3 is a limited token with administrative privileges removed and administrative groups disabled.  The limited token is used when User Account Control is enabled, the application does not require administrative privilege, and the user does not choose to start the program using Run as administrator.","EventData":"\u003cEventData xmlns=\"http://schemas.microsoft.com/win/2004/08/events/event\"\u003e\u003cData Name=\"SubjectUserSid\"\u003eS-1-5-21-2199682790-2533951109-4136935257-1001\u003c/Data\u003e\u003cData Name=\"SubjectUserName\"\u003emalware\u003c/Data\u003e\u003cData Name=\"SubjectDomainName\"\u003eFLAREVM\u003c/Data\u003e\u003cData Name=\"SubjectLogonId\"\u003e0x977de\u003c/Data\u003e\u003cData Name=\"NewProcessId\"\u003e0x2228\u003c/Data\u003e\u003cData Name=\"NewProcessName\"\u003eC:\\Windows\\System32\\whoami.exe\u003c/Data\u003e\u003cData Name=\"TokenElevationType\"\u003e%%1937\u003c/Data\u003e\u003cData Name=\"ProcessId\"\u003e0x2340\u003c/Data\u003e\u003cData Name=\"CommandLine\"\u003e\u003c/Data\u003e\u003cData Name=\"TargetUserSid\"\u003eS-1-0-0\u003c/Data\u003e\u003cData Name=\"TargetUserName\"\u003e-\u003c/Data\u003e\u003cData Name=\"TargetDomainName\"\u003e-\u003c/Data\u003e\u003cData Name=\"TargetLogonId\"\u003e0x0\u003c/Data\u003e\u003cData Name=\"ParentProcessName\"\u003eC:\\Windows\\System32\\WindowsPowerShell\\v1.0\\powershell.exe\u003c/Data\u003e\u003cData Name=\"MandatoryLabel\"\u003eS-1-16-12288\u003c/Data\u003e\u003c/EventData\u003e","Task":13312,"SubjectUserSid":"S-1-5-21-2199682790-2533951109-4136935257-1001","SubjectUserName":"malware","SubjectDomainName":"FLAREVM","SubjectLogonId":"0x977de","NewProcessId":"0x2228","NewProcessName":"C:\\Windows\\System32\\whoami.exe","TokenElevationType":"%%1937","ProcessId":"0x2340","CommandLine":"","TargetUserSid":"S-1-0-0","TargetUserName":"-","TargetDomainName":"-","TargetLogonId":"0x0","ParentProcessName":"C:\\Windows\\System32\\WindowsPowerShell\\v1.0\\powershell.exe","MandatoryLabel":"S-1-16-12288"},{"EventSourceName":"Microsoft-Windows-Security-Auditing","Provider":"Microsoft-Windows-Security-Auditing","ProviderGuid":"{54849625-5478-4994-a5ba-3e3b0328c30d}","Level":"0","Keywords":"0x8020000000000000","Channel":"Security","Computer":"FlareVM","TimeCreated":"2023-02-28T10:54:51.624Z","TimeGenerated":"2023-02-28T03:54:51.624Z","EventRecordID":"288263","EventID":4688,"Message":"A new process has been created.\r\n\r\nCreator Subject:\r\n\tSecurity ID:\t\tS-1-5-21-2199682790-2533951109-4136935257-1001\r\n\tAccount Name:\t\tmalware\r\n\tAccount Domain:\t\tFLAREVM\r\n\tLogon ID:\t\t0x977DE\r\n\r\nTarget Subject:\r\n\tSecurity ID:\t\tS-1-0-0\r\n\tAccount Name:\t\t-\r\n\tAccount Domain:\t\t-\r\n\tLogon ID:\t\t0x0\r\n\r\nProcess Information:\r\n\tNew Process ID:\t\t0x1548\r\n\tNew Process Name:\tC:\\Windows\\System32\\WindowsPowerShell\\v1.0\\powershell.exe\r\n\tToken Elevation Type:\t%%1937\r\n\tMandatory Label:\t\tS-1-16-12288\r\n\tCreator Process ID:\t0x2340\r\n\tCreator Process Name:\tC:\\Windows\\System32\\WindowsPowerShell\\v1.0\\powershell.exe\r\n\tProcess Command Line:\t\r\n\r\nToken Elevation Type indicates the type of token that was assigned to the new process in accordance with User Account Control policy.\r\n\r\nType 1 is a full token with no privileges removed or groups disabled.  A full token is only used if User Account Control is disabled or if the user is the built-in Administrator account or a service account.\r\n\r\nType 2 is an elevated token with no privileges removed or groups disabled.  An elevated token is used when User Account Control is enabled and the user chooses to start the program using Run as administrator.  An elevated token is also used when an application is configured to always require administrative privilege or to always require maximum privilege, and the user is a member of the Administrators group.\r\n\r\nType 3 is a limited token with administrative privileges removed and administrative groups disabled.  The limited token is used when User Account Control is enabled, the application does not require administrative privilege, and the user does not choose to start the program using Run as administrator.","EventData":"\u003cEventData xmlns=\"http://schemas.microsoft.com/win/2004/08/events/event\"\u003e\u003cData Name=\"SubjectUserSid\"\u003eS-1-5-21-2199682790-2533951109-4136935257-1001\u003c/Data\u003e\u003cData Name=\"SubjectUserName\"\u003emalware\u003c/Data\u003e\u003cData Name=\"SubjectDomainName\"\u003eFLAREVM\u003c/Data\u003e\u003cData Name=\"SubjectLogonId\"\u003e0x977de\u003c/Data\u003e\u003cData Name=\"NewProcessId\"\u003e0x1548\u003c/Data\u003e\u003cData Name=\"NewProcessName\"\u003eC:\\Windows\\System32\\WindowsPowerShell\\v1.0\\powershell.exe\u003c/Data\u003e\u003cData Name=\"TokenElevationType\"\u003e%%1937\u003c/Data\u003e\u003cData Name=\"ProcessId\"\u003e0x2340\u003c/Data\u003e\u003cData Name=\"CommandLine\"\u003e\u003c/Data\u003e\u003cData Name=\"TargetUserSid\"\u003eS-1-0-0\u003c/Data\u003e\u003cData Name=\"TargetUserName\"\u003e-\u003c/Data\u003e\u003cData Name=\"TargetDomainName\"\u003e-\u003c/Data\u003e\u003cData Name=\"TargetLogonId\"\u003e0x0\u003c/Data\u003e\u003cData Name=\"ParentProcessName\"\u003eC:\\Windows\\System32\\WindowsPowerShell\\v1.0\\powershell.exe\u003c/Data\u003e\u003cData Name=\"MandatoryLabel\"\u003eS-1-16-12288\u003c/Data\u003e\u003c/EventData\u003e","Task":13312,"SubjectUserSid":"S-1-5-21-2199682790-2533951109-4136935257-1001","SubjectUserName":"malware","SubjectDomainName":"FLAREVM","SubjectLogonId":"0x977de","NewProcessId":"0x1548","NewProcessName":"C:\\Windows\\System32\\WindowsPowerShell\\v1.0\\powershell.exe","TokenElevationType":"%%1937","ProcessId":"0x2340","CommandLine":"","TargetUserSid":"S-1-0-0","TargetUserName":"-","TargetDomainName":"-","TargetLogonId":"0x0","ParentProcessName":"C:\\Windows\\System32\\WindowsPowerShell\\v1.0\\powershell.exe","MandatoryLabel":"S-1-16-12288"},{"EventSourceName":"Microsoft-Windows-Security-Auditing","Provider":"Microsoft-Windows-Security-Auditing","ProviderGuid":"{54849625-5478-4994-a5ba-3e3b0328c30d}","Level":"0","Keywords":"0x8020000000000000","Channel":"Security","Computer":"FlareVM","TimeCreated":"2023-02-28T10:54:51.628Z","TimeGenerated":"2023-02-28T03:54:51.628Z","EventRecordID":"288264","EventID":4688,"Message":"A new process has been created.\r\n\r\nCreator Subject:\r\n\tSecurity ID:\t\tS-1-5-21-2199682790-2533951109-4136935257-1001\r\n\tAccount Name:\t\tmalware\r\n\tAccount Domain:\t\tFLAREVM\r\n\tLogon ID:\t\t0x977DE\r\n\r\nTarget Subject:\r\n\tSecurity ID:\t\tS-1-0-0\r\n\tAccount Name:\t\t-\r\n\tAccount Domain:\t\t-\r\n\tLogon ID:\t\t0x0\r\n\r\nProcess Information:\r\n\tNew Process ID:\t\t0x2054\r\n\tNew Process Name:\tC:\\Windows\\System32\\conhost.exe\r\n\tToken Elevation Type:\t%%1937\r\n\tMandatory Label:\t\tS-1-16-12288\r\n\tCreator Process ID:\t0x1548\r\n\tCreator Process Name:\tC:\\Windows\\System32\\WindowsPowerShell\\v1.0\\powershell.exe\r\n\tProcess Command Line:\t\r\n\r\nToken Elevation Type indicates the type of token that was assigned to the new process in accordance with User Account Control policy.\r\n\r\nType 1 is a full token with no privileges removed or groups disabled.  A full token is only used if User Account Control is disabled or if the user is the built-in Administrator account or a service account.\r\n\r\nType 2 is an elevated token with no privileges removed or groups disabled.  An elevated token is used when User Account Control is enabled and the user chooses to start the program using Run as administrator.  An elevated token is also used when an application is configured to always require administrative privilege or to always require maximum privilege, and the user is a member of the Administrators group.\r\n\r\nType 3 is a limited token with administrative privileges removed and administrative groups disabled.  The limited token is used when User Account Control is enabled, the application does not require administrative privilege, and the user does not choose to start the program using Run as administrator.","EventData":"\u003cEventData xmlns=\"http://schemas.microsoft.com/win/2004/08/events/event\"\u003e\u003cData Name=\"SubjectUserSid\"\u003eS-1-5-21-2199682790-2533951109-4136935257-1001\u003c/Data\u003e\u003cData Name=\"SubjectUserName\"\u003emalware\u003c/Data\u003e\u003cData Name=\"SubjectDomainName\"\u003eFLAREVM\u003c/Data\u003e\u003cData Name=\"SubjectLogonId\"\u003e0x977de\u003c/Data\u003e\u003cData Name=\"NewProcessId\"\u003e0x2054\u003c/Data\u003e\u003cData Name=\"NewProcessName\"\u003eC:\\Windows\\System32\\conhost.exe\u003c/Data\u003e\u003cData Name=\"TokenElevationType\"\u003e%%1937\u003c/Data\u003e\u003cData Name=\"ProcessId\"\u003e0x1548\u003c/Data\u003e\u003cData Name=\"CommandLine\"\u003e\u003c/Data\u003e\u003cData Name=\"TargetUserSid\"\u003eS-1-0-0\u003c/Data\u003e\u003cData Name=\"TargetUserName\"\u003e-\u003c/Data\u003e\u003cData Name=\"TargetDomainName\"\u003e-\u003c/Data\u003e\u003cData Name=\"TargetLogonId\"\u003e0x0\u003c/Data\u003e\u003cData Name=\"ParentProcessName\"\u003eC:\\Windows\\System32\\WindowsPowerShell\\v1.0\\powershell.exe\u003c/Data\u003e\u003cData Name=\"MandatoryLabel\"\u003eS-1-16-12288\u003c/Data\u003e\u003c/EventData\u003e","Task":13312,"SubjectUserSid":"S-1-5-21-2199682790-2533951109-4136935257-1001","SubjectUserName":"malware","SubjectDomainName":"FLAREVM","SubjectLogonId":"0x977de","NewProcessId":"0x2054","NewProcessName":"C:\\Windows\\System32\\conhost.exe","TokenElevationType":"%%1937","ProcessId":"0x1548","CommandLine":"","TargetUserSid":"S-1-0-0","TargetUserName":"-","TargetDomainName":"-","TargetLogonId":"0x0","ParentProcessName":"C:\\Windows\\System32\\WindowsPowerShell\\v1.0\\powershell.exe","MandatoryLabel":"S-1-16-12288"},{"EventSourceName":"Microsoft-Windows-Security-Auditing","Provider":"Microsoft-Windows-Security-Auditing","ProviderGuid":"{54849625-5478-4994-a5ba-3e3b0328c30d}","Level":"0","Keywords":"0x8020000000000000","Channel":"Security","Computer":"FlareVM","TimeCreated":"2023-02-28T10:54:52.501Z","TimeGenerated":"2023-02-28T03:54:52.501Z","EventRecordID":"288265","EventID":4674,"Message":"An operation was attempted on a privileged object.\r\n\r\nSubject:\r\n\tSecurity ID:\t\tS-1-5-21-2199682790-2533951109-4136935257-1001\r\n\tAccount Name:\t\tmalware\r\n\tAccount Domain:\t\tFLAREVM\r\n\tLogon ID:\t\t0x977DE\r\n\r\nObject:\r\n\tObject Server:\tSecurity\r\n\tObject Type:\tMutant\r\n\tObject Name:\t\\Sessions\\1\\BaseNamedObjects\\SM0:5448:304:WilStaging_02\r\n\tObject Handle:\t0x7ec\r\n\r\nProcess Information:\r\n\tProcess ID:\t0x1548\r\n\tProcess Name:\tC:\\Windows\\System32\\WindowsPowerShell\\v1.0\\powershell.exe\r\n\r\nRequested Operation:\r\n\tDesired Access:\tDELETE\r\n\t\t\t\tREAD_CONTROL\r\n\t\t\t\tWRITE_DAC\r\n\t\t\t\tWRITE_OWNER\r\n\t\t\t\tSYNCHRONIZE\r\n\t\t\t\tQuery mutant state\r\n\t\t\t\t\r\n\tPrivileges:\t\tSeTakeOwnershipPrivilege","EventData":"\u003cEventData xmlns=\"http://schemas.microsoft.com/win/2004/08/events/event\"\u003e\u003cData Name=\"SubjectUserSid\"\u003eS-1-5-21-2199682790-2533951109-4136935257-1001\u003c/Data\u003e\u003cData Name=\"SubjectUserName\"\u003emalware\u003c/Data\u003e\u003cData Name=\"SubjectDomainName\"\u003eFLAREVM\u003c/Data\u003e\u003cData Name=\"SubjectLogonId\"\u003e0x977de\u003c/Data\u003e\u003cData Name=\"ObjectServer\"\u003eSecurity\u003c/Data\u003e\u003cData Name=\"ObjectType\"\u003eMutant\u003c/Data\u003e\u003cData Name=\"ObjectName\"\u003e\\Sessions\\1\\BaseNamedObjects\\SM0:5448:304:WilStaging_02\u003c/Data\u003e\u003cData Name=\"HandleId\"\u003e0x7ec\u003c/Data\u003e\u003cData Name=\"AccessMask\"\u003e%%1537\n\t\t\t\t%%1538\n\t\t\t\t%%1539\n\t\t\t\t%%1540\n\t\t\t\t%%1541\n\t\t\t\t%%4448\n\t\t\t\t\u003c/Data\u003e\u003cData Name=\"PrivilegeList\"\u003eSeTakeOwnershipPrivilege\u003c/Data\u003e\u003cData Name=\"ProcessId\"\u003e0x1548\u003c/Data\u003e\u003cData Name=\"ProcessName\"\u003eC:\\Windows\\System32\\WindowsPowerShell\\v1.0\\powershell.exe\u003c/Data\u003e\u003c/EventData\u003e","Task":13056,"SubjectUserSid":"S-1-5-21-2199682790-2533951109-4136935257-1001","SubjectUserName":"malware","SubjectDomainName":"FLAREVM","SubjectLogonId":"0x977de","ObjectServer":"Security","ObjectType":"Mutant","ObjectName":"\\Sessions\\1\\BaseNamedObjects\\SM0:5448:304:WilStaging_02","HandleId":"0x7ec","AccessMask":"%%1537\r\n\t\t\t\t%%1538\r\n\t\t\t\t%%1539\r\n\t\t\t\t%%1540\r\n\t\t\t\t%%1541\r\n\t\t\t\t%%4448\r\n\t\t\t\t","PrivilegeList":"SeTakeOwnershipPrivilege","ProcessId":"0x1548","ProcessName":"C:\\Windows\\System32\\WindowsPowerShell\\v1.0\\powershell.exe"},{"EventSourceName":"Microsoft-Windows-Security-Auditing","Provider":"Microsoft-Windows-Security-Auditing","ProviderGuid":"{54849625-5478-4994-a5ba-3e3b0328c30d}","Level":"0","Keywords":"0x8020000000000000","Channel":"Security","Computer":"FlareVM","TimeCreated":"2023-02-28T10:54:52.501Z","TimeGenerated":"2023-02-28T03:54:52.501Z","EventRecordID":"288266","EventID":4674,"Message":"An operation was attempted on a privileged object.\r\n\r\nSubject:\r\n\tSecurity ID:\t\tS-1-5-21-2199682790-2533951109-4136935257-1001\r\n\tAccount Name:\t\tmalware\r\n\tAccount Domain:\t\tFLAREVM\r\n\tLogon ID:\t\t0x977DE\r\n\r\nObject:\r\n\tObject Server:\tSecurity\r\n\tObject Type:\t-\r\n\tObject Name:\t-\r\n\tObject Handle:\t0x7ec\r\n\r\nProcess Information:\r\n\tProcess ID:\t0x1548\r\n\tProcess Name:\tC:\\Windows\\System32\\WindowsPowerShell\\v1.0\\powershell.exe\r\n\r\nRequested Operation:\r\n\tDesired Access:\t2031617\r\n\tPrivileges:\t\tSeTakeOwnershipPrivilege","EventData":"\u003cEventData xmlns=\"http://schemas.microsoft.com/win/2004/08/events/event\"\u003e\u003cData Name=\"SubjectUserSid\"\u003eS-1-5-21-2199682790-2533951109-4136935257-1001\u003c/Data\u003e\u003cData Name=\"SubjectUserName\"\u003emalware\u003c/Data\u003e\u003cData Name=\"SubjectDomainName\"\u003eFLAREVM\u003c/Data\u003e\u003cData Name=\"SubjectLogonId\"\u003e0x977de\u003c/Data\u003e\u003cData Name=\"ObjectServer\"\u003eSecurity\u003c/Data\u003e\u003cData Name=\"ObjectType\"\u003e-\u003c/Data\u003e\u003cData Name=\"ObjectName\"\u003e-\u003c/Data\u003e\u003cData Name=\"HandleId\"\u003e0x7ec\u003c/Data\u003e\u003cData Name=\"AccessMask\"\u003e2031617\u003c/Data\u003e\u003cData Name=\"PrivilegeList\"\u003eSeTakeOwnershipPrivilege\u003c/Data\u003e\u003cData Name=\"ProcessId\"\u003e0x1548\u003c/Data\u003e\u003cData Name=\"ProcessName\"\u003eC:\\Windows\\System32\\WindowsPowerShell\\v1.0\\powershell.exe\u003c/Data\u003e\u003c/EventData\u003e","Task":13056,"SubjectUserSid":"S-1-5-21-2199682790-2533951109-4136935257-1001","SubjectUserName":"malware","SubjectDomainName":"FLAREVM","SubjectLogonId":"0x977de","ObjectServer":"Security","ObjectType":"-","ObjectName":"-","HandleId":"0x7ec","AccessMask":"2031617","PrivilegeList":"SeTakeOwnershipPrivilege","ProcessId":"0x1548","ProcessName":"C:\\Windows\\System32\\WindowsPowerShell\\v1.0\\powershell.exe"},{"EventSourceName":"Microsoft-Windows-Security-Auditing","Provider":"Microsoft-Windows-Security-Auditing","ProviderGuid":"{54849625-5478-4994-a5ba-3e3b0328c30d}","Level":"0","Keywords":"0x8020000000000000","Channel":"Security","Computer":"FlareVM","TimeCreated":"2023-02-28T10:54:52.501Z","TimeGenerated":"2023-02-28T03:54:52.501Z","EventRecordID":"288267","EventID":4674,"Message":"An operation was attempted on a privileged object.\r\n\r\nSubject:\r\n\tSecurity ID:\t\tS-1-5-21-2199682790-2533951109-4136935257-1001\r\n\tAccount Name:\t\tmalware\r\n\tAccount Domain:\t\tFLAREVM\r\n\tLogon ID:\t\t0x977DE\r\n\r\nObject:\r\n\tObject Server:\tSecurity\r\n\tObject Type:\tSemaphore\r\n\tObject Name:\t\\Sessions\\1\\BaseNamedObjects\\SM0:5448:304:WilStaging_02_p0\r\n\tObject Handle:\t0x828\r\n\r\nProcess Information:\r\n\tProcess ID:\t0x1548\r\n\tProcess Name:\tC:\\Windows\\System32\\WindowsPowerShell\\v1.0\\powershell.exe\r\n\r\nRequested Operation:\r\n\tDesired Access:\tDELETE\r\n\t\t\t\tREAD_CONTROL\r\n\t\t\t\tWRITE_DAC\r\n\t\t\t\tWRITE_OWNER\r\n\t\t\t\tSYNCHRONIZE\r\n\t\t\t\tQuery semaphore state\r\n\t\t\t\tModify semaphore state\r\n\t\t\t\t\r\n\tPrivileges:\t\tSeTakeOwnershipPrivilege","EventData":"\u003cEventData xmlns=\"http://schemas.microsoft.com/win/2004/08/events/event\"\u003e\u003cData Name=\"SubjectUserSid\"\u003eS-1-5-21-2199682790-2533951109-4136935257-1001\u003c/Data\u003e\u003cData Name=\"SubjectUserName\"\u003emalware\u003c/Data\u003e\u003cData Name=\"SubjectDomainName\"\u003eFLAREVM\u003c/Data\u003e\u003cData Name=\"SubjectLogonId\"\u003e0x977de\u003c/Data\u003e\u003cData Name=\"ObjectServer\"\u003eSecurity\u003c/Data\u003e\u003cData Name=\"ObjectType\"\u003eSemaphore\u003c/Data\u003e\u003cData Name=\"ObjectName\"\u003e\\Sessions\\1\\BaseNamedObjects\\SM0:5448:304:WilStaging_02_p0\u003c/Data\u003e\u003cData Name=\"HandleId\"\u003e0x828\u003c/Data\u003e\u003cData Name=\"AccessMask\"\u003e%%1537\n\t\t\t\t%%1538\n\t\t\t\t%%1539\n\t\t\t\t%%1540\n\t\t\t\t%%1541\n\t\t\t\t%%4528\n\t\t\t\t%%4529\n\t\t\t\t\u003c/Data\u003e\u003cData Name=\"PrivilegeList\"\u003eSeTakeOwnershipPrivilege\u003c/Data\u003e\u003cData Name=\"ProcessId\"\u003e0x1548\u003c/Data\u003e\u003cData Name=\"ProcessName\"\u003eC:\\Windows\\System32\\WindowsPowerShell\\v1.0\\powershell.exe\u003c/Data\u003e\u003c/EventData\u003e","Task":13056,"SubjectUserSid":"S-1-5-21-2199682790-2533951109-4136935257-1001","SubjectUserName":"malware","SubjectDomainName":"FLAREVM","SubjectLogonId":"0x977de","ObjectServer":"Security","ObjectType":"Semaphore","ObjectName":"\\Sessions\\1\\BaseNamedObjects\\SM0:5448:304:WilStaging_02_p0","HandleId":"0x828","AccessMask":"%%1537\r\n\t\t\t\t%%1538\r\n\t\t\t\t%%1539\r\n\t\t\t\t%%1540\r\n\t\t\t\t%%1541\r\n\t\t\t\t%%4528\r\n\t\t\t\t%%4529\r\n\t\t\t\t","PrivilegeList":"SeTakeOwnershipPrivilege","ProcessId":"0x1548","ProcessName":"C:\\Windows\\System32\\WindowsPowerShell\\v1.0\\powershell.exe"},{"EventSourceName":"Microsoft-Windows-Security-Auditing","Provider":"Microsoft-Windows-Security-Auditing","ProviderGuid":"{54849625-5478-4994-a5ba-3e3b0328c30d}","Level":"0","Keywords":"0x8020000000000000","Channel":"Security","Computer":"FlareVM","TimeCreated":"2023-02-28T10:54:52.501Z","TimeGenerated":"2023-02-28T03:54:52.501Z","EventRecordID":"288268","EventID":4674,"Message":"An operation was attempted on a privileged object.\r\n\r\nSubject:\r\n\tSecurity ID:\t\tS-1-5-21-2199682790-2533951109-4136935257-1001\r\n\tAccount Name:\t\tmalware\r\n\tAccount Domain:\t\tFLAREVM\r\n\tLogon ID:\t\t0x977DE\r\n\r\nObject:\r\n\tObject Server:\tSecurity\r\n\tObject Type:\tSemaphore\r\n\tObject Name:\t\\Sessions\\1\\BaseNamedObjects\\SM0:5448:304:WilStaging_02_p0h\r\n\tObject Handle:\t0x834\r\n\r\nProcess Information:\r\n\tProcess ID:\t0x1548\r\n\tProcess Name:\tC:\\Windows\\System32\\WindowsPowerShell\\v1.0\\powershell.exe\r\n\r\nRequested Operation:\r\n\tDesired Access:\tDELETE\r\n\t\t\t\tREAD_CONTROL\r\n\t\t\t\tWRITE_DAC\r\n\t\t\t\tWRITE_OWNER\r\n\t\t\t\tSYNCHRONIZE\r\n\t\t\t\tQuery semaphore state\r\n\t\t\t\tModify semaphore state\r\n\t\t\t\t\r\n\tPrivileges:\t\tSeTakeOwnershipPrivilege","EventData":"\u003cEventData xmlns=\"http://schemas.microsoft.com/win/2004/08/events/event\"\u003e\u003cData Name=\"SubjectUserSid\"\u003eS-1-5-21-2199682790-2533951109-4136935257-1001\u003c/Data\u003e\u003cData Name=\"SubjectUserName\"\u003emalware\u003c/Data\u003e\u003cData Name=\"SubjectDomainName\"\u003eFLAREVM\u003c/Data\u003e\u003cData Name=\"SubjectLogonId\"\u003e0x977de\u003c/Data\u003e\u003cData Name=\"ObjectServer\"\u003eSecurity\u003c/Data\u003e\u003cData Name=\"ObjectType\"\u003eSemaphore\u003c/Data\u003e\u003cData Name=\"ObjectName\"\u003e\\Sessions\\1\\BaseNamedObjects\\SM0:5448:304:WilStaging_02_p0h\u003c/Data\u003e\u003cData Name=\"HandleId\"\u003e0x834\u003c/Data\u003e\u003cData Name=\"AccessMask\"\u003e%%1537\n\t\t\t\t%%1538\n\t\t\t\t%%1539\n\t\t\t\t%%1540\n\t\t\t\t%%1541\n\t\t\t\t%%4528\n\t\t\t\t%%4529\n\t\t\t\t\u003c/Data\u003e\u003cData Name=\"PrivilegeList\"\u003eSeTakeOwnershipPrivilege\u003c/Data\u003e\u003cData Name=\"ProcessId\"\u003e0x1548\u003c/Data\u003e\u003cData Name=\"ProcessName\"\u003eC:\\Windows\\System32\\WindowsPowerShell\\v1.0\\powershell.exe\u003c/Data\u003e\u003c/EventData\u003e","Task":13056,"SubjectUserSid":"S-1-5-21-2199682790-2533951109-4136935257-1001","SubjectUserName":"malware","SubjectDomainName":"FLAREVM","SubjectLogonId":"0x977de","ObjectServer":"Security","ObjectType":"Semaphore","ObjectName":"\\Sessions\\1\\BaseNamedObjects\\SM0:5448:304:WilStaging_02_p0h","HandleId":"0x834","AccessMask":"%%1537\r\n\t\t\t\t%%1538\r\n\t\t\t\t%%1539\r\n\t\t\t\t%%1540\r\n\t\t\t\t%%1541\r\n\t\t\t\t%%4528\r\n\t\t\t\t%%4529\r\n\t\t\t\t","PrivilegeList":"SeTakeOwnershipPrivilege","ProcessId":"0x1548","ProcessName":"C:\\Windows\\System32\\WindowsPowerShell\\v1.0\\powershell.exe"},{"EventSourceName":"Microsoft-Windows-Security-Auditing","Provider":"Microsoft-Windows-Security-Auditing","ProviderGuid":"{54849625-5478-4994-a5ba-3e3b0328c30d}","Level":"0","Keywords":"0x8020000000000000","Channel":"Security","Computer":"FlareVM","TimeCreated":"2023-02-28T10:54:52.681Z","TimeGenerated":"2023-02-28T03:54:52.681Z","EventRecordID":"288269","EventID":4688,"Message":"A new process has been created.\r\n\r\nCreator Subject:\r\n\tSecurity ID:\t\tS-1-5-21-2199682790-2533951109-4136935257-1001\r\n\tAccount Name:\t\tmalware\r\n\tAccount Domain:\t\tFLAREVM\r\n\tLogon ID:\t\t0x977DE\r\n\r\nTarget Subject:\r\n\tSecurity ID:\t\tS-1-0-0\r\n\tAccount Name:\t\t-\r\n\tAccount Domain:\t\t-\r\n\tLogon ID:\t\t0x0\r\n\r\nProcess Information:\r\n\tNew Process ID:\t\t0x618\r\n\tNew Process Name:\tC:\\Windows\\System32\\WindowsPowerShell\\v1.0\\powershell.exe\r\n\tToken Elevation Type:\t%%1937\r\n\tMandatory Label:\t\tS-1-16-12288\r\n\tCreator Process ID:\t0x2340\r\n\tCreator Process Name:\tC:\\Windows\\System32\\WindowsPowerShell\\v1.0\\powershell.exe\r\n\tProcess Command Line:\t\r\n\r\nToken Elevation Type indicates the type of token that was assigned to the new process in accordance with User Account Control policy.\r\n\r\nType 1 is a full token with no privileges removed or groups disabled.  A full token is only used if User Account Control is disabled or if the user is the built-in Administrator account or a service account.\r\n\r\nType 2 is an elevated token with no privileges removed or groups disabled.  An elevated token is used when User Account Control is enabled and the user chooses to start the program using Run as administrator.  An elevated token is also used when an application is configured to always require administrative privilege or to always require maximum privilege, and the user is a member of the Administrators group.\r\n\r\nType 3 is a limited token with administrative privileges removed and administrative groups disabled.  The limited token is used when User Account Control is enabled, the application does not require administrative privilege, and the user does not choose to start the program using Run as administrator.","EventData":"\u003cEventData xmlns=\"http://schemas.microsoft.com/win/2004/08/events/event\"\u003e\u003cData Name=\"SubjectUserSid\"\u003eS-1-5-21-2199682790-2533951109-4136935257-1001\u003c/Data\u003e\u003cData Name=\"SubjectUserName\"\u003emalware\u003c/Data\u003e\u003cData Name=\"SubjectDomainName\"\u003eFLAREVM\u003c/Data\u003e\u003cData Name=\"SubjectLogonId\"\u003e0x977de\u003c/Data\u003e\u003cData Name=\"NewProcessId\"\u003e0x618\u003c/Data\u003e\u003cData Name=\"NewProcessName\"\u003eC:\\Windows\\System32\\WindowsPowerShell\\v1.0\\powershell.exe\u003c/Data\u003e\u003cData Name=\"TokenElevationType\"\u003e%%1937\u003c/Data\u003e\u003cData Name=\"ProcessId\"\u003e0x2340\u003c/Data\u003e\u003cData Name=\"CommandLine\"\u003e\u003c/Data\u003e\u003cData Name=\"TargetUserSid\"\u003eS-1-0-0\u003c/Data\u003e\u003cData Name=\"TargetUserName\"\u003e-\u003c/Data\u003e\u003cData Name=\"TargetDomainName\"\u003e-\u003c/Data\u003e\u003cData Name=\"TargetLogonId\"\u003e0x0\u003c/Data\u003e\u003cData Name=\"ParentProcessName\"\u003eC:\\Windows\\System32\\WindowsPowerShell\\v1.0\\powershell.exe\u003c/Data\u003e\u003cData Name=\"MandatoryLabel\"\u003eS-1-16-12288\u003c/Data\u003e\u003c/EventData\u003e","Task":13312,"SubjectUserSid":"S-1-5-21-2199682790-2533951109-4136935257-1001","SubjectUserName":"malware","SubjectDomainName":"FLAREVM","SubjectLogonId":"0x977de","NewProcessId":"0x618","NewProcessName":"C:\\Windows\\System32\\WindowsPowerShell\\v1.0\\powershell.exe","TokenElevationType":"%%1937","ProcessId":"0x2340","CommandLine":"","TargetUserSid":"S-1-0-0","TargetUserName":"-","TargetDomainName":"-","TargetLogonId":"0x0","ParentProcessName":"C:\\Windows\\System32\\WindowsPowerShell\\v1.0\\powershell.exe","MandatoryLabel":"S-1-16-12288"},{"EventSourceName":"Microsoft-Windows-Security-Auditing","Provider":"Microsoft-Windows-Security-Auditing","ProviderGuid":"{54849625-5478-4994-a5ba-3e3b0328c30d}","Level":"0","Keywords":"0x8020000000000000","Channel":"Security","Computer":"FlareVM","TimeCreated":"2023-02-28T10:54:52.684Z","TimeGenerated":"2023-02-28T03:54:52.684Z","EventRecordID":"288270","EventID":4688,"Message":"A new process has been created.\r\n\r\nCreator Subject:\r\n\tSecurity ID:\t\tS-1-5-21-2199682790-2533951109-4136935257-1001\r\n\tAccount Name:\t\tmalware\r\n\tAccount Domain:\t\tFLAREVM\r\n\tLogon ID:\t\t0x977DE\r\n\r\nTarget Subject:\r\n\tSecurity ID:\t\tS-1-0-0\r\n\tAccount Name:\t\t-\r\n\tAccount Domain:\t\t-\r\n\tLogon ID:\t\t0x0\r\n\r\nProcess Information:\r\n\tNew Process ID:\t\t0x2778\r\n\tNew Process Name:\tC:\\Windows\\System32\\conhost.exe\r\n\tToken Elevation Type:\t%%1937\r\n\tMandatory Label:\t\tS-1-16-12288\r\n\tCreator Process ID:\t0x618\r\n\tCreator Process Name:\tC:\\Windows\\System32\\WindowsPowerShell\\v1.0\\powershell.exe\r\n\tProcess Command Line:\t\r\n\r\nToken Elevation Type indicates the type of token that was assigned to the new process in accordance with User Account Control policy.\r\n\r\nType 1 is a full token with no privileges removed or groups disabled.  A full token is only used if User Account Control is disabled or if the user is the built-in Administrator account or a service account.\r\n\r\nType 2 is an elevated token with no privileges removed or groups disabled.  An elevated token is used when User Account Control is enabled and the user chooses to start the program using Run as administrator.  An elevated token is also used when an application is configured to always require administrative privilege or to always require maximum privilege, and the user is a member of the Administrators group.\r\n\r\nType 3 is a limited token with administrative privileges removed and administrative groups disabled.  The limited token is used when User Account Control is enabled, the application does not require administrative privilege, and the user does not choose to start the program using Run as administrator.","EventData":"\u003cEventData xmlns=\"http://schemas.microsoft.com/win/2004/08/events/event\"\u003e\u003cData Name=\"SubjectUserSid\"\u003eS-1-5-21-2199682790-2533951109-4136935257-1001\u003c/Data\u003e\u003cData Name=\"SubjectUserName\"\u003emalware\u003c/Data\u003e\u003cData Name=\"SubjectDomainName\"\u003eFLAREVM\u003c/Data\u003e\u003cData Name=\"SubjectLogonId\"\u003e0x977de\u003c/Data\u003e\u003cData Name=\"NewProcessId\"\u003e0x2778\u003c/Data\u003e\u003cData Name=\"NewProcessName\"\u003eC:\\Windows\\System32\\conhost.exe\u003c/Data\u003e\u003cData Name=\"TokenElevationType\"\u003e%%1937\u003c/Data\u003e\u003cData Name=\"ProcessId\"\u003e0x618\u003c/Data\u003e\u003cData Name=\"CommandLine\"\u003e\u003c/Data\u003e\u003cData Name=\"TargetUserSid\"\u003eS-1-0-0\u003c/Data\u003e\u003cData Name=\"TargetUserName\"\u003e-\u003c/Data\u003e\u003cData Name=\"TargetDomainName\"\u003e-\u003c/Data\u003e\u003cData Name=\"TargetLogonId\"\u003e0x0\u003c/Data\u003e\u003cData Name=\"ParentProcessName\"\u003eC:\\Windows\\System32\\WindowsPowerShell\\v1.0\\powershell.exe\u003c/Data\u003e\u003cData Name=\"MandatoryLabel\"\u003eS-1-16-12288\u003c/Data\u003e\u003c/EventData\u003e","Task":13312,"SubjectUserSid":"S-1-5-21-2199682790-2533951109-4136935257-1001","SubjectUserName":"malware","SubjectDomainName":"FLAREVM","SubjectLogonId":"0x977de","NewProcessId":"0x2778","NewProcessName":"C:\\Windows\\System32\\conhost.exe","TokenElevationType":"%%1937","ProcessId":"0x618","CommandLine":"","TargetUserSid":"S-1-0-0","TargetUserName":"-","TargetDomainName":"-","TargetLogonId":"0x0","ParentProcessName":"C:\\Windows\\System32\\WindowsPowerShell\\v1.0\\powershell.exe","MandatoryLabel":"S-1-16-12288"},{"EventSourceName":"Microsoft-Windows-Security-Auditing","Provider":"Microsoft-Windows-Security-Auditing","ProviderGuid":"{54849625-5478-4994-a5ba-3e3b0328c30d}","Level":"0","Keywords":"0x8020000000000000","Channel":"Security","Computer":"FlareVM","TimeCreated":"2023-02-28T10:54:52.739Z","TimeGenerated":"2023-02-28T03:54:52.739Z","EventRecordID":"288271","EventID":4688,"Message":"A new process has been created.\r\n\r\nCreator Subject:\r\n\tSecurity ID:\t\tS-1-5-18\r\n\tAccount Name:\t\tFLAREVM$\r\n\tAccount Domain:\t\tWORKGROUP\r\n\tLogon ID:\t\t0x3E7\r\n\r\nTarget Subject:\r\n\tSecurity ID:\t\tS-1-5-21-2199682790-2533951109-4136935257-1001\r\n\tAccount Name:\t\tmalware\r\n\tAccount Domain:\t\tFLAREVM\r\n\tLogon ID:\t\t0x97819\r\n\r\nProcess Information:\r\n\tNew Process ID:\t\t0x598\r\n\tNew Process Name:\tC:\\Windows\\System32\\dllhost.exe\r\n\tToken Elevation Type:\t%%1938\r\n\tMandatory Label:\t\tS-1-16-8192\r\n\tCreator Process ID:\t0x35c\r\n\tCreator Process Name:\tC:\\Windows\\System32\\svchost.exe\r\n\tProcess Command Line:\t\r\n\r\nToken Elevation Type indicates the type of token that was assigned to the new process in accordance with User Account Control policy.\r\n\r\nType 1 is a full token with no privileges removed or groups disabled.  A full token is only used if User Account Control is disabled or if the user is the built-in Administrator account or a service account.\r\n\r\nType 2 is an elevated token with no privileges removed or groups disabled.  An elevated token is used when User Account Control is enabled and the user chooses to start the program using Run as administrator.  An elevated token is also used when an application is configured to always require administrative privilege or to always require maximum privilege, and the user is a member of the Administrators group.\r\n\r\nType 3 is a limited token with administrative privileges removed and administrative groups disabled.  The limited token is used when User Account Control is enabled, the application does not require administrative privilege, and the user does not choose to start the program using Run as administrator.","EventData":"\u003cEventData xmlns=\"http://schemas.microsoft.com/win/2004/08/events/event\"\u003e\u003cData Name=\"SubjectUserSid\"\u003eS-1-5-18\u003c/Data\u003e\u003cData Name=\"SubjectUserName\"\u003eFLAREVM$\u003c/Data\u003e\u003cData Name=\"SubjectDomainName\"\u003eWORKGROUP\u003c/Data\u003e\u003cData Name=\"SubjectLogonId\"\u003e0x3e7\u003c/Data\u003e\u003cData Name=\"NewProcessId\"\u003e0x598\u003c/Data\u003e\u003cData Name=\"NewProcessName\"\u003eC:\\Windows\\System32\\dllhost.exe\u003c/Data\u003e\u003cData Name=\"TokenElevationType\"\u003e%%1938\u003c/Data\u003e\u003cData Name=\"ProcessId\"\u003e0x35c\u003c/Data\u003e\u003cData Name=\"CommandLine\"\u003e\u003c/Data\u003e\u003cData Name=\"TargetUserSid\"\u003eS-1-5-21-2199682790-2533951109-4136935257-1001\u003c/Data\u003e\u003cData Name=\"TargetUserName\"\u003emalware\u003c/Data\u003e\u003cData Name=\"TargetDomainName\"\u003eFLAREVM\u003c/Data\u003e\u003cData Name=\"TargetLogonId\"\u003e0x97819\u003c/Data\u003e\u003cData Name=\"ParentProcessName\"\u003eC:\\Windows\\System32\\svchost.exe\u003c/Data\u003e\u003cData Name=\"MandatoryLabel\"\u003eS-1-16-8192\u003c/Data\u003e\u003c/EventData\u003e","Task":13312,"SubjectUserSid":"S-1-5-18","SubjectUserName":"FLAREVM$","SubjectDomainName":"WORKGROUP","SubjectLogonId":"0x3e7","NewProcessId":"0x598","NewProcessName":"C:\\Windows\\System32\\dllhost.exe","TokenElevationType":"%%1938","ProcessId":"0x35c","CommandLine":"","TargetUserSid":"S-1-5-21-2199682790-2533951109-4136935257-1001","TargetUserName":"malware","TargetDomainName":"FLAREVM","TargetLogonId":"0x97819","ParentProcessName":"C:\\Windows\\System32\\svchost.exe","MandatoryLabel":"S-1-16-8192"},{"EventSourceName":"Microsoft-Windows-Security-Auditing","Provider":"Microsoft-Windows-Security-Auditing","ProviderGuid":"{54849625-5478-4994-a5ba-3e3b0328c30d}","Level":"0","Keywords":"0x8020000000000000","Channel":"Security","Computer":"FlareVM","TimeCreated":"2023-02-28T10:54:53.587Z","TimeGenerated":"2023-02-28T03:54:53.587Z","EventRecordID":"288272","EventID":4674,"Message":"An operation was attempted on a privileged object.\r\n\r\nSubject:\r\n\tSecurity ID:\t\tS-1-5-21-2199682790-2533951109-4136935257-1001\r\n\tAccount Name:\t\tmalware\r\n\tAccount Domain:\t\tFLAREVM\r\n\tLogon ID:\t\t0x977DE\r\n\r\nObject:\r\n\tObject Server:\tSecurity\r\n\tObject Type:\tMutant\r\n\tObject Name:\t\\Sessions\\1\\BaseNamedObjects\\SM0:1560:304:WilStaging_02\r\n\tObject Handle:\t0x860\r\n\r\nProcess Information:\r\n\tProcess ID:\t0x618\r\n\tProcess Name:\tC:\\Windows\\System32\\WindowsPowerShell\\v1.0\\powershell.exe\r\n\r\nRequested Operation:\r\n\tDesired Access:\tDELETE\r\n\t\t\t\tREAD_CONTROL\r\n\t\t\t\tWRITE_DAC\r\n\t\t\t\tWRITE_OWNER\r\n\t\t\t\tSYNCHRONIZE\r\n\t\t\t\tQuery mutant state\r\n\t\t\t\t\r\n\tPrivileges:\t\tSeTakeOwnershipPrivilege","EventData":"\u003cEventData xmlns=\"http://schemas.microsoft.com/win/2004/08/events/event\"\u003e\u003cData Name=\"SubjectUserSid\"\u003eS-1-5-21-2199682790-2533951109-4136935257-1001\u003c/Data\u003e\u003cData Name=\"SubjectUserName\"\u003emalware\u003c/Data\u003e\u003cData Name=\"SubjectDomainName\"\u003eFLAREVM\u003c/Data\u003e\u003cData Name=\"SubjectLogonId\"\u003e0x977de\u003c/Data\u003e\u003cData Name=\"ObjectServer\"\u003eSecurity\u003c/Data\u003e\u003cData Name=\"ObjectType\"\u003eMutant\u003c/Data\u003e\u003cData Name=\"ObjectName\"\u003e\\Sessions\\1\\BaseNamedObjects\\SM0:1560:304:WilStaging_02\u003c/Data\u003e\u003cData Name=\"HandleId\"\u003e0x860\u003c/Data\u003e\u003cData Name=\"AccessMask\"\u003e%%1537\n\t\t\t\t%%1538\n\t\t\t\t%%1539\n\t\t\t\t%%1540\n\t\t\t\t%%1541\n\t\t\t\t%%4448\n\t\t\t\t\u003c/Data\u003e\u003cData Name=\"PrivilegeList\"\u003eSeTakeOwnershipPrivilege\u003c/Data\u003e\u003cData Name=\"ProcessId\"\u003e0x618\u003c/Data\u003e\u003cData Name=\"ProcessName\"\u003eC:\\Windows\\System32\\WindowsPowerShell\\v1.0\\powershell.exe\u003c/Data\u003e\u003c/EventData\u003e","Task":13056,"SubjectUserSid":"S-1-5-21-2199682790-2533951109-4136935257-1001","SubjectUserName":"malware","SubjectDomainName":"FLAREVM","SubjectLogonId":"0x977de","ObjectServer":"Security","ObjectType":"Mutant","ObjectName":"\\Sessions\\1\\BaseNamedObjects\\SM0:1560:304:WilStaging_02","HandleId":"0x860","AccessMask":"%%1537\r\n\t\t\t\t%%1538\r\n\t\t\t\t%%1539\r\n\t\t\t\t%%1540\r\n\t\t\t\t%%1541\r\n\t\t\t\t%%4448\r\n\t\t\t\t","PrivilegeList":"SeTakeOwnershipPrivilege","ProcessId":"0x618","ProcessName":"C:\\Windows\\System32\\WindowsPowerShell\\v1.0\\powershell.exe"},{"EventSourceName":"Microsoft-Windows-Security-Auditing","Provider":"Microsoft-Windows-Security-Auditing","ProviderGuid":"{54849625-5478-4994-a5ba-3e3b0328c30d}","Level":"0","Keywords":"0x8020000000000000","Channel":"Security","Computer":"FlareVM","TimeCreated":"2023-02-28T10:54:53.587Z","TimeGenerated":"2023-02-28T03:54:53.587Z","EventRecordID":"288273","EventID":4674,"Message":"An operation was attempted on a privileged object.\r\n\r\nSubject:\r\n\tSecurity ID:\t\tS-1-5-21-2199682790-2533951109-4136935257-1001\r\n\tAccount Name:\t\tmalware\r\n\tAccount Domain:\t\tFLAREVM\r\n\tLogon ID:\t\t0x977DE\r\n\r\nObject:\r\n\tObject Server:\tSecurity\r\n\tObject Type:\t-\r\n\tObject Name:\t-\r\n\tObject Handle:\t0x860\r\n\r\nProcess Information:\r\n\tProcess ID:\t0x618\r\n\tProcess Name:\tC:\\Windows\\System32\\WindowsPowerShell\\v1.0\\powershell.exe\r\n\r\nRequested Operation:\r\n\tDesired Access:\t2031617\r\n\tPrivileges:\t\tSeTakeOwnershipPrivilege","EventData":"\u003cEventData xmlns=\"http://schemas.microsoft.com/win/2004/08/events/event\"\u003e\u003cData Name=\"SubjectUserSid\"\u003eS-1-5-21-2199682790-2533951109-4136935257-1001\u003c/Data\u003e\u003cData Name=\"SubjectUserName\"\u003emalware\u003c/Data\u003e\u003cData Name=\"SubjectDomainName\"\u003eFLAREVM\u003c/Data\u003e\u003cData Name=\"SubjectLogonId\"\u003e0x977de\u003c/Data\u003e\u003cData Name=\"ObjectServer\"\u003eSecurity\u003c/Data\u003e\u003cData Name=\"ObjectType\"\u003e-\u003c/Data\u003e\u003cData Name=\"ObjectName\"\u003e-\u003c/Data\u003e\u003cData Name=\"HandleId\"\u003e0x860\u003c/Data\u003e\u003cData Name=\"AccessMask\"\u003e2031617\u003c/Data\u003e\u003cData Name=\"PrivilegeList\"\u003eSeTakeOwnershipPrivilege\u003c/Data\u003e\u003cData Name=\"ProcessId\"\u003e0x618\u003c/Data\u003e\u003cData Name=\"ProcessName\"\u003eC:\\Windows\\System32\\WindowsPowerShell\\v1.0\\powershell.exe\u003c/Data\u003e\u003c/EventData\u003e","Task":13056,"SubjectUserSid":"S-1-5-21-2199682790-2533951109-4136935257-1001","SubjectUserName":"malware","SubjectDomainName":"FLAREVM","SubjectLogonId":"0x977de","ObjectServer":"Security","ObjectType":"-","ObjectName":"-","HandleId":"0x860","AccessMask":"2031617","PrivilegeList":"SeTakeOwnershipPrivilege","ProcessId":"0x618","ProcessName":"C:\\Windows\\System32\\WindowsPowerShell\\v1.0\\powershell.exe"},{"EventSourceName":"Microsoft-Windows-Security-Auditing","Provider":"Microsoft-Windows-Security-Auditing","ProviderGuid":"{54849625-5478-4994-a5ba-3e3b0328c30d}","Level":"0","Keywords":"0x8020000000000000","Channel":"Security","Computer":"FlareVM","TimeCreated":"2023-02-28T10:54:53.587Z","TimeGenerated":"2023-02-28T03:54:53.587Z","EventRecordID":"288274","EventID":4674,"Message":"An operation was attempted on a privileged object.\r\n\r\nSubject:\r\n\tSecurity ID:\t\tS-1-5-21-2199682790-2533951109-4136935257-1001\r\n\tAccount Name:\t\tmalware\r\n\tAccount Domain:\t\tFLAREVM\r\n\tLogon ID:\t\t0x977DE\r\n\r\nObject:\r\n\tObject Server:\tSecurity\r\n\tObject Type:\tSemaphore\r\n\tObject Name:\t\\Sessions\\1\\BaseNamedObjects\\SM0:1560:304:WilStaging_02_p0\r\n\tObject Handle:\t0x8c0\r\n\r\nProcess Information:\r\n\tProcess ID:\t0x618\r\n\tProcess Name:\tC:\\Windows\\System32\\WindowsPowerShell\\v1.0\\powershell.exe\r\n\r\nRequested Operation:\r\n\tDesired Access:\tDELETE\r\n\t\t\t\tREAD_CONTROL\r\n\t\t\t\tWRITE_DAC\r\n\t\t\t\tWRITE_OWNER\r\n\t\t\t\tSYNCHRONIZE\r\n\t\t\t\tQuery semaphore state\r\n\t\t\t\tModify semaphore state\r\n\t\t\t\t\r\n\tPrivileges:\t\tSeTakeOwnershipPrivilege","EventData":"\u003cEventData xmlns=\"http://schemas.microsoft.com/win/2004/08/events/event\"\u003e\u003cData Name=\"SubjectUserSid\"\u003eS-1-5-21-2199682790-2533951109-4136935257-1001\u003c/Data\u003e\u003cData Name=\"SubjectUserName\"\u003emalware\u003c/Data\u003e\u003cData Name=\"SubjectDomainName\"\u003eFLAREVM\u003c/Data\u003e\u003cData Name=\"SubjectLogonId\"\u003e0x977de\u003c/Data\u003e\u003cData Name=\"ObjectServer\"\u003eSecurity\u003c/Data\u003e\u003cData Name=\"ObjectType\"\u003eSemaphore\u003c/Data\u003e\u003cData Name=\"ObjectName\"\u003e\\Sessions\\1\\BaseNamedObjects\\SM0:1560:304:WilStaging_02_p0\u003c/Data\u003e\u003cData Name=\"HandleId\"\u003e0x8c0\u003c/Data\u003e\u003cData Name=\"AccessMask\"\u003e%%1537\n\t\t\t\t%%1538\n\t\t\t\t%%1539\n\t\t\t\t%%1540\n\t\t\t\t%%1541\n\t\t\t\t%%4528\n\t\t\t\t%%4529\n\t\t\t\t\u003c/Data\u003e\u003cData Name=\"PrivilegeList\"\u003eSeTakeOwnershipPrivilege\u003c/Data\u003e\u003cData Name=\"ProcessId\"\u003e0x618\u003c/Data\u003e\u003cData Name=\"ProcessName\"\u003eC:\\Windows\\System32\\WindowsPowerShell\\v1.0\\powershell.exe\u003c/Data\u003e\u003c/EventData\u003e","Task":13056,"SubjectUserSid":"S-1-5-21-2199682790-2533951109-4136935257-1001","SubjectUserName":"malware","SubjectDomainName":"FLAREVM","SubjectLogonId":"0x977de","ObjectServer":"Security","ObjectType":"Semaphore","ObjectName":"\\Sessions\\1\\BaseNamedObjects\\SM0:1560:304:WilStaging_02_p0","HandleId":"0x8c0","AccessMask":"%%1537\r\n\t\t\t\t%%1538\r\n\t\t\t\t%%1539\r\n\t\t\t\t%%1540\r\n\t\t\t\t%%1541\r\n\t\t\t\t%%4528\r\n\t\t\t\t%%4529\r\n\t\t\t\t","PrivilegeList":"SeTakeOwnershipPrivilege","ProcessId":"0x618","ProcessName":"C:\\Windows\\System32\\WindowsPowerShell\\v1.0\\powershell.exe"},{"EventSourceName":"Microsoft-Windows-Security-Auditing","Provider":"Microsoft-Windows-Security-Auditing","ProviderGuid":"{54849625-5478-4994-a5ba-3e3b0328c30d}","Level":"0","Keywords":"0x8020000000000000","Channel":"Security","Computer":"FlareVM","TimeCreated":"2023-02-28T10:54:53.587Z","TimeGenerated":"2023-02-28T03:54:53.587Z","EventRecordID":"288275","EventID":4674,"Message":"An operation was attempted on a privileged object.\r\n\r\nSubject:\r\n\tSecurity ID:\t\tS-1-5-21-2199682790-2533951109-4136935257-1001\r\n\tAccount Name:\t\tmalware\r\n\tAccount Domain:\t\tFLAREVM\r\n\tLogon ID:\t\t0x977DE\r\n\r\nObject:\r\n\tObject Server:\tSecurity\r\n\tObject Type:\tSemaphore\r\n\tObject Name:\t\\Sessions\\1\\BaseNamedObjects\\SM0:1560:304:WilStaging_02_p0h\r\n\tObject Handle:\t0x8c8\r\n\r\nProcess Information:\r\n\tProcess ID:\t0x618\r\n\tProcess Name:\tC:\\Windows\\System32\\WindowsPowerShell\\v1.0\\powershell.exe\r\n\r\nRequested Operation:\r\n\tDesired Access:\tDELETE\r\n\t\t\t\tREAD_CONTROL\r\n\t\t\t\tWRITE_DAC\r\n\t\t\t\tWRITE_OWNER\r\n\t\t\t\tSYNCHRONIZE\r\n\t\t\t\tQuery semaphore state\r\n\t\t\t\tModify semaphore state\r\n\t\t\t\t\r\n\tPrivileges:\t\tSeTakeOwnershipPrivilege","EventData":"\u003cEventData xmlns=\"http://schemas.microsoft.com/win/2004/08/events/event\"\u003e\u003cData Name=\"SubjectUserSid\"\u003eS-1-5-21-2199682790-2533951109-4136935257-1001\u003c/Data\u003e\u003cData Name=\"SubjectUserName\"\u003emalware\u003c/Data\u003e\u003cData Name=\"SubjectDomainName\"\u003eFLAREVM\u003c/Data\u003e\u003cData Name=\"SubjectLogonId\"\u003e0x977de\u003c/Data\u003e\u003cData Name=\"ObjectServer\"\u003eSecurity\u003c/Data\u003e\u003cData Name=\"ObjectType\"\u003eSemaphore\u003c/Data\u003e\u003cData Name=\"ObjectName\"\u003e\\Sessions\\1\\BaseNamedObjects\\SM0:1560:304:WilStaging_02_p0h\u003c/Data\u003e\u003cData Name=\"HandleId\"\u003e0x8c8\u003c/Data\u003e\u003cData Name=\"AccessMask\"\u003e%%1537\n\t\t\t\t%%1538\n\t\t\t\t%%1539\n\t\t\t\t%%1540\n\t\t\t\t%%1541\n\t\t\t\t%%4528\n\t\t\t\t%%4529\n\t\t\t\t\u003c/Data\u003e\u003cData Name=\"PrivilegeList\"\u003eSeTakeOwnershipPrivilege\u003c/Data\u003e\u003cData Name=\"ProcessId\"\u003e0x618\u003c/Data\u003e\u003cData Name=\"ProcessName\"\u003eC:\\Windows\\System32\\WindowsPowerShell\\v1.0\\powershell.exe\u003c/Data\u003e\u003c/EventData\u003e","Task":13056,"SubjectUserSid":"S-1-5-21-2199682790-2533951109-4136935257-1001","SubjectUserName":"malware","SubjectDomainName":"FLAREVM","SubjectLogonId":"0x977de","ObjectServer":"Security","ObjectType":"Semaphore","ObjectName":"\\Sessions\\1\\BaseNamedObjects\\SM0:1560:304:WilStaging_02_p0h","HandleId":"0x8c8","AccessMask":"%%1537\r\n\t\t\t\t%%1538\r\n\t\t\t\t%%1539\r\n\t\t\t\t%%1540\r\n\t\t\t\t%%1541\r\n\t\t\t\t%%4528\r\n\t\t\t\t%%4529\r\n\t\t\t\t","PrivilegeList":"SeTakeOwnershipPrivilege","ProcessId":"0x618","ProcessName":"C:\\Windows\\System32\\WindowsPowerShell\\v1.0\\powershell.exe"},{"EventSourceName":"Microsoft-Windows-Security-Auditing","Provider":"Microsoft-Windows-Security-Auditing","ProviderGuid":"{54849625-5478-4994-a5ba-3e3b0328c30d}","Level":"0","Keywords":"0x8020000000000000","Channel":"Security","Computer":"FlareVM","TimeCreated":"2023-02-28T10:54:53.821Z","TimeGenerated":"2023-02-28T03:54:53.821Z","EventRecordID":"288276","EventID":4688,"Message":"A new process has been created.\r\n\r\nCreator Subject:\r\n\tSecurity ID:\t\tS-1-5-21-2199682790-2533951109-4136935257-1001\r\n\tAccount Name:\t\tmalware\r\n\tAccount Domain:\t\tFLAREVM\r\n\tLogon ID:\t\t0x977DE\r\n\r\nTarget Subject:\r\n\tSecurity ID:\t\tS-1-0-0\r\n\tAccount Name:\t\t-\r\n\tAccount Domain:\t\t-\r\n\tLogon ID:\t\t0x0\r\n\r\nProcess Information:\r\n\tNew Process ID:\t\t0x26e8\r\n\tNew Process Name:\t\\Device\\CdRom3\\hello.exe\r\n\tToken Elevation Type:\t%%1937\r\n\tMandatory Label:\t\tS-1-16-12288\r\n\tCreator Process ID:\t0x618\r\n\tCreator Process Name:\tC:\\Windows\\System32\\WindowsPowerShell\\v1.0\\powershell.exe\r\n\tProcess Command Line:\t\r\n\r\nToken Elevation Type indicates the type of token that was assigned to the new process in accordance with User Account Control policy.\r\n\r\nType 1 is a full token with no privileges removed or groups disabled.  A full token is only used if User Account Control is disabled or if the user is the built-in Administrator account or a service account.\r\n\r\nType 2 is an elevated token with no privileges removed or groups disabled.  An elevated token is used when User Account Control is enabled and the user chooses to start the program using Run as administrator.  An elevated token is also used when an application is configured to always require administrative privilege or to always require maximum privilege, and the user is a member of the Administrators group.\r\n\r\nType 3 is a limited token with administrative privileges removed and administrative groups disabled.  The limited token is used when User Account Control is enabled, the application does not require administrative privilege, and the user does not choose to start the program using Run as administrator.","EventData":"\u003cEventData xmlns=\"http://schemas.microsoft.com/win/2004/08/events/event\"\u003e\u003cData Name=\"SubjectUserSid\"\u003eS-1-5-21-2199682790-2533951109-4136935257-1001\u003c/Data\u003e\u003cData Name=\"SubjectUserName\"\u003emalware\u003c/Data\u003e\u003cData Name=\"SubjectDomainName\"\u003eFLAREVM\u003c/Data\u003e\u003cData Name=\"SubjectLogonId\"\u003e0x977de\u003c/Data\u003e\u003cData Name=\"NewProcessId\"\u003e0x26e8\u003c/Data\u003e\u003cData Name=\"NewProcessName\"\u003e\\Device\\CdRom3\\hello.exe\u003c/Data\u003e\u003cData Name=\"TokenElevationType\"\u003e%%1937\u003c/Data\u003e\u003cData Name=\"ProcessId\"\u003e0x618\u003c/Data\u003e\u003cData Name=\"CommandLine\"\u003e\u003c/Data\u003e\u003cData Name=\"TargetUserSid\"\u003eS-1-0-0\u003c/Data\u003e\u003cData Name=\"TargetUserName\"\u003e-\u003c/Data\u003e\u003cData Name=\"TargetDomainName\"\u003e-\u003c/Data\u003e\u003cData Name=\"TargetLogonId\"\u003e0x0\u003c/Data\u003e\u003cData Name=\"ParentProcessName\"\u003eC:\\Windows\\System32\\WindowsPowerShell\\v1.0\\powershell.exe\u003c/Data\u003e\u003cData Name=\"MandatoryLabel\"\u003eS-1-16-12288\u003c/Data\u003e\u003c/EventData\u003e","Task":13312,"SubjectUserSid":"S-1-5-21-2199682790-2533951109-4136935257-1001","SubjectUserName":"malware","SubjectDomainName":"FLAREVM","SubjectLogonId":"0x977de","NewProcessId":"0x26e8","NewProcessName":"\\Device\\CdRom3\\hello.exe","TokenElevationType":"%%1937","ProcessId":"0x618","CommandLine":"","TargetUserSid":"S-1-0-0","TargetUserName":"-","TargetDomainName":"-","TargetLogonId":"0x0","ParentProcessName":"C:\\Windows\\System32\\WindowsPowerShell\\v1.0\\powershell.exe","MandatoryLabel":"S-1-16-12288"},{"EventSourceName":"Microsoft-Windows-Security-Auditing","Provider":"Microsoft-Windows-Security-Auditing","ProviderGuid":"{54849625-5478-4994-a5ba-3e3b0328c30d}","Level":"0","Keywords":"0x8020000000000000","Channel":"Security","Computer":"FlareVM","TimeCreated":"2023-02-28T10:54:53.827Z","TimeGenerated":"2023-02-28T03:54:53.827Z","EventRecordID":"288277","EventID":4688,"Message":"A new process has been created.\r\n\r\nCreator Subject:\r\n\tSecurity ID:\t\tS-1-5-21-2199682790-2533951109-4136935257-1001\r\n\tAccount Name:\t\tmalware\r\n\tAccount Domain:\t\tFLAREVM\r\n\tLogon ID:\t\t0x977DE\r\n\r\nTarget Subject:\r\n\tSecurity ID:\t\tS-1-0-0\r\n\tAccount Name:\t\t-\r\n\tAccount Domain:\t\t-\r\n\tLogon ID:\t\t0x0\r\n\r\nProcess Information:\r\n\tNew Process ID:\t\t0x2a90\r\n\tNew Process Name:\tC:\\Windows\\System32\\conhost.exe\r\n\tToken Elevation Type:\t%%1937\r\n\tMandatory Label:\t\tS-1-16-12288\r\n\tCreator Process ID:\t0x26e8\r\n\tCreator Process Name:\t\\Device\\CdRom3\\hello.exe\r\n\tProcess Command Line:\t\r\n\r\nToken Elevation Type indicates the type of token that was assigned to the new process in accordance with User Account Control policy.\r\n\r\nType 1 is a full token with no privileges removed or groups disabled.  A full token is only used if User Account Control is disabled or if the user is the built-in Administrator account or a service account.\r\n\r\nType 2 is an elevated token with no privileges removed or groups disabled.  An elevated token is used when User Account Control is enabled and the user chooses to start the program using Run as administrator.  An elevated token is also used when an application is configured to always require administrative privilege or to always require maximum privilege, and the user is a member of the Administrators group.\r\n\r\nType 3 is a limited token with administrative privileges removed and administrative groups disabled.  The limited token is used when User Account Control is enabled, the application does not require administrative privilege, and the user does not choose to start the program using Run as administrator.","EventData":"\u003cEventData xmlns=\"http://schemas.microsoft.com/win/2004/08/events/event\"\u003e\u003cData Name=\"SubjectUserSid\"\u003eS-1-5-21-2199682790-2533951109-4136935257-1001\u003c/Data\u003e\u003cData Name=\"SubjectUserName\"\u003emalware\u003c/Data\u003e\u003cData Name=\"SubjectDomainName\"\u003eFLAREVM\u003c/Data\u003e\u003cData Name=\"SubjectLogonId\"\u003e0x977de\u003c/Data\u003e\u003cData Name=\"NewProcessId\"\u003e0x2a90\u003c/Data\u003e\u003cData Name=\"NewProcessName\"\u003eC:\\Windows\\System32\\conhost.exe\u003c/Data\u003e\u003cData Name=\"TokenElevationType\"\u003e%%1937\u003c/Data\u003e\u003cData Name=\"ProcessId\"\u003e0x26e8\u003c/Data\u003e\u003cData Name=\"CommandLine\"\u003e\u003c/Data\u003e\u003cData Name=\"TargetUserSid\"\u003eS-1-0-0\u003c/Data\u003e\u003cData Name=\"TargetUserName\"\u003e-\u003c/Data\u003e\u003cData Name=\"TargetDomainName\"\u003e-\u003c/Data\u003e\u003cData Name=\"TargetLogonId\"\u003e0x0\u003c/Data\u003e\u003cData Name=\"ParentProcessName\"\u003e\\Device\\CdRom3\\hello.exe\u003c/Data\u003e\u003cData Name=\"MandatoryLabel\"\u003eS-1-16-12288\u003c/Data\u003e\u003c/EventData\u003e","Task":13312,"SubjectUserSid":"S-1-5-21-2199682790-2533951109-4136935257-1001","SubjectUserName":"malware","SubjectDomainName":"FLAREVM","SubjectLogonId":"0x977de","NewProcessId":"0x2a90","NewProcessName":"C:\\Windows\\System32\\conhost.exe","TokenElevationType":"%%1937","ProcessId":"0x26e8","CommandLine":"","TargetUserSid":"S-1-0-0","TargetUserName":"-","TargetDomainName":"-","TargetLogonId":"0x0","ParentProcessName":"\\Device\\CdRom3\\hello.exe","MandatoryLabel":"S-1-16-12288"},{"EventSourceName":"Microsoft-Windows-Security-Auditing","Provider":"Microsoft-Windows-Security-Auditing","ProviderGuid":"{54849625-5478-4994-a5ba-3e3b0328c30d}","Level":"0","Keywords":"0x8020000000000000","Channel":"Security","Computer":"FlareVM","TimeCreated":"2023-02-28T10:54:53.936Z","TimeGenerated":"2023-02-28T03:54:53.936Z","EventRecordID":"288278","EventID":4688,"Message":"A new process has been created.\r\n\r\nCreator Subject:\r\n\tSecurity ID:\t\tS-1-5-21-2199682790-2533951109-4136935257-1001\r\n\tAccount Name:\t\tmalware\r\n\tAccount Domain:\t\tFLAREVM\r\n\tLogon ID:\t\t0x977DE\r\n\r\nTarget Subject:\r\n\tSecurity ID:\t\tS-1-0-0\r\n\tAccount Name:\t\t-\r\n\tAccount Domain:\t\t-\r\n\tLogon ID:\t\t0x0\r\n\r\nProcess Information:\r\n\tNew Process ID:\t\t0xf00\r\n\tNew Process Name:\tC:\\Windows\\System32\\WindowsPowerShell\\v1.0\\powershell.exe\r\n\tToken Elevation Type:\t%%1937\r\n\tMandatory Label:\t\tS-1-16-12288\r\n\tCreator Process ID:\t0x2340\r\n\tCreator Process Name:\tC:\\Windows\\System32\\WindowsPowerShell\\v1.0\\powershell.exe\r\n\tProcess Command Line:\t\r\n\r\nToken Elevation Type indicates the type of token that was assigned to the new process in accordance with User Account Control policy.\r\n\r\nType 1 is a full token with no privileges removed or groups disabled.  A full token is only used if User Account Control is disabled or if the user is the built-in Administrator account or a service account.\r\n\r\nType 2 is an elevated token with no privileges removed or groups disabled.  An elevated token is used when User Account Control is enabled and the user chooses to start the program using Run as administrator.  An elevated token is also used when an application is configured to always require administrative privilege or to always require maximum privilege, and the user is a member of the Administrators group.\r\n\r\nType 3 is a limited token with administrative privileges removed and administrative groups disabled.  The limited token is used when User Account Control is enabled, the application does not require administrative privilege, and the user does not choose to start the program using Run as administrator.","EventData":"\u003cEventData xmlns=\"http://schemas.microsoft.com/win/2004/08/events/event\"\u003e\u003cData Name=\"SubjectUserSid\"\u003eS-1-5-21-2199682790-2533951109-4136935257-1001\u003c/Data\u003e\u003cData Name=\"SubjectUserName\"\u003emalware\u003c/Data\u003e\u003cData Name=\"SubjectDomainName\"\u003eFLAREVM\u003c/Data\u003e\u003cData Name=\"SubjectLogonId\"\u003e0x977de\u003c/Data\u003e\u003cData Name=\"NewProcessId\"\u003e0xf00\u003c/Data\u003e\u003cData Name=\"NewProcessName\"\u003eC:\\Windows\\System32\\WindowsPowerShell\\v1.0\\powershell.exe\u003c/Data\u003e\u003cData Name=\"TokenElevationType\"\u003e%%1937\u003c/Data\u003e\u003cData Name=\"ProcessId\"\u003e0x2340\u003c/Data\u003e\u003cData Name=\"CommandLine\"\u003e\u003c/Data\u003e\u003cData Name=\"TargetUserSid\"\u003eS-1-0-0\u003c/Data\u003e\u003cData Name=\"TargetUserName\"\u003e-\u003c/Data\u003e\u003cData Name=\"TargetDomainName\"\u003e-\u003c/Data\u003e\u003cData Name=\"TargetLogonId\"\u003e0x0\u003c/Data\u003e\u003cData Name=\"ParentProcessName\"\u003eC:\\Windows\\System32\\WindowsPowerShell\\v1.0\\powershell.exe\u003c/Data\u003e\u003cData Name=\"MandatoryLabel\"\u003eS-1-16-12288\u003c/Data\u003e\u003c/EventData\u003e","Task":13312,"SubjectUserSid":"S-1-5-21-2199682790-2533951109-4136935257-1001","SubjectUserName":"malware","SubjectDomainName":"FLAREVM","SubjectLogonId":"0x977de","NewProcessId":"0xf00","NewProcessName":"C:\\Windows\\System32\\WindowsPowerShell\\v1.0\\powershell.exe","TokenElevationType":"%%1937","ProcessId":"0x2340","CommandLine":"","TargetUserSid":"S-1-0-0","TargetUserName":"-","TargetDomainName":"-","TargetLogonId":"0x0","ParentProcessName":"C:\\Windows\\System32\\WindowsPowerShell\\v1.0\\powershell.exe","MandatoryLabel":"S-1-16-12288"},{"EventSourceName":"Microsoft-Windows-Security-Auditing","Provider":"Microsoft-Windows-Security-Auditing","ProviderGuid":"{54849625-5478-4994-a5ba-3e3b0328c30d}","Level":"0","Keywords":"0x8020000000000000","Channel":"Security","Computer":"FlareVM","TimeCreated":"2023-02-28T10:54:53.942Z","TimeGenerated":"2023-02-28T03:54:53.942Z","EventRecordID":"288279","EventID":4688,"Message":"A new process has been created.\r\n\r\nCreator Subject:\r\n\tSecurity ID:\t\tS-1-5-21-2199682790-2533951109-4136935257-1001\r\n\tAccount Name:\t\tmalware\r\n\tAccount Domain:\t\tFLAREVM\r\n\tLogon ID:\t\t0x977DE\r\n\r\nTarget Subject:\r\n\tSecurity ID:\t\tS-1-0-0\r\n\tAccount Name:\t\t-\r\n\tAccount Domain:\t\t-\r\n\tLogon ID:\t\t0x0\r\n\r\nProcess Information:\r\n\tNew Process ID:\t\t0x2ad4\r\n\tNew Process Name:\tC:\\Windows\\System32\\conhost.exe\r\n\tToken Elevation Type:\t%%1937\r\n\tMandatory Label:\t\tS-1-16-12288\r\n\tCreator Process ID:\t0xf00\r\n\tCreator Process Name:\tC:\\Windows\\System32\\WindowsPowerShell\\v1.0\\powershell.exe\r\n\tProcess Command Line:\t\r\n\r\nToken Elevation Type indicates the type of token that was assigned to the new process in accordance with User Account Control policy.\r\n\r\nType 1 is a full token with no privileges removed or groups disabled.  A full token is only used if User Account Control is disabled or if the user is the built-in Administrator account or a service account.\r\n\r\nType 2 is an elevated token with no privileges removed or groups disabled.  An elevated token is used when User Account Control is enabled and the user chooses to start the program using Run as administrator.  An elevated token is also used when an application is configured to always require administrative privilege or to always require maximum privilege, and the user is a member of the Administrators group.\r\n\r\nType 3 is a limited token with administrative privileges removed and administrative groups disabled.  The limited token is used when User Account Control is enabled, the application does not require administrative privilege, and the user does not choose to start the program using Run as administrator.","EventData":"\u003cEventData xmlns=\"http://schemas.microsoft.com/win/2004/08/events/event\"\u003e\u003cData Name=\"SubjectUserSid\"\u003eS-1-5-21-2199682790-2533951109-4136935257-1001\u003c/Data\u003e\u003cData Name=\"SubjectUserName\"\u003emalware\u003c/Data\u003e\u003cData Name=\"SubjectDomainName\"\u003eFLAREVM\u003c/Data\u003e\u003cData Name=\"SubjectLogonId\"\u003e0x977de\u003c/Data\u003e\u003cData Name=\"NewProcessId\"\u003e0x2ad4\u003c/Data\u003e\u003cData Name=\"NewProcessName\"\u003eC:\\Windows\\System32\\conhost.exe\u003c/Data\u003e\u003cData Name=\"TokenElevationType\"\u003e%%1937\u003c/Data\u003e\u003cData Name=\"ProcessId\"\u003e0xf00\u003c/Data\u003e\u003cData Name=\"CommandLine\"\u003e\u003c/Data\u003e\u003cData Name=\"TargetUserSid\"\u003eS-1-0-0\u003c/Data\u003e\u003cData Name=\"TargetUserName\"\u003e-\u003c/Data\u003e\u003cData Name=\"TargetDomainName\"\u003e-\u003c/Data\u003e\u003cData Name=\"TargetLogonId\"\u003e0x0\u003c/Data\u003e\u003cData Name=\"ParentProcessName\"\u003eC:\\Windows\\System32\\WindowsPowerShell\\v1.0\\powershell.exe\u003c/Data\u003e\u003cData Name=\"MandatoryLabel\"\u003eS-1-16-12288\u003c/Data\u003e\u003c/EventData\u003e","Task":13312,"SubjectUserSid":"S-1-5-21-2199682790-2533951109-4136935257-1001","SubjectUserName":"malware","SubjectDomainName":"FLAREVM","SubjectLogonId":"0x977de","NewProcessId":"0x2ad4","NewProcessName":"C:\\Windows\\System32\\conhost.exe","TokenElevationType":"%%1937","ProcessId":"0xf00","CommandLine":"","TargetUserSid":"S-1-0-0","TargetUserName":"-","TargetDomainName":"-","TargetLogonId":"0x0","ParentProcessName":"C:\\Windows\\System32\\WindowsPowerShell\\v1.0\\powershell.exe","MandatoryLabel":"S-1-16-12288"},{"EventSourceName":"Microsoft-Windows-Security-Auditing","Provider":"Microsoft-Windows-Security-Auditing","ProviderGuid":"{54849625-5478-4994-a5ba-3e3b0328c30d}","Level":"0","Keywords":"0x8020000000000000","Channel":"Security","Computer":"FlareVM","TimeCreated":"2023-02-28T10:54:54.331Z","TimeGenerated":"2023-02-28T03:54:54.331Z","EventRecordID":"288280","EventID":4688,"Message":"A new process has been created.\r\n\r\nCreator Subject:\r\n\tSecurity ID:\t\tS-1-5-21-2199682790-2533951109-4136935257-1001\r\n\tAccount Name:\t\tmalware\r\n\tAccount Domain:\t\tFLAREVM\r\n\tLogon ID:\t\t0x977DE\r\n\r\nTarget Subject:\r\n\tSecurity ID:\t\tS-1-0-0\r\n\tAccount Name:\t\t-\r\n\tAccount Domain:\t\t-\r\n\tLogon ID:\t\t0x0\r\n\r\nProcess Information:\r\n\tNew Process ID:\t\t0x110c\r\n\tNew Process Name:\tC:\\Windows\\System32\\WindowsPowerShell\\v1.0\\powershell.exe\r\n\tToken Elevation Type:\t%%1937\r\n\tMandatory Label:\t\tS-1-16-12288\r\n\tCreator Process ID:\t0x2340\r\n\tCreator Process Name:\tC:\\Windows\\System32\\WindowsPowerShell\\v1.0\\powershell.exe\r\n\tProcess Command Line:\t\r\n\r\nToken Elevation Type indicates the type of token that was assigned to the new process in accordance with User Account Control policy.\r\n\r\nType 1 is a full token with no privileges removed or groups disabled.  A full token is only used if User Account Control is disabled or if the user is the built-in Administrator account or a service account.\r\n\r\nType 2 is an elevated token with no privileges removed or groups disabled.  An elevated token is used when User Account Control is enabled and the user chooses to start the program using Run as administrator.  An elevated token is also used when an application is configured to always require administrative privilege or to always require maximum privilege, and the user is a member of the Administrators group.\r\n\r\nType 3 is a limited token with administrative privileges removed and administrative groups disabled.  The limited token is used when User Account Control is enabled, the application does not require administrative privilege, and the user does not choose to start the program using Run as administrator.","EventData":"\u003cEventData xmlns=\"http://schemas.microsoft.com/win/2004/08/events/event\"\u003e\u003cData Name=\"SubjectUserSid\"\u003eS-1-5-21-2199682790-2533951109-4136935257-1001\u003c/Data\u003e\u003cData Name=\"SubjectUserName\"\u003emalware\u003c/Data\u003e\u003cData Name=\"SubjectDomainName\"\u003eFLAREVM\u003c/Data\u003e\u003cData Name=\"SubjectLogonId\"\u003e0x977de\u003c/Data\u003e\u003cData Name=\"NewProcessId\"\u003e0x110c\u003c/Data\u003e\u003cData Name=\"NewProcessName\"\u003eC:\\Windows\\System32\\WindowsPowerShell\\v1.0\\powershell.exe\u003c/Data\u003e\u003cData Name=\"TokenElevationType\"\u003e%%1937\u003c/Data\u003e\u003cData Name=\"ProcessId\"\u003e0x2340\u003c/Data\u003e\u003cData Name=\"CommandLine\"\u003e\u003c/Data\u003e\u003cData Name=\"TargetUserSid\"\u003eS-1-0-0\u003c/Data\u003e\u003cData Name=\"TargetUserName\"\u003e-\u003c/Data\u003e\u003cData Name=\"TargetDomainName\"\u003e-\u003c/Data\u003e\u003cData Name=\"TargetLogonId\"\u003e0x0\u003c/Data\u003e\u003cData Name=\"ParentProcessName\"\u003eC:\\Windows\\System32\\WindowsPowerShell\\v1.0\\powershell.exe\u003c/Data\u003e\u003cData Name=\"MandatoryLabel\"\u003eS-1-16-12288\u003c/Data\u003e\u003c/EventData\u003e","Task":13312,"SubjectUserSid":"S-1-5-21-2199682790-2533951109-4136935257-1001","SubjectUserName":"malware","SubjectDomainName":"FLAREVM","SubjectLogonId":"0x977de","NewProcessId":"0x110c","NewProcessName":"C:\\Windows\\System32\\WindowsPowerShell\\v1.0\\powershell.exe","TokenElevationType":"%%1937","ProcessId":"0x2340","CommandLine":"","TargetUserSid":"S-1-0-0","TargetUserName":"-","TargetDomainName":"-","TargetLogonId":"0x0","ParentProcessName":"C:\\Windows\\System32\\WindowsPowerShell\\v1.0\\powershell.exe","MandatoryLabel":"S-1-16-12288"},{"EventSourceName":"Microsoft-Windows-Security-Auditing","Provider":"Microsoft-Windows-Security-Auditing","ProviderGuid":"{54849625-5478-4994-a5ba-3e3b0328c30d}","Level":"0","Keywords":"0x8020000000000000","Channel":"Security","Computer":"FlareVM","TimeCreated":"2023-02-28T10:54:54.334Z","TimeGenerated":"2023-02-28T03:54:54.334Z","EventRecordID":"288281","EventID":4688,"Message":"A new process has been created.\r\n\r\nCreator Subject:\r\n\tSecurity ID:\t\tS-1-5-21-2199682790-2533951109-4136935257-1001\r\n\tAccount Name:\t\tmalware\r\n\tAccount Domain:\t\tFLAREVM\r\n\tLogon ID:\t\t0x977DE\r\n\r\nTarget Subject:\r\n\tSecurity ID:\t\tS-1-0-0\r\n\tAccount Name:\t\t-\r\n\tAccount Domain:\t\t-\r\n\tLogon ID:\t\t0x0\r\n\r\nProcess Information:\r\n\tNew Process ID:\t\t0x29e4\r\n\tNew Process Name:\tC:\\Windows\\System32\\conhost.exe\r\n\tToken Elevation Type:\t%%1937\r\n\tMandatory Label:\t\tS-1-16-12288\r\n\tCreator Process ID:\t0x110c\r\n\tCreator Process Name:\tC:\\Windows\\System32\\WindowsPowerShell\\v1.0\\powershell.exe\r\n\tProcess Command Line:\t\r\n\r\nToken Elevation Type indicates the type of token that was assigned to the new process in accordance with User Account Control policy.\r\n\r\nType 1 is a full token with no privileges removed or groups disabled.  A full token is only used if User Account Control is disabled or if the user is the built-in Administrator account or a service account.\r\n\r\nType 2 is an elevated token with no privileges removed or groups disabled.  An elevated token is used when User Account Control is enabled and the user chooses to start the program using Run as administrator.  An elevated token is also used when an application is configured to always require administrative privilege or to always require maximum privilege, and the user is a member of the Administrators group.\r\n\r\nType 3 is a limited token with administrative privileges removed and administrative groups disabled.  The limited token is used when User Account Control is enabled, the application does not require administrative privilege, and the user does not choose to start the program using Run as administrator.","EventData":"\u003cEventData xmlns=\"http://schemas.microsoft.com/win/2004/08/events/event\"\u003e\u003cData Name=\"SubjectUserSid\"\u003eS-1-5-21-2199682790-2533951109-4136935257-1001\u003c/Data\u003e\u003cData Name=\"SubjectUserName\"\u003emalware\u003c/Data\u003e\u003cData Name=\"SubjectDomainName\"\u003eFLAREVM\u003c/Data\u003e\u003cData Name=\"SubjectLogonId\"\u003e0x977de\u003c/Data\u003e\u003cData Name=\"NewProcessId\"\u003e0x29e4\u003c/Data\u003e\u003cData Name=\"NewProcessName\"\u003eC:\\Windows\\System32\\conhost.exe\u003c/Data\u003e\u003cData Name=\"TokenElevationType\"\u003e%%1937\u003c/Data\u003e\u003cData Name=\"ProcessId\"\u003e0x110c\u003c/Data\u003e\u003cData Name=\"CommandLine\"\u003e\u003c/Data\u003e\u003cData Name=\"TargetUserSid\"\u003eS-1-0-0\u003c/Data\u003e\u003cData Name=\"TargetUserName\"\u003e-\u003c/Data\u003e\u003cData Name=\"TargetDomainName\"\u003e-\u003c/Data\u003e\u003cData Name=\"TargetLogonId\"\u003e0x0\u003c/Data\u003e\u003cData Name=\"ParentProcessName\"\u003eC:\\Windows\\System32\\WindowsPowerShell\\v1.0\\powershell.exe\u003c/Data\u003e\u003cData Name=\"MandatoryLabel\"\u003eS-1-16-12288\u003c/Data\u003e\u003c/EventData\u003e","Task":13312,"SubjectUserSid":"S-1-5-21-2199682790-2533951109-4136935257-1001","SubjectUserName":"malware","SubjectDomainName":"FLAREVM","SubjectLogonId":"0x977de","NewProcessId":"0x29e4","NewProcessName":"C:\\Windows\\System32\\conhost.exe","TokenElevationType":"%%1937","ProcessId":"0x110c","CommandLine":"","TargetUserSid":"S-1-0-0","TargetUserName":"-","TargetDomainName":"-","TargetLogonId":"0x0","ParentProcessName":"C:\\Windows\\System32\\WindowsPowerShell\\v1.0\\powershell.exe","MandatoryLabel":"S-1-16-12288"},{"EventSourceName":"Microsoft-Windows-Security-Auditing","Provider":"Microsoft-Windows-Security-Auditing","ProviderGuid":"{54849625-5478-4994-a5ba-3e3b0328c30d}","Level":"0","Keywords":"0x8020000000000000","Channel":"Security","Computer":"FlareVM","TimeCreated":"2023-02-28T10:54:55.195Z","TimeGenerated":"2023-02-28T03:54:55.195Z","EventRecordID":"288282","EventID":4674,"Message":"An operation was attempted on a privileged object.\r\n\r\nSubject:\r\n\tSecurity ID:\t\tS-1-5-21-2199682790-2533951109-4136935257-1001\r\n\tAccount Name:\t\tmalware\r\n\tAccount Domain:\t\tFLAREVM\r\n\tLogon ID:\t\t0x977DE\r\n\r\nObject:\r\n\tObject Server:\tSecurity\r\n\tObject Type:\tMutant\r\n\tObject Name:\t\\Sessions\\1\\BaseNamedObjects\\SM0:4364:304:WilStaging_02\r\n\tObject Handle:\t0x8d8\r\n\r\nProcess Information:\r\n\tProcess ID:\t0x110c\r\n\tProcess Name:\tC:\\Windows\\System32\\WindowsPowerShell\\v1.0\\powershell.exe\r\n\r\nRequested Operation:\r\n\tDesired Access:\tDELETE\r\n\t\t\t\tREAD_CONTROL\r\n\t\t\t\tWRITE_DAC\r\n\t\t\t\tWRITE_OWNER\r\n\t\t\t\tSYNCHRONIZE\r\n\t\t\t\tQuery mutant state\r\n\t\t\t\t\r\n\tPrivileges:\t\tSeTakeOwnershipPrivilege","EventData":"\u003cEventData xmlns=\"http://schemas.microsoft.com/win/2004/08/events/event\"\u003e\u003cData Name=\"SubjectUserSid\"\u003eS-1-5-21-2199682790-2533951109-4136935257-1001\u003c/Data\u003e\u003cData Name=\"SubjectUserName\"\u003emalware\u003c/Data\u003e\u003cData Name=\"SubjectDomainName\"\u003eFLAREVM\u003c/Data\u003e\u003cData Name=\"SubjectLogonId\"\u003e0x977de\u003c/Data\u003e\u003cData Name=\"ObjectServer\"\u003eSecurity\u003c/Data\u003e\u003cData Name=\"ObjectType\"\u003eMutant\u003c/Data\u003e\u003cData Name=\"ObjectName\"\u003e\\Sessions\\1\\BaseNamedObjects\\SM0:4364:304:WilStaging_02\u003c/Data\u003e\u003cData Name=\"HandleId\"\u003e0x8d8\u003c/Data\u003e\u003cData Name=\"AccessMask\"\u003e%%1537\n\t\t\t\t%%1538\n\t\t\t\t%%1539\n\t\t\t\t%%1540\n\t\t\t\t%%1541\n\t\t\t\t%%4448\n\t\t\t\t\u003c/Data\u003e\u003cData Name=\"PrivilegeList\"\u003eSeTakeOwnershipPrivilege\u003c/Data\u003e\u003cData Name=\"ProcessId\"\u003e0x110c\u003c/Data\u003e\u003cData Name=\"ProcessName\"\u003eC:\\Windows\\System32\\WindowsPowerShell\\v1.0\\powershell.exe\u003c/Data\u003e\u003c/EventData\u003e","Task":13056,"SubjectUserSid":"S-1-5-21-2199682790-2533951109-4136935257-1001","SubjectUserName":"malware","SubjectDomainName":"FLAREVM","SubjectLogonId":"0x977de","ObjectServer":"Security","ObjectType":"Mutant","ObjectName":"\\Sessions\\1\\BaseNamedObjects\\SM0:4364:304:WilStaging_02","HandleId":"0x8d8","AccessMask":"%%1537\r\n\t\t\t\t%%1538\r\n\t\t\t\t%%1539\r\n\t\t\t\t%%1540\r\n\t\t\t\t%%1541\r\n\t\t\t\t%%4448\r\n\t\t\t\t","PrivilegeList":"SeTakeOwnershipPrivilege","ProcessId":"0x110c","ProcessName":"C:\\Windows\\System32\\WindowsPowerShell\\v1.0\\powershell.exe"},{"EventSourceName":"Microsoft-Windows-Security-Auditing","Provider":"Microsoft-Windows-Security-Auditing","ProviderGuid":"{54849625-5478-4994-a5ba-3e3b0328c30d}","Level":"0","Keywords":"0x8020000000000000","Channel":"Security","Computer":"FlareVM","TimeCreated":"2023-02-28T10:54:55.195Z","TimeGenerated":"2023-02-28T03:54:55.195Z","EventRecordID":"288283","EventID":4674,"Message":"An operation was attempted on a privileged object.\r\n\r\nSubject:\r\n\tSecurity ID:\t\tS-1-5-21-2199682790-2533951109-4136935257-1001\r\n\tAccount Name:\t\tmalware\r\n\tAccount Domain:\t\tFLAREVM\r\n\tLogon ID:\t\t0x977DE\r\n\r\nObject:\r\n\tObject Server:\tSecurity\r\n\tObject Type:\t-\r\n\tObject Name:\t-\r\n\tObject Handle:\t0x8d8\r\n\r\nProcess Information:\r\n\tProcess ID:\t0x110c\r\n\tProcess Name:\tC:\\Windows\\System32\\WindowsPowerShell\\v1.0\\powershell.exe\r\n\r\nRequested Operation:\r\n\tDesired Access:\t2031617\r\n\tPrivileges:\t\tSeTakeOwnershipPrivilege","EventData":"\u003cEventData xmlns=\"http://schemas.microsoft.com/win/2004/08/events/event\"\u003e\u003cData Name=\"SubjectUserSid\"\u003eS-1-5-21-2199682790-2533951109-4136935257-1001\u003c/Data\u003e\u003cData Name=\"SubjectUserName\"\u003emalware\u003c/Data\u003e\u003cData Name=\"SubjectDomainName\"\u003eFLAREVM\u003c/Data\u003e\u003cData Name=\"SubjectLogonId\"\u003e0x977de\u003c/Data\u003e\u003cData Name=\"ObjectServer\"\u003eSecurity\u003c/Data\u003e\u003cData Name=\"ObjectType\"\u003e-\u003c/Data\u003e\u003cData Name=\"ObjectName\"\u003e-\u003c/Data\u003e\u003cData Name=\"HandleId\"\u003e0x8d8\u003c/Data\u003e\u003cData Name=\"AccessMask\"\u003e2031617\u003c/Data\u003e\u003cData Name=\"PrivilegeList\"\u003eSeTakeOwnershipPrivilege\u003c/Data\u003e\u003cData Name=\"ProcessId\"\u003e0x110c\u003c/Data\u003e\u003cData Name=\"ProcessName\"\u003eC:\\Windows\\System32\\WindowsPowerShell\\v1.0\\powershell.exe\u003c/Data\u003e\u003c/EventData\u003e","Task":13056,"SubjectUserSid":"S-1-5-21-2199682790-2533951109-4136935257-1001","SubjectUserName":"malware","SubjectDomainName":"FLAREVM","SubjectLogonId":"0x977de","ObjectServer":"Security","ObjectType":"-","ObjectName":"-","HandleId":"0x8d8","AccessMask":"2031617","PrivilegeList":"SeTakeOwnershipPrivilege","ProcessId":"0x110c","ProcessName":"C:\\Windows\\System32\\WindowsPowerShell\\v1.0\\powershell.exe"},{"EventSourceName":"Microsoft-Windows-Security-Auditing","Provider":"Microsoft-Windows-Security-Auditing","ProviderGuid":"{54849625-5478-4994-a5ba-3e3b0328c30d}","Level":"0","Keywords":"0x8020000000000000","Channel":"Security","Computer":"FlareVM","TimeCreated":"2023-02-28T10:54:55.195Z","TimeGenerated":"2023-02-28T03:54:55.195Z","EventRecordID":"288284","EventID":4674,"Message":"An operation was attempted on a privileged object.\r\n\r\nSubject:\r\n\tSecurity ID:\t\tS-1-5-21-2199682790-2533951109-4136935257-1001\r\n\tAccount Name:\t\tmalware\r\n\tAccount Domain:\t\tFLAREVM\r\n\tLogon ID:\t\t0x977DE\r\n\r\nObject:\r\n\tObject Server:\tSecurity\r\n\tObject Type:\tSemaphore\r\n\tObject Name:\t\\Sessions\\1\\BaseNamedObjects\\SM0:4364:304:WilStaging_02_p0\r\n\tObject Handle:\t0x8b4\r\n\r\nProcess Information:\r\n\tProcess ID:\t0x110c\r\n\tProcess Name:\tC:\\Windows\\System32\\WindowsPowerShell\\v1.0\\powershell.exe\r\n\r\nRequested Operation:\r\n\tDesired Access:\tDELETE\r\n\t\t\t\tREAD_CONTROL\r\n\t\t\t\tWRITE_DAC\r\n\t\t\t\tWRITE_OWNER\r\n\t\t\t\tSYNCHRONIZE\r\n\t\t\t\tQuery semaphore state\r\n\t\t\t\tModify semaphore state\r\n\t\t\t\t\r\n\tPrivileges:\t\tSeTakeOwnershipPrivilege","EventData":"\u003cEventData xmlns=\"http://schemas.microsoft.com/win/2004/08/events/event\"\u003e\u003cData Name=\"SubjectUserSid\"\u003eS-1-5-21-2199682790-2533951109-4136935257-1001\u003c/Data\u003e\u003cData Name=\"SubjectUserName\"\u003emalware\u003c/Data\u003e\u003cData Name=\"SubjectDomainName\"\u003eFLAREVM\u003c/Data\u003e\u003cData Name=\"SubjectLogonId\"\u003e0x977de\u003c/Data\u003e\u003cData Name=\"ObjectServer\"\u003eSecurity\u003c/Data\u003e\u003cData Name=\"ObjectType\"\u003eSemaphore\u003c/Data\u003e\u003cData Name=\"ObjectName\"\u003e\\Sessions\\1\\BaseNamedObjects\\SM0:4364:304:WilStaging_02_p0\u003c/Data\u003e\u003cData Name=\"HandleId\"\u003e0x8b4\u003c/Data\u003e\u003cData Name=\"AccessMask\"\u003e%%1537\n\t\t\t\t%%1538\n\t\t\t\t%%1539\n\t\t\t\t%%1540\n\t\t\t\t%%1541\n\t\t\t\t%%4528\n\t\t\t\t%%4529\n\t\t\t\t\u003c/Data\u003e\u003cData Name=\"PrivilegeList\"\u003eSeTakeOwnershipPrivilege\u003c/Data\u003e\u003cData Name=\"ProcessId\"\u003e0x110c\u003c/Data\u003e\u003cData Name=\"ProcessName\"\u003eC:\\Windows\\System32\\WindowsPowerShell\\v1.0\\powershell.exe\u003c/Data\u003e\u003c/EventData\u003e","Task":13056,"SubjectUserSid":"S-1-5-21-2199682790-2533951109-4136935257-1001","SubjectUserName":"malware","SubjectDomainName":"FLAREVM","SubjectLogonId":"0x977de","ObjectServer":"Security","ObjectType":"Semaphore","ObjectName":"\\Sessions\\1\\BaseNamedObjects\\SM0:4364:304:WilStaging_02_p0","HandleId":"0x8b4","AccessMask":"%%1537\r\n\t\t\t\t%%1538\r\n\t\t\t\t%%1539\r\n\t\t\t\t%%1540\r\n\t\t\t\t%%1541\r\n\t\t\t\t%%4528\r\n\t\t\t\t%%4529\r\n\t\t\t\t","PrivilegeList":"SeTakeOwnershipPrivilege","ProcessId":"0x110c","ProcessName":"C:\\Windows\\System32\\WindowsPowerShell\\v1.0\\powershell.exe"},{"EventSourceName":"Microsoft-Windows-Security-Auditing","Provider":"Microsoft-Windows-Security-Auditing","ProviderGuid":"{54849625-5478-4994-a5ba-3e3b0328c30d}","Level":"0","Keywords":"0x8020000000000000","Channel":"Security","Computer":"FlareVM","TimeCreated":"2023-02-28T10:54:55.195Z","TimeGenerated":"2023-02-28T03:54:55.195Z","EventRecordID":"288285","EventID":4674,"Message":"An operation was attempted on a privileged object.\r\n\r\nSubject:\r\n\tSecurity ID:\t\tS-1-5-21-2199682790-2533951109-4136935257-1001\r\n\tAccount Name:\t\tmalware\r\n\tAccount Domain:\t\tFLAREVM\r\n\tLogon ID:\t\t0x977DE\r\n\r\nObject:\r\n\tObject Server:\tSecurity\r\n\tObject Type:\tSemaphore\r\n\tObject Name:\t\\Sessions\\1\\BaseNamedObjects\\SM0:4364:304:WilStaging_02_p0h\r\n\tObject Handle:\t0x8d4\r\n\r\nProcess Information:\r\n\tProcess ID:\t0x110c\r\n\tProcess Name:\tC:\\Windows\\System32\\WindowsPowerShell\\v1.0\\powershell.exe\r\n\r\nRequested Operation:\r\n\tDesired Access:\tDELETE\r\n\t\t\t\tREAD_CONTROL\r\n\t\t\t\tWRITE_DAC\r\n\t\t\t\tWRITE_OWNER\r\n\t\t\t\tSYNCHRONIZE\r\n\t\t\t\tQuery semaphore state\r\n\t\t\t\tModify semaphore state\r\n\t\t\t\t\r\n\tPrivileges:\t\tSeTakeOwnershipPrivilege","EventData":"\u003cEventData xmlns=\"http://schemas.microsoft.com/win/2004/08/events/event\"\u003e\u003cData Name=\"SubjectUserSid\"\u003eS-1-5-21-2199682790-2533951109-4136935257-1001\u003c/Data\u003e\u003cData Name=\"SubjectUserName\"\u003emalware\u003c/Data\u003e\u003cData Name=\"SubjectDomainName\"\u003eFLAREVM\u003c/Data\u003e\u003cData Name=\"SubjectLogonId\"\u003e0x977de\u003c/Data\u003e\u003cData Name=\"ObjectServer\"\u003eSecurity\u003c/Data\u003e\u003cData Name=\"ObjectType\"\u003eSemaphore\u003c/Data\u003e\u003cData Name=\"ObjectName\"\u003e\\Sessions\\1\\BaseNamedObjects\\SM0:4364:304:WilStaging_02_p0h\u003c/Data\u003e\u003cData Name=\"HandleId\"\u003e0x8d4\u003c/Data\u003e\u003cData Name=\"AccessMask\"\u003e%%1537\n\t\t\t\t%%1538\n\t\t\t\t%%1539\n\t\t\t\t%%1540\n\t\t\t\t%%1541\n\t\t\t\t%%4528\n\t\t\t\t%%4529\n\t\t\t\t\u003c/Data\u003e\u003cData Name=\"PrivilegeList\"\u003eSeTakeOwnershipPrivilege\u003c/Data\u003e\u003cData Name=\"ProcessId\"\u003e0x110c\u003c/Data\u003e\u003cData Name=\"ProcessName\"\u003eC:\\Windows\\System32\\WindowsPowerShell\\v1.0\\powershell.exe\u003c/Data\u003e\u003c/EventData\u003e","Task":13056,"SubjectUserSid":"S-1-5-21-2199682790-2533951109-4136935257-1001","SubjectUserName":"malware","SubjectDomainName":"FLAREVM","SubjectLogonId":"0x977de","ObjectServer":"Security","ObjectType":"Semaphore","ObjectName":"\\Sessions\\1\\BaseNamedObjects\\SM0:4364:304:WilStaging_02_p0h","HandleId":"0x8d4","AccessMask":"%%1537\r\n\t\t\t\t%%1538\r\n\t\t\t\t%%1539\r\n\t\t\t\t%%1540\r\n\t\t\t\t%%1541\r\n\t\t\t\t%%4528\r\n\t\t\t\t%%4529\r\n\t\t\t\t","PrivilegeList":"SeTakeOwnershipPrivilege","ProcessId":"0x110c","ProcessName":"C:\\Windows\\System32\\WindowsPowerShell\\v1.0\\powershell.exe"},{"EventSourceName":"Microsoft-Windows-Security-Auditing","Provider":"Microsoft-Windows-Security-Auditing","ProviderGuid":"{54849625-5478-4994-a5ba-3e3b0328c30d}","Level":"0","Keywords":"0x8020000000000000","Channel":"Security","Computer":"FlareVM","TimeCreated":"2023-02-28T10:54:56.126Z","TimeGenerated":"2023-02-28T03:54:56.126Z","EventRecordID":"288286","EventID":4688,"Message":"A new process has been created.\r\n\r\nCreator Subject:\r\n\tSecurity ID:\t\tS-1-5-21-2199682790-2533951109-4136935257-1001\r\n\tAccount Name:\t\tmalware\r\n\tAccount Domain:\t\tFLAREVM\r\n\tLogon ID:\t\t0x97819\r\n\r\nTarget Subject:\r\n\tSecurity ID:\t\tS-1-0-0\r\n\tAccount Name:\t\t-\r\n\tAccount Domain:\t\t-\r\n\tLogon ID:\t\t0x0\r\n\r\nProcess Information:\r\n\tNew Process ID:\t\t0xd38\r\n\tNew Process Name:\tC:\\Windows\\System32\\cmd.exe\r\n\tToken Elevation Type:\t%%1938\r\n\tMandatory Label:\t\tS-1-16-8192\r\n\tCreator Process ID:\t0x1938\r\n\tCreator Process Name:\tC:\\Windows\\explorer.exe\r\n\tProcess Command Line:\t\r\n\r\nToken Elevation Type indicates the type of token that was assigned to the new process in accordance with User Account Control policy.\r\n\r\nType 1 is a full token with no privileges removed or groups disabled.  A full token is only used if User Account Control is disabled or if the user is the built-in Administrator account or a service account.\r\n\r\nType 2 is an elevated token with no privileges removed or groups disabled.  An elevated token is used when User Account Control is enabled and the user chooses to start the program using Run as administrator.  An elevated token is also used when an application is configured to always require administrative privilege or to always require maximum privilege, and the user is a member of the Administrators group.\r\n\r\nType 3 is a limited token with administrative privileges removed and administrative groups disabled.  The limited token is used when User Account Control is enabled, the application does not require administrative privilege, and the user does not choose to start the program using Run as administrator.","EventData":"\u003cEventData xmlns=\"http://schemas.microsoft.com/win/2004/08/events/event\"\u003e\u003cData Name=\"SubjectUserSid\"\u003eS-1-5-21-2199682790-2533951109-4136935257-1001\u003c/Data\u003e\u003cData Name=\"SubjectUserName\"\u003emalware\u003c/Data\u003e\u003cData Name=\"SubjectDomainName\"\u003eFLAREVM\u003c/Data\u003e\u003cData Name=\"SubjectLogonId\"\u003e0x97819\u003c/Data\u003e\u003cData Name=\"NewProcessId\"\u003e0xd38\u003c/Data\u003e\u003cData Name=\"NewProcessName\"\u003eC:\\Windows\\System32\\cmd.exe\u003c/Data\u003e\u003cData Name=\"TokenElevationType\"\u003e%%1938\u003c/Data\u003e\u003cData Name=\"ProcessId\"\u003e0x1938\u003c/Data\u003e\u003cData Name=\"CommandLine\"\u003e\u003c/Data\u003e\u003cData Name=\"TargetUserSid\"\u003eS-1-0-0\u003c/Data\u003e\u003cData Name=\"TargetUserName\"\u003e-\u003c/Data\u003e\u003cData Name=\"TargetDomainName\"\u003e-\u003c/Data\u003e\u003cData Name=\"TargetLogonId\"\u003e0x0\u003c/Data\u003e\u003cData Name=\"ParentProcessName\"\u003eC:\\Windows\\explorer.exe\u003c/Data\u003e\u003cData Name=\"MandatoryLabel\"\u003eS-1-16-8192\u003c/Data\u003e\u003c/EventData\u003e","Task":13312,"SubjectUserSid":"S-1-5-21-2199682790-2533951109-4136935257-1001","SubjectUserName":"malware","SubjectDomainName":"FLAREVM","SubjectLogonId":"0x97819","NewProcessId":"0xd38","NewProcessName":"C:\\Windows\\System32\\cmd.exe","TokenElevationType":"%%1938","ProcessId":"0x1938","CommandLine":"","TargetUserSid":"S-1-0-0","TargetUserName":"-","TargetDomainName":"-","TargetLogonId":"0x0","ParentProcessName":"C:\\Windows\\explorer.exe","MandatoryLabel":"S-1-16-8192"},{"EventSourceName":"Microsoft-Windows-Security-Auditing","Provider":"Microsoft-Windows-Security-Auditing","ProviderGuid":"{54849625-5478-4994-a5ba-3e3b0328c30d}","Level":"0","Keywords":"0x8020000000000000","Channel":"Security","Computer":"FlareVM","TimeCreated":"2023-02-28T10:54:56.129Z","TimeGenerated":"2023-02-28T03:54:56.129Z","EventRecordID":"288287","EventID":4688,"Message":"A new process has been created.\r\n\r\nCreator Subject:\r\n\tSecurity ID:\t\tS-1-5-21-2199682790-2533951109-4136935257-1001\r\n\tAccount Name:\t\tmalware\r\n\tAccount Domain:\t\tFLAREVM\r\n\tLogon ID:\t\t0x97819\r\n\r\nTarget Subject:\r\n\tSecurity ID:\t\tS-1-0-0\r\n\tAccount Name:\t\t-\r\n\tAccount Domain:\t\t-\r\n\tLogon ID:\t\t0x0\r\n\r\nProcess Information:\r\n\tNew Process ID:\t\t0x21dc\r\n\tNew Process Name:\tC:\\Windows\\System32\\conhost.exe\r\n\tToken Elevation Type:\t%%1938\r\n\tMandatory Label:\t\tS-1-16-8192\r\n\tCreator Process ID:\t0xd38\r\n\tCreator Process Name:\tC:\\Windows\\System32\\cmd.exe\r\n\tProcess Command Line:\t\r\n\r\nToken Elevation Type indicates the type of token that was assigned to the new process in accordance with User Account Control policy.\r\n\r\nType 1 is a full token with no privileges removed or groups disabled.  A full token is only used if User Account Control is disabled or if the user is the built-in Administrator account or a service account.\r\n\r\nType 2 is an elevated token with no privileges removed or groups disabled.  An elevated token is used when User Account Control is enabled and the user chooses to start the program using Run as administrator.  An elevated token is also used when an application is configured to always require administrative privilege or to always require maximum privilege, and the user is a member of the Administrators group.\r\n\r\nType 3 is a limited token with administrative privileges removed and administrative groups disabled.  The limited token is used when User Account Control is enabled, the application does not require administrative privilege, and the user does not choose to start the program using Run as administrator.","EventData":"\u003cEventData xmlns=\"http://schemas.microsoft.com/win/2004/08/events/event\"\u003e\u003cData Name=\"SubjectUserSid\"\u003eS-1-5-21-2199682790-2533951109-4136935257-1001\u003c/Data\u003e\u003cData Name=\"SubjectUserName\"\u003emalware\u003c/Data\u003e\u003cData Name=\"SubjectDomainName\"\u003eFLAREVM\u003c/Data\u003e\u003cData Name=\"SubjectLogonId\"\u003e0x97819\u003c/Data\u003e\u003cData Name=\"NewProcessId\"\u003e0x21dc\u003c/Data\u003e\u003cData Name=\"NewProcessName\"\u003eC:\\Windows\\System32\\conhost.exe\u003c/Data\u003e\u003cData Name=\"TokenElevationType\"\u003e%%1938\u003c/Data\u003e\u003cData Name=\"ProcessId\"\u003e0xd38\u003c/Data\u003e\u003cData Name=\"CommandLine\"\u003e\u003c/Data\u003e\u003cData Name=\"TargetUserSid\"\u003eS-1-0-0\u003c/Data\u003e\u003cData Name=\"TargetUserName\"\u003e-\u003c/Data\u003e\u003cData Name=\"TargetDomainName\"\u003e-\u003c/Data\u003e\u003cData Name=\"TargetLogonId\"\u003e0x0\u003c/Data\u003e\u003cData Name=\"ParentProcessName\"\u003eC:\\Windows\\System32\\cmd.exe\u003c/Data\u003e\u003cData Name=\"MandatoryLabel\"\u003eS-1-16-8192\u003c/Data\u003e\u003c/EventData\u003e","Task":13312,"SubjectUserSid":"S-1-5-21-2199682790-2533951109-4136935257-1001","SubjectUserName":"malware","SubjectDomainName":"FLAREVM","SubjectLogonId":"0x97819","NewProcessId":"0x21dc","NewProcessName":"C:\\Windows\\System32\\conhost.exe","TokenElevationType":"%%1938","ProcessId":"0xd38","CommandLine":"","TargetUserSid":"S-1-0-0","TargetUserName":"-","TargetDomainName":"-","TargetLogonId":"0x0","ParentProcessName":"C:\\Windows\\System32\\cmd.exe","MandatoryLabel":"S-1-16-8192"},{"EventSourceName":"Microsoft-Windows-Security-Auditing","Provider":"Microsoft-Windows-Security-Auditing","ProviderGuid":"{54849625-5478-4994-a5ba-3e3b0328c30d}","Level":"0","Keywords":"0x8020000000000000","Channel":"Security","Computer":"FlareVM","TimeCreated":"2023-02-28T10:54:56.200Z","TimeGenerated":"2023-02-28T03:54:56.200Z","EventRecordID":"288288","EventID":4688,"Message":"A new process has been created.\r\n\r\nCreator Subject:\r\n\tSecurity ID:\t\tS-1-5-21-2199682790-2533951109-4136935257-1001\r\n\tAccount Name:\t\tmalware\r\n\tAccount Domain:\t\tFLAREVM\r\n\tLogon ID:\t\t0x97819\r\n\r\nTarget Subject:\r\n\tSecurity ID:\t\tS-1-0-0\r\n\tAccount Name:\t\t-\r\n\tAccount Domain:\t\t-\r\n\tLogon ID:\t\t0x0\r\n\r\nProcess Information:\r\n\tNew Process ID:\t\t0x2388\r\n\tNew Process Name:\tC:\\Windows\\System32\\rundll32.exe\r\n\tToken Elevation Type:\t%%1938\r\n\tMandatory Label:\t\tS-1-16-8192\r\n\tCreator Process ID:\t0xd38\r\n\tCreator Process Name:\tC:\\Windows\\System32\\cmd.exe\r\n\tProcess Command Line:\t\r\n\r\nToken Elevation Type indicates the type of token that was assigned to the new process in accordance with User Account Control policy.\r\n\r\nType 1 is a full token with no privileges removed or groups disabled.  A full token is only used if User Account Control is disabled or if the user is the built-in Administrator account or a service account.\r\n\r\nType 2 is an elevated token with no privileges removed or groups disabled.  An elevated token is used when User Account Control is enabled and the user chooses to start the program using Run as administrator.  An elevated token is also used when an application is configured to always require administrative privilege or to always require maximum privilege, and the user is a member of the Administrators group.\r\n\r\nType 3 is a limited token with administrative privileges removed and administrative groups disabled.  The limited token is used when User Account Control is enabled, the application does not require administrative privilege, and the user does not choose to start the program using Run as administrator.","EventData":"\u003cEventData xmlns=\"http://schemas.microsoft.com/win/2004/08/events/event\"\u003e\u003cData Name=\"SubjectUserSid\"\u003eS-1-5-21-2199682790-2533951109-4136935257-1001\u003c/Data\u003e\u003cData Name=\"SubjectUserName\"\u003emalware\u003c/Data\u003e\u003cData Name=\"SubjectDomainName\"\u003eFLAREVM\u003c/Data\u003e\u003cData Name=\"SubjectLogonId\"\u003e0x97819\u003c/Data\u003e\u003cData Name=\"NewProcessId\"\u003e0x2388\u003c/Data\u003e\u003cData Name=\"NewProcessName\"\u003eC:\\Windows\\System32\\rundll32.exe\u003c/Data\u003e\u003cData Name=\"TokenElevationType\"\u003e%%1938\u003c/Data\u003e\u003cData Name=\"ProcessId\"\u003e0xd38\u003c/Data\u003e\u003cData Name=\"CommandLine\"\u003e\u003c/Data\u003e\u003cData Name=\"TargetUserSid\"\u003eS-1-0-0\u003c/Data\u003e\u003cData Name=\"TargetUserName\"\u003e-\u003c/Data\u003e\u003cData Name=\"TargetDomainName\"\u003e-\u003c/Data\u003e\u003cData Name=\"TargetLogonId\"\u003e0x0\u003c/Data\u003e\u003cData Name=\"ParentProcessName\"\u003eC:\\Windows\\System32\\cmd.exe\u003c/Data\u003e\u003cData Name=\"MandatoryLabel\"\u003eS-1-16-8192\u003c/Data\u003e\u003c/EventData\u003e","Task":13312,"SubjectUserSid":"S-1-5-21-2199682790-2533951109-4136935257-1001","SubjectUserName":"malware","SubjectDomainName":"FLAREVM","SubjectLogonId":"0x97819","NewProcessId":"0x2388","NewProcessName":"C:\\Windows\\System32\\rundll32.exe","TokenElevationType":"%%1938","ProcessId":"0xd38","CommandLine":"","TargetUserSid":"S-1-0-0","TargetUserName":"-","TargetDomainName":"-","TargetLogonId":"0x0","ParentProcessName":"C:\\Windows\\System32\\cmd.exe","MandatoryLabel":"S-1-16-8192"},{"EventSourceName":"Microsoft-Windows-Security-Auditing","Provider":"Microsoft-Windows-Security-Auditing","ProviderGuid":"{54849625-5478-4994-a5ba-3e3b0328c30d}","Level":"0","Keywords":"0x8020000000000000","Channel":"Security","Computer":"FlareVM","TimeCreated":"2023-02-28T10:54:56.279Z","TimeGenerated":"2023-02-28T03:54:56.279Z","EventRecordID":"288289","EventID":4688,"Message":"A new process has been created.\r\n\r\nCreator Subject:\r\n\tSecurity ID:\t\tS-1-5-21-2199682790-2533951109-4136935257-1001\r\n\tAccount Name:\t\tmalware\r\n\tAccount Domain:\t\tFLAREVM\r\n\tLogon ID:\t\t0x97819\r\n\r\nTarget Subject:\r\n\tSecurity ID:\t\tS-1-0-0\r\n\tAccount Name:\t\t-\r\n\tAccount Domain:\t\t-\r\n\tLogon ID:\t\t0x0\r\n\r\nProcess Information:\r\n\tNew Process ID:\t\t0x15b8\r\n\tNew Process Name:\tC:\\Windows\\System32\\calc.exe\r\n\tToken Elevation Type:\t%%1938\r\n\tMandatory Label:\t\tS-1-16-8192\r\n\tCreator Process ID:\t0x2388\r\n\tCreator Process Name:\tC:\\Windows\\System32\\rundll32.exe\r\n\tProcess Command Line:\t\r\n\r\nToken Elevation Type indicates the type of token that was assigned to the new process in accordance with User Account Control policy.\r\n\r\nType 1 is a full token with no privileges removed or groups disabled.  A full token is only used if User Account Control is disabled or if the user is the built-in Administrator account or a service account.\r\n\r\nType 2 is an elevated token with no privileges removed or groups disabled.  An elevated token is used when User Account Control is enabled and the user chooses to start the program using Run as administrator.  An elevated token is also used when an application is configured to always require administrative privilege or to always require maximum privilege, and the user is a member of the Administrators group.\r\n\r\nType 3 is a limited token with administrative privileges removed and administrative groups disabled.  The limited token is used when User Account Control is enabled, the application does not require administrative privilege, and the user does not choose to start the program using Run as administrator.","EventData":"\u003cEventData xmlns=\"http://schemas.microsoft.com/win/2004/08/events/event\"\u003e\u003cData Name=\"SubjectUserSid\"\u003eS-1-5-21-2199682790-2533951109-4136935257-1001\u003c/Data\u003e\u003cData Name=\"SubjectUserName\"\u003emalware\u003c/Data\u003e\u003cData Name=\"SubjectDomainName\"\u003eFLAREVM\u003c/Data\u003e\u003cData Name=\"SubjectLogonId\"\u003e0x97819\u003c/Data\u003e\u003cData Name=\"NewProcessId\"\u003e0x15b8\u003c/Data\u003e\u003cData Name=\"NewProcessName\"\u003eC:\\Windows\\System32\\calc.exe\u003c/Data\u003e\u003cData Name=\"TokenElevationType\"\u003e%%1938\u003c/Data\u003e\u003cData Name=\"ProcessId\"\u003e0x2388\u003c/Data\u003e\u003cData Name=\"CommandLine\"\u003e\u003c/Data\u003e\u003cData Name=\"TargetUserSid\"\u003eS-1-0-0\u003c/Data\u003e\u003cData Name=\"TargetUserName\"\u003e-\u003c/Data\u003e\u003cData Name=\"TargetDomainName\"\u003e-\u003c/Data\u003e\u003cData Name=\"TargetLogonId\"\u003e0x0\u003c/Data\u003e\u003cData Name=\"ParentProcessName\"\u003eC:\\Windows\\System32\\rundll32.exe\u003c/Data\u003e\u003cData Name=\"MandatoryLabel\"\u003eS-1-16-8192\u003c/Data\u003e\u003c/EventData\u003e","Task":13312,"SubjectUserSid":"S-1-5-21-2199682790-2533951109-4136935257-1001","SubjectUserName":"malware","SubjectDomainName":"FLAREVM","SubjectLogonId":"0x97819","NewProcessId":"0x15b8","NewProcessName":"C:\\Windows\\System32\\calc.exe","TokenElevationType":"%%1938","ProcessId":"0x2388","CommandLine":"","TargetUserSid":"S-1-0-0","TargetUserName":"-","TargetDomainName":"-","TargetLogonId":"0x0","ParentProcessName":"C:\\Windows\\System32\\rundll32.exe","MandatoryLabel":"S-1-16-8192"},{"EventSourceName":"Microsoft-Windows-Security-Auditing","Provider":"Microsoft-Windows-Security-Auditing","ProviderGuid":"{54849625-5478-4994-a5ba-3e3b0328c30d}","Level":"0","Keywords":"0x8020000000000000","Channel":"Security","Computer":"FlareVM","TimeCreated":"2023-02-28T10:54:56.432Z","TimeGenerated":"2023-02-28T03:54:56.432Z","EventRecordID":"288290","EventID":4688,"Message":"A new process has been created.\r\n\r\nCreator Subject:\r\n\tSecurity ID:\t\tS-1-5-18\r\n\tAccount Name:\t\tFLAREVM$\r\n\tAccount Domain:\t\tWORKGROUP\r\n\tLogon ID:\t\t0x3E7\r\n\r\nTarget Subject:\r\n\tSecurity ID:\t\tS-1-5-21-2199682790-2533951109-4136935257-1001\r\n\tAccount Name:\t\tmalware\r\n\tAccount Domain:\t\tFLAREVM\r\n\tLogon ID:\t\t0x97819\r\n\r\nProcess Information:\r\n\tNew Process ID:\t\t0x2354\r\n\tNew Process Name:\tC:\\Program Files\\WindowsApps\\Microsoft.WindowsCalculator_11.2210.0.0_x64__8wekyb3d8bbwe\\CalculatorApp.exe\r\n\tToken Elevation Type:\t%%1938\r\n\tMandatory Label:\t\tS-1-16-4096\r\n\tCreator Process ID:\t0x35c\r\n\tCreator Process Name:\tC:\\Windows\\System32\\svchost.exe\r\n\tProcess Command Line:\t\r\n\r\nToken Elevation Type indicates the type of token that was assigned to the new process in accordance with User Account Control policy.\r\n\r\nType 1 is a full token with no privileges removed or groups disabled.  A full token is only used if User Account Control is disabled or if the user is the built-in Administrator account or a service account.\r\n\r\nType 2 is an elevated token with no privileges removed or groups disabled.  An elevated token is used when User Account Control is enabled and the user chooses to start the program using Run as administrator.  An elevated token is also used when an application is configured to always require administrative privilege or to always require maximum privilege, and the user is a member of the Administrators group.\r\n\r\nType 3 is a limited token with administrative privileges removed and administrative groups disabled.  The limited token is used when User Account Control is enabled, the application does not require administrative privilege, and the user does not choose to start the program using Run as administrator.","EventData":"\u003cEventData xmlns=\"http://schemas.microsoft.com/win/2004/08/events/event\"\u003e\u003cData Name=\"SubjectUserSid\"\u003eS-1-5-18\u003c/Data\u003e\u003cData Name=\"SubjectUserName\"\u003eFLAREVM$\u003c/Data\u003e\u003cData Name=\"SubjectDomainName\"\u003eWORKGROUP\u003c/Data\u003e\u003cData Name=\"SubjectLogonId\"\u003e0x3e7\u003c/Data\u003e\u003cData Name=\"NewProcessId\"\u003e0x2354\u003c/Data\u003e\u003cData Name=\"NewProcessName\"\u003eC:\\Program Files\\WindowsApps\\Microsoft.WindowsCalculator_11.2210.0.0_x64__8wekyb3d8bbwe\\CalculatorApp.exe\u003c/Data\u003e\u003cData Name=\"TokenElevationType\"\u003e%%1938\u003c/Data\u003e\u003cData Name=\"ProcessId\"\u003e0x35c\u003c/Data\u003e\u003cData Name=\"CommandLine\"\u003e\u003c/Data\u003e\u003cData Name=\"TargetUserSid\"\u003eS-1-5-21-2199682790-2533951109-4136935257-1001\u003c/Data\u003e\u003cData Name=\"TargetUserName\"\u003emalware\u003c/Data\u003e\u003cData Name=\"TargetDomainName\"\u003eFLAREVM\u003c/Data\u003e\u003cData Name=\"TargetLogonId\"\u003e0x97819\u003c/Data\u003e\u003cData Name=\"ParentProcessName\"\u003eC:\\Windows\\System32\\svchost.exe\u003c/Data\u003e\u003cData Name=\"MandatoryLabel\"\u003eS-1-16-4096\u003c/Data\u003e\u003c/EventData\u003e","Task":13312,"SubjectUserSid":"S-1-5-18","SubjectUserName":"FLAREVM$","SubjectDomainName":"WORKGROUP","SubjectLogonId":"0x3e7","NewProcessId":"0x2354","NewProcessName":"C:\\Program Files\\WindowsApps\\Microsoft.WindowsCalculator_11.2210.0.0_x64__8wekyb3d8bbwe\\CalculatorApp.exe","TokenElevationType":"%%1938","ProcessId":"0x35c","CommandLine":"","TargetUserSid":"S-1-5-21-2199682790-2533951109-4136935257-1001","TargetUserName":"malware","TargetDomainName":"FLAREVM","TargetLogonId":"0x97819","ParentProcessName":"C:\\Windows\\System32\\svchost.exe","MandatoryLabel":"S-1-16-4096"},{"EventSourceName":"Microsoft-Windows-Security-Auditing","Provider":"Microsoft-Windows-Security-Auditing","ProviderGuid":"{54849625-5478-4994-a5ba-3e3b0328c30d}","Level":"0","Keywords":"0x8020000000000000","Channel":"Security","Computer":"FlareVM","TimeCreated":"2023-02-28T10:54:57.165Z","TimeGenerated":"2023-02-28T03:54:57.165Z","EventRecordID":"288291","EventID":4688,"Message":"A new process has been created.\r\n\r\nCreator Subject:\r\n\tSecurity ID:\t\tS-1-5-18\r\n\tAccount Name:\t\tFLAREVM$\r\n\tAccount Domain:\t\tWORKGROUP\r\n\tLogon ID:\t\t0x3E7\r\n\r\nTarget Subject:\r\n\tSecurity ID:\t\tS-1-5-21-2199682790-2533951109-4136935257-1001\r\n\tAccount Name:\t\tmalware\r\n\tAccount Domain:\t\tFLAREVM\r\n\tLogon ID:\t\t0x97819\r\n\r\nProcess Information:\r\n\tNew Process ID:\t\t0x25d0\r\n\tNew Process Name:\tC:\\Windows\\System32\\RuntimeBroker.exe\r\n\tToken Elevation Type:\t%%1938\r\n\tMandatory Label:\t\tS-1-16-8192\r\n\tCreator Process ID:\t0x35c\r\n\tCreator Process Name:\tC:\\Windows\\System32\\svchost.exe\r\n\tProcess Command Line:\t\r\n\r\nToken Elevation Type indicates the type of token that was assigned to the new process in accordance with User Account Control policy.\r\n\r\nType 1 is a full token with no privileges removed or groups disabled.  A full token is only used if User Account Control is disabled or if the user is the built-in Administrator account or a service account.\r\n\r\nType 2 is an elevated token with no privileges removed or groups disabled.  An elevated token is used when User Account Control is enabled and the user chooses to start the program using Run as administrator.  An elevated token is also used when an application is configured to always require administrative privilege or to always require maximum privilege, and the user is a member of the Administrators group.\r\n\r\nType 3 is a limited token with administrative privileges removed and administrative groups disabled.  The limited token is used when User Account Control is enabled, the application does not require administrative privilege, and the user does not choose to start the program using Run as administrator.","EventData":"\u003cEventData xmlns=\"http://schemas.microsoft.com/win/2004/08/events/event\"\u003e\u003cData Name=\"SubjectUserSid\"\u003eS-1-5-18\u003c/Data\u003e\u003cData Name=\"SubjectUserName\"\u003eFLAREVM$\u003c/Data\u003e\u003cData Name=\"SubjectDomainName\"\u003eWORKGROUP\u003c/Data\u003e\u003cData Name=\"SubjectLogonId\"\u003e0x3e7\u003c/Data\u003e\u003cData Name=\"NewProcessId\"\u003e0x25d0\u003c/Data\u003e\u003cData Name=\"NewProcessName\"\u003eC:\\Windows\\System32\\RuntimeBroker.exe\u003c/Data\u003e\u003cData Name=\"TokenElevationType\"\u003e%%1938\u003c/Data\u003e\u003cData Name=\"ProcessId\"\u003e0x35c\u003c/Data\u003e\u003cData Name=\"CommandLine\"\u003e\u003c/Data\u003e\u003cData Name=\"TargetUserSid\"\u003eS-1-5-21-2199682790-2533951109-4136935257-1001\u003c/Data\u003e\u003cData Name=\"TargetUserName\"\u003emalware\u003c/Data\u003e\u003cData Name=\"TargetDomainName\"\u003eFLAREVM\u003c/Data\u003e\u003cData Name=\"TargetLogonId\"\u003e0x97819\u003c/Data\u003e\u003cData Name=\"ParentProcessName\"\u003eC:\\Windows\\System32\\svchost.exe\u003c/Data\u003e\u003cData Name=\"MandatoryLabel\"\u003eS-1-16-8192\u003c/Data\u003e\u003c/EventData\u003e","Task":13312,"SubjectUserSid":"S-1-5-18","SubjectUserName":"FLAREVM$","SubjectDomainName":"WORKGROUP","SubjectLogonId":"0x3e7","NewProcessId":"0x25d0","NewProcessName":"C:\\Windows\\System32\\RuntimeBroker.exe","TokenElevationType":"%%1938","ProcessId":"0x35c","CommandLine":"","TargetUserSid":"S-1-5-21-2199682790-2533951109-4136935257-1001","TargetUserName":"malware","TargetDomainName":"FLAREVM","TargetLogonId":"0x97819","ParentProcessName":"C:\\Windows\\System32\\svchost.exe","MandatoryLabel":"S-1-16-8192"}]
